Book,Chapter,Verse,Ref,Indonesian,Subheading
Zabur,71,7,Zabur 71:7,"Bagi banyak orang aku seperti tanda yang ajaib, tetapi Engkaulah tempat perlindunganku yang kuat.",
Zabur,71,8,Zabur 71:8,"Mulutku penuh dengan puji-pujian kepada-Mu, dengan pemuliaan diri-Mu sepanjang hari.",
Zabur,71,9,Zabur 71:9,"Janganlah membuang aku pada masa tuaku, dan janganlah tinggalkan aku pada waktu kekuatanku habis.",
Zabur,71,10,Zabur 71:10,"Musuh-musuhku membicarakan aku, orang-orang yang mengintai nyawaku berunding bersama-sama.",
Zabur,71,11,Zabur 71:11,"Kata mereka, “Allah telah meninggalkannya! Kejar dan tangkaplah dia karena tidak ada yang akan melepaskannya!”",
Zabur,71,12,Zabur 71:12,"Ya Allah, janganlah jauh dari diriku, ya Tuhanku, tolonglah aku dengan segera!",
Zabur,71,13,Zabur 71:13,Biarlah orang-orang yang melawan aku mendapat malu dan binasa. Biarlah orang-orang yang ingin mencelakakan aku diliputi cela dan aib.,
Zabur,71,14,Zabur 71:14,"Tetapi, aku, aku akan senantiasa berharap, aku akan lebih lagi menaikkan segala puji-pujianku kepada-Mu.",
Zabur,71,15,Zabur 71:15,Mulutku akan bercerita tentang kebenaran-Mu dan tentang keselamatan dari-Mu sepanjang hari sekalipun jumlahnya melebihi yang dapat kuketahui.,
Zabur,71,16,Zabur 71:16,Aku akan datang dan memuji keperkasaan-keperkasaan Allah Taala. Aku akan memasyhurkan kebenaran-Mu saja.,
Zabur,71,17,Zabur 71:17,"Ya Allah, sejak masa mudaku Engkau telah mengajariku, dan sampai sekarang pun aku menyatakan perbuatan-perbuatan-Mu yang ajaib.",
Zabur,71,18,Zabur 71:18,"Bahkan sampai aku tua dan putih rambutku, janganlah meninggalkan aku, ya Allah, supaya aku dapat memberitakan kuasa-Mu kepada generasi ini, serta keperkasaan-Mu kepada semua orang yang akan datang.",
Zabur,71,19,Zabur 71:19,"Kebenaran-Mu, ya Allah, sampai ke langit! Engkau telah melakukan hal-hal yang besar, ya Allah, siapakah yang seperti Engkau?",
Zabur,71,20,Zabur 71:20,"Engkau, yang telah membiarkanku mengalami banyak kesusahan dan malapetaka, Engkau jugalah yang akan menghidupkan aku kembali. Dari kedalaman bumi ini Engkau akan mengangkatku kembali.",
Zabur,71,21,Zabur 71:21,"Engkau akan menambah kebesaranku, dan berpaling menghibur aku.",
Zabur,71,22,Zabur 71:22,"Aku pun hendak memuji Engkau dengan alat musik gambus karena kesetiaan-Mu, ya Tuhanku. Aku hendak melantunkan puji-pujian bagi-Mu dengan kecapi, ya Yang Mahasuci, Tuhan yang disembah bani Israil!",
Zabur,71,23,Zabur 71:23,"Bibirku akan bersorak-sorai ketika aku melantunkan puji-pujian kepada-Mu, demikian pula jiwaku, yang telah Kautebus.",
Zabur,71,24,Zabur 71:24,Lidahku akan menyatakan kebenaran-Mu sepanjang hari karena orang-orang yang ingin mencelakakan aku telah mendapat malu dan menjadi bingung.,
Zabur,72,1,Zabur 72:1,"Dari Sulaiman. Ya Allah, karuniakanlah hukum-hukum-Mu kepada raja, dan kebenaran-Mu kepada putra baginda.",Doa Harapan untuk Raja
Zabur,72,2,Zabur 72:2,"Ia akan mengadili umat-Mu dengan kebenaran, dan yang tertindas dengan keadilan.",
Zabur,72,3,Zabur 72:3,"Gunung-gunung akan menghasilkan kesejahteraan bagi rakyat, dan bukit-bukit pun menghasilkan kebenaran.",
Zabur,72,4,Zabur 72:4,"Ia akan membela perkara orang-orang yang tertindas di antara rakyat, menyelamatkan anak-anak orang melarat, dan menghancurkan para penindas.",
Zabur,72,5,Zabur 72:5,"Mereka akan takut kepada-Mu selagi matahari ada dan selama bulan ada, turun-temurun.",
Zabur,72,6,Zabur 72:6,"Ia akan seperti hujan yang turun ke atas rerumputan yang telah disabit, seperti hujan lebat yang menyirami bumi.",
Zabur,72,7,Zabur 72:7,"Pada zamannya kebenaran akan tumbuh subur, dan sejahtera melimpah hingga bulan tidak ada lagi.",
Zabur,72,8,Zabur 72:8,"Ia akan memerintah dari laut ke laut, dan dari Sungai Efrat sampai ke ujung bumi.",
Zabur,72,9,Zabur 72:9,"Orang-orang yang tinggal di padang gurun akan tunduk di hadapannya, dan musuh-musuhnya menjilat debu tanah.",
Zabur,72,10,Zabur 72:10,Raja-raja dari Tarsis dan dari pulau-pulau akan membawa persembahan kepadanya. Raja-raja dari Syeba dan Seba mengantarkan upeti kepadanya.,
Zabur,72,11,Zabur 72:11,"Semua raja akan sujud menghormatinya, dan segala bangsa menghambakan diri kepadanya.",
Zabur,72,12,Zabur 72:12,"Ia akan melepaskan orang melarat yang berteriak minta tolong, demikian pula orang yang tertindas dan orang yang tidak punya penolong.",
Zabur,72,13,Zabur 72:13,"Ia akan mengasihani orang miskin dan orang melarat, serta menyelamatkan nyawa kaum duafa.",
Zabur,72,14,Zabur 72:14,"Ia akan menebus hidup mereka dari penindasan dan kekerasan, darah mereka berharga di matanya.",
Zabur,72,15,Zabur 72:15,"Hiduplah dia! Kiranya kepadanya dipersembahkan emas dari Syeba! Kiranya ia senantiasa didoakan, dan sepanjang hari orang memohonkan berkah baginya.",
Zabur,72,16,Zabur 72:16,"Kiranya tanaman gandum berlimpah-limpah di negeri, berayun-ayun di puncak pegunungan. Kiranya hasilnya seperti hasil Libanon, dan kiranya penduduk kota bertambah banyak seperti rumput di padang.",
Zabur,72,17,Zabur 72:17,"Kiranya namanya tetap untuk selama-lamanya, kiranya namanya semakin masyhur selama matahari ada. Segala bangsa akan mendapat berkah karenanya, dan mereka akan menyebutnya berbahagia.",
Zabur,72,18,Zabur 72:18,"Segala puji bagi ALLAH, Tuhan kita, yaitu Tuhan yang disembah bani Israil, yang melakukan perbuatan-perbuatan ajaib sendirian!",
Zabur,72,19,Zabur 72:19,"Segala puji bagi nama-Nya yang mulia untuk selama-lamanya! Kiranya seluruh bumi dipenuhi dengan kemuliaan-Nya. Amin, ya amin!",
Zabur,72,20,Zabur 72:20,Sekianlah doa-doa Daud bin Isai.,
Zabur,73,1,Zabur 73:1,"Syair Asaf. Sesungguhnya, Allah itu baik bagi orang Israil, bagi orang-orang yang suci hatinya.",Pergumulan dan Harapan
Zabur,73,2,Zabur 73:2,"Tetapi, aku, hampir terpeleset kakiku, dan nyaris langkahku tergelincir",
Zabur,73,3,Zabur 73:3,karena aku dengki melihat orang yang sombong ketika kulihat kesejahteraan orang fasik.,
Zabur,73,4,Zabur 73:4,"Mereka tidak kesakitan waktu mati, tubuh mereka gemuk.",
Zabur,73,5,Zabur 73:5,"Mereka tidak mengalami kesukaran seperti orang lain, dan mereka tidak kena tulah seperti manusia lain.",
Zabur,73,6,Zabur 73:6,"Itu sebabnya, mereka berkalungkan kecongkakan, mereka memakai pakaian kekerasan.",
Zabur,73,7,Zabur 73:7,"Mata mereka menonjol karena kegemukan, sangkaan-sangkaan hati mereka berlebihan.",
Zabur,73,8,Zabur 73:8,"Mereka mengolok-olok dan mengata-ngatai orang dengan jahatnya, dengan tinggi hati mereka membicarakan pemerasan.",
Zabur,73,9,Zabur 73:9,"Mulut mereka menentang surga, dan lidah mereka merajalela di bumi.",
Zabur,73,10,Zabur 73:10,"Sebab itu, orang-orang berbalik kepada mereka, menghabiskan air mereka yang berlimpah-limpah.",
Zabur,73,11,Zabur 73:11,"Mereka berkata, “Bagaimana mungkin Allah mengetahuinya? Adakah pengetahuan pada Yang Mahatinggi?”",
Zabur,73,12,Zabur 73:12,"Lihat, beginilah orang-orang fasik: selalu hidup sentosa, dan hartanya bertambah-tambah.",
Zabur,73,13,Zabur 73:13,"Sesungguhnya, sia-sia saja aku menjaga hatiku suci, dan membasuh tanganku tanda tak bersalah.",
Zabur,73,14,Zabur 73:14,"Sepanjang hari aku kena tulah, dan setiap pagi aku kena hukuman.",
Zabur,73,15,Zabur 73:15,"Jika aku berkata, “Aku hendak berkata demikian,” maka aku telah berkhianat terhadap generasi anak-anakmu.",
Zabur,73,16,Zabur 73:16,"Tetapi, ketika aku bermaksud mengetahuinya, maka hal itu terlalu susah di mataku",
Zabur,73,17,Zabur 73:17,"sampai aku masuk ke dalam tempat suci Allah, dan memahami kesudahan mereka.",
Zabur,73,18,Zabur 73:18,"Sesungguhnya, Kautempatkan mereka di tempat-tempat yang licin, dan Kaujatuhkan mereka hingga binasa.",
Zabur,73,19,Zabur 73:19,"Betapa mereka binasa dalam sesaat saja, habis sama sekali oleh kengerian.",
Zabur,73,20,Zabur 73:20,"Seperti mimpi pada waktu orang terbangun, ya Rabbi, pada waktu orang terjaga, rupa mereka Kaupandang hina.",
Zabur,73,21,Zabur 73:21,"Ketika hatiku berduka, dan batinku terasa ditusuk-tusuk,",
Zabur,73,22,Zabur 73:22,aku dungu dan tanpa pengertian. Di hadapan-Mu aku seperti binatang.,
Zabur,73,23,Zabur 73:23,"Meskipun demikian, aku senantiasa di dekat-Mu. Engkau memegang tangan kananku.",
Zabur,73,24,Zabur 73:24,"Engkau menuntun aku dengan nasihat-Mu, dan kemudian Engkau menyambut aku dalam kemuliaan.",
Zabur,73,25,Zabur 73:25,"Siapa gerangan ada padaku di surga, selain Engkau? Di bumi ini tidak ada yang kuinginkan, selain Engkau.",
Zabur,73,26,Zabur 73:26,"Jiwa dan ragaku dapat hilang binasa, tetapi Allah adalah kekuatan hatiku dan pusakaku selama-lamanya.",
Zabur,73,27,Zabur 73:27,"Sesungguhnya, orang-orang yang jauh dari-Mu akan binasa. Kaubinasakan semua orang yang berbuat kafir dengan meninggalkan-Mu.",
Zabur,73,28,Zabur 73:28,"Tetapi, bagiku, dekat dengan Allah adalah yang terbaik. Aku telah menjadikan Allah Taala tempat perlindunganku supaya aku dapat menceritakan segala perbuatan-Mu!",
Zabur,74,1,Zabur 74:1,"Nyanyian pengajaran. Asaf. Ya Allah, mengapa Engkau membuang kami untuk selama-lamanya? Mengapa murka-Mu menyala atas domba-domba gembalaan-Mu?",Nyanyian Ratapan karena Bait Suci yang Rusak
Zabur,74,2,Zabur 74:2,"Ingatlah kiranya akan umat-Mu yang telah Kauperoleh pada zaman dahulu, suku yang telah Kautebus menjadi suku milik pusaka-Mu, begitu juga Gunung Sion ini, tempat Engkau bersemayam.",
Zabur,74,3,Zabur 74:3,"Langkahkanlah kaki-Mu ke tempat yang rusak abadi, segala kehancuran telah dibuat musuh di tempat yang suci.",
Zabur,74,4,Zabur 74:4,"Lawan-lawan-Mu mengaum di tempat hadirat-Mu, dan mereka mendirikan panji-panjinya sebagai tanda kemenangan.",
Zabur,74,5,Zabur 74:5,Tampaknya seperti orang yang mengayunkan kapak tinggi-tinggi untuk menebang belukar kayu.,
Zabur,74,6,Zabur 74:6,Semua karya ukiran mereka hantam dengan kapak dan palu.,
Zabur,74,7,Zabur 74:7,"Mereka memusnahkan tempat suci-Mu dengan api sampai rata dengan tanah, dan mereka menajiskan tempat kediaman nama-Mu.",
Zabur,74,8,Zabur 74:8,"Dalam hatinya mereka berkata, “Mari kita tindas mereka semua!” Semua tempat hadirat Allah di negeri ini mereka bakar.",
Zabur,74,9,Zabur 74:9,"Kami tidak melihat lagi tanda-tanda, seorang nabi pun tidak ada lagi, tak seorang pun di antara kami tahu sampai kapan.",
Zabur,74,10,Zabur 74:10,"Ya Allah, sampai kapan lawan akan mencela? Sampai selama-lamanyakah musuh akan menista nama-Mu?",
Zabur,74,11,Zabur 74:11,"Mengapa Engkau menarik kembali tangan-Mu, tangan kanan-Mu? Turun tanganlah, habisilah mereka!",
Zabur,74,12,Zabur 74:12,"Tetapi, Allah adalah Rajaku sejak zaman dahulu. Ia melakukan penyelamatan di bumi.",
Zabur,74,13,Zabur 74:13,Dengan kekuatan-Mu Engkau telah membelah laut. Engkau menghancurkan kepala naga-naga di perairan.,
Zabur,74,14,Zabur 74:14,"Engkau meremukkan kepala-kepala Lewiatan, dan memberikannya menjadi makanan bagi makhluk-makhluk di padang gurun.",
Zabur,74,15,Zabur 74:15,Engkaulah yang membuka mata air dan sungai. Engkau mengeringkan sungai-sungai yang selalu mengalir.,
Zabur,74,16,Zabur 74:16,"Milik-Mulah siang dan milik-Mulah malam, Engkaulah yang menjadikan benda penerang dan matahari.",
Zabur,74,17,Zabur 74:17,"Engkau menetapkan semua batas bumi, Engkau membuat musim panas dan musim dingin.",
Zabur,74,18,Zabur 74:18,"Ingatlah ini: Musuh mencela, ya ALLAH. Bangsa yang kafir menista nama-Mu.",
Zabur,74,19,Zabur 74:19,"Janganlah menyerahkan nyawa tekukur-Mu kepada binatang buas, dan jangan lupakan untuk selamanya nyawa orang-orang-Mu yang tertindas.",
Zabur,74,20,Zabur 74:20,Perhatikanlah perjanjian yang Kaubuat dengan kami karena tempat-tempat gelap di bumi ini penuh dengan sarang orang-orang yang melakukan kekerasan.,
Zabur,74,21,Zabur 74:21,"Jangan biarkan orang tertindas pulang dengan malu, biarlah orang sengsara dan miskin memuji nama-Mu.",
Zabur,74,22,Zabur 74:22,"Ya Allah, bertindaklah kiranya, belalah perkara-Mu. Ingatlah bagaimana orang kafir mencela Engkau sepanjang hari.",
Zabur,74,23,Zabur 74:23,"Jangan lupakan suara lawan-lawan-Mu, kegaduhan orang-orang yang bangkit melawan Engkau, yang makin nyaring.",
Zabur,75,1,Zabur 75:1,"Untuk pemimpin pujian. Syair Asaf untuk lagu: Jangan Musnahkan. (75-2) Kami mengucap syukur kepada-Mu, ya Allah, kami mengucap syukur karena Engkau dekat. Orang menceritakan perbuatan-perbuatan-Mu yang ajaib.","Allah, Hakim Yang Adil"
Zabur,75,2,Zabur 75:2,"(75-3) “Pada waktu yang telah Kutentukan, Aku akan menghakimi dengan adil.",
Zabur,75,3,Zabur 75:3,"(75-4) Pada waktu bumi dan segala isinya hancur, Akulah yang akan meneguhkan tiang-tiangnya. S e l a",
Zabur,75,4,Zabur 75:4,"(75-5) Kepada orang yang sombong Aku berfirman, ‘Jangan sombong,’ dan kepada orang yang fasik, ‘Jangan membanggakan kekuatanmu.",
Zabur,75,5,Zabur 75:5,"(75-6) Jangan membanggakan kekuatanmu melawan surga, atau berbicara dengan bersitegang leher.’”",
Zabur,75,6,Zabur 75:6,(75-7) Peninggian tidak datang dari timur atau dari barat atau pun dari padang belantara.,
Zabur,75,7,Zabur 75:7,"(75-8) Tetapi, Allah adalah Hakim, Dia merendahkan yang satu dan meninggikan yang lain.",
Zabur,75,8,Zabur 75:8,"(75-9) Murka ALLAH seperti cawan di tangan-Nya, berisi anggur yang membuih, penuh campuran bumbu. Ia akan menuangkan isinya. Sungguh, ampasnya akan diminum habis oleh semua orang fasik di bumi.",
Zabur,75,9,Zabur 75:9,"(75-10) Tetapi, aku, sampai selama-lamanya aku hendak memasyhurkan hal ini. Aku hendak melantunkan puji-pujian bagi Tuhan yang dipuja Yakub.",
Zabur,75,10,Zabur 75:10,"(75-11) Aku akan mematahkan segala kekuatan orang fasik, tetapi kekuatan orang benar akan ditambahkan.",
Zabur,76,1,Zabur 76:1,"Untuk pemimpin pujian. Dengan permainan kecapi. Syair Asaf. Nyanyian. (76-2) Allah dikenal di Yuda, nama-Nya besar di Israil.","Allah, Hakim Segala Bangsa"
Zabur,76,2,Zabur 76:2,"(76-3) Tempat kediaman-Nya ada di Salem, dan tempat bersemayam-Nya di Sion.",
Zabur,76,3,Zabur 76:3,"(76-4) Di sanalah Ia mematahkan panah yang berkilat-kilat, juga perisai, pedang, serta peralatan perang. S e l a",
Zabur,76,4,Zabur 76:4,(76-5) Engkau gilang-gemilang! Lebih mulia daripada gunung-gunung yang penuh hewan buruan.,
Zabur,76,5,Zabur 76:5,"(76-6) Orang-orang yang berhati berani telah dijarah, dan mereka tertidur selamanya. Semua orang yang gagah perkasa tidak dapat mengangkat tangannya lagi.",
Zabur,76,6,Zabur 76:6,"(76-7) Ya Tuhan yang disembah Yakub, karena hardik-Mu penunggang kereta dan kuda jatuh pingsan.",
Zabur,76,7,Zabur 76:7,"(76-8) Engkau, Engkau sajalah yang patut ditakuti! Siapakah yang dapat bertahan di hadapan-Mu ketika Engkau murka?",
Zabur,76,8,Zabur 76:8,"(76-9) Dari langit Kauperdengarkan keputusan hukum, bumi pun takut dan terdiam",
Zabur,76,9,Zabur 76:9,(76-10) ketika Allah bangkit untuk mengadili dan menyelamatkan semua orang yang tertindas di bumi. S e l a,
Zabur,76,10,Zabur 76:10,"(76-11) Sesungguhnya, murka-Mu terhadap manusia membuat Engkau dipuji, dan dengan sisa murka itu Engkau mempersenjatai diri.",
Zabur,76,11,Zabur 76:11,"(76-12) Bernazarlah engkau dan bayarlah nazarmu kepada ALLAH, Tuhanmu! Biarlah semua yang ada di sekeliling-Nya membawa persembahan mereka kepada Dia yang patut ditakuti.",
Zabur,76,12,Zabur 76:12,"(76-13) Dialah yang mematahkan semangat para pemimpin, dan Ia ditakuti oleh raja-raja di bumi.",
Zabur,77,1,Zabur 77:1,"Untuk pemimpin pujian. Syair Asaf untuk Yedutun. (77-2) Aku berseru kepada Allah dengan nyaring, kepada Allah dengan nyaring agar Ia mendengarkanku.",Perbuatan Allah di Masa Lampau
Zabur,77,2,Zabur 77:2,"(77-3) Pada hari kesesakanku aku mencari Tuhan. Pada malam hari kutadahkan tanganku tanpa kenal lesu, jiwaku tidak mau dihiburkan.",
Zabur,77,3,Zabur 77:3,"(77-4) Aku mengingat Allah, dan aku mengerang. Aku merenung, dan semangatku letih lesu. S e l a",
Zabur,77,4,Zabur 77:4,(77-5) Engkau membuat mataku tetap terbuka. Aku gelisah dan tak dapat berkata-kata lagi.,
Zabur,77,5,Zabur 77:5,"(77-6) Aku memikirkan zaman dahulu, tahun-tahun yang sudah lama berlalu.",
Zabur,77,6,Zabur 77:6,"(77-7) Aku teringat pada nyanyianku di malam hari, aku merenung di dalam hati, dan ruhku bertanya-tanya.",
Zabur,77,7,Zabur 77:7,(77-8) Masakan Tuhan membuang untuk selama-lamanya? Masakan Ia tidak lagi berkenan?,
Zabur,77,8,Zabur 77:8,(77-9) Telah habis untuk selamanyakah kasih abadi-Nya? Telah berakhirkah janji-Nya turun-temurun?,
Zabur,77,9,Zabur 77:9,(77-10) Apakah Allah sudah lupa untuk berbelaskasihan? Apakah dalam murka-Nya Ia menutup rahmat-Nya? S e l a,
Zabur,77,10,Zabur 77:10,"(77-11) Lalu, aku berkata, “Inilah kesedihanku bahwa kuasa Yang Mahatinggi berpaling dariku.”",
Zabur,77,11,Zabur 77:11,"(77-12) Aku hendak mengingat perbuatan-perbuatan ALLAH. Ya, aku hendak mengenang keajaiban-keajaiban-Mu pada zaman dahulu.",
Zabur,77,12,Zabur 77:12,"(77-13) Aku hendak merenungkan segala pekerjaan-Mu, dan memikirkan perbuatan-perbuatan-Mu.",
Zabur,77,13,Zabur 77:13,"(77-14) Jalan-Mu suci, ya Allah, Tuhan manakah yang besar seperti Allah?",
Zabur,77,14,Zabur 77:14,(77-15) Engkaulah Tuhan yang melakukan keajaiban. Engkau telah menyatakan kuasa-Mu di antara bangsa-bangsa.,
Zabur,77,15,Zabur 77:15,"(77-16) Dengan tangan-Mu Engkau menebus umat-Mu, yaitu bani Yakub dan bani Yusuf. S e l a",
Zabur,77,16,Zabur 77:16,"(77-17) Air melihat Engkau, ya Allah, air melihat Engkau, dan mereka gentar. Ya, samudera pun gemetar.",
Zabur,77,17,Zabur 77:17,"(77-18) Awan mencurahkan air, dan langit pun bergemuruh. Anak-anak panah-Mu sabung-menyabung.",
Zabur,77,18,Zabur 77:18,"(77-19) Bunyi guruh-Mu terdengar dalam angin puyuh, dan kilat menerangi dunia. Bumi pun gempa dan berguncang.",
Zabur,77,19,Zabur 77:19,"(77-20) Jalan-Mu melalui laut, jalur-Mu melalui limpahan air, namun jejak-jejak-Mu tak tampak.",
Zabur,77,20,Zabur 77:20,(77-21) Engkau memimpin umat-Mu seperti kawanan domba dengan perantaraan Musa dan Harun.,
Zabur,78,1,Zabur 78:1,"Nyanyian pengajaran Asaf. Hai bangsaku, dengarlah pengajaranku, pasanglah telingamu bagi perkataan-perkataan mulutku.",Pelajaran dari Sejarah
Zabur,78,2,Zabur 78:2,"Aku hendak membuka mulutku untuk menyampaikan ibarat, aku hendak mengungkapkan hal-hal yang tersembunyi sejak dahulu kala,",
Zabur,78,3,Zabur 78:3,"yaitu hal-hal yang telah kami dengar dan kami ketahui, serta yang telah diceritakan kepada kami oleh nenek moyang kami.",
Zabur,78,4,Zabur 78:4,"Kami tidak akan menyembunyikannya dari anak-anak mereka, tetapi kami akan memasyhurkan kepada generasi yang berikutnya puji-pujian kepada ALLAH, kekuatan-Nya, dan perbuatan-perbuatan ajaib yang telah dilakukan-Nya.",
Zabur,78,5,Zabur 78:5,"Ia menetapkan peringatan di antara bani Yakub, dan memberikan hukum Taurat di antara bani Israil. Ia memerintahkan nenek moyang kita untuk memberitahukannya kepada anak-anak mereka",
Zabur,78,6,Zabur 78:6,"sehingga generasi yang berikutnya mengetahuinya, yaitu anak-anak yang kelak akan lahir. Kemudian, mereka pun akan bangkit dan menceritakannya kepada anak-anak mereka.",
Zabur,78,7,Zabur 78:7,"Dengan demikian, mereka akan menaruh kepercayaan mereka kepada Allah dan tidak melupakan perbuatan-perbuatan Allah, tetapi mematuhi perintah-perintah-Nya.",
Zabur,78,8,Zabur 78:8,"Mereka tidak akan menjadi seperti nenek moyang mereka, yaitu generasi pembangkang dan pemberontak, generasi yang tidak teguh hatinya, dan yang jiwanya tidak setia kepada Allah.",
Zabur,78,9,Zabur 78:9,"Bani Efraim, yang bersenjatakan panah itu, berbalik mundur pada hari peperangan.",
Zabur,78,10,Zabur 78:10,"Mereka tidak memegang teguh perjanjian Allah, dan enggan untuk hidup menurut hukum-Nya.",
Zabur,78,11,Zabur 78:11,Mereka melupakan perbuatan-perbuatan-Nya serta perbuatan-perbuatan ajaib yang telah diperlihatkan-Nya kepada mereka.,
Zabur,78,12,Zabur 78:12,"Di hadapan nenek moyang mereka, Ia melakukan keajaiban, di Tanah Mesir, di Padang Zoan.",
Zabur,78,13,Zabur 78:13,Ia membelah laut dan menyeberangkan mereka. Air dibuat-Nya berdiri seperti suatu bendungan.,
Zabur,78,14,Zabur 78:14,"Pada siang hari Ia menuntun mereka dengan awan, dan sepanjang malam dengan cahaya api.",
Zabur,78,15,Zabur 78:15,"Ia membelah gunung batu di padang belantara, dan memberi mereka minum berlimpah-limpah, seperti dari samudera.",
Zabur,78,16,Zabur 78:16,Ia membuat aliran air keluar dari bukit batu sehingga air mengalir seperti sungai.,
Zabur,78,17,Zabur 78:17,"Tetapi, mereka masih saja berdosa terhadap-Nya dengan mendurhaka terhadap Yang Mahatinggi di tanah gersang.",
Zabur,78,18,Zabur 78:18,Mereka mencobai Allah di dalam hati mereka dengan meminta makanan sesuai dengan nafsu mereka.,
Zabur,78,19,Zabur 78:19,"Mereka berbicara melawan Allah, kata mereka, “Dapatkah Allah menyiapkan hidangan di padang belantara?",
Zabur,78,20,Zabur 78:20,"Benar bahwa gunung batu dipukul-Nya sehingga air terpancar dan anak-anak sungai mengalir, tetapi dapatkah Ia memberikan pula roti? Dapatkah Ia menyediakan daging bagi umat-Nya?”",
Zabur,78,21,Zabur 78:21,"Sebab itu, ketika ALLAH mendengarnya, Ia menjadi murka. Api menyala menimpa bani Yakub, murka pun bangkit melawan Israil",
Zabur,78,22,Zabur 78:22,karena mereka tidak beriman kepada Allah dan tidak percaya pada keselamatan dari-Nya.,
Zabur,78,23,Zabur 78:23,"Namun, Ia memberi perintah kepada awan-awan di atas dan membuka pintu-pintu langit.",
Zabur,78,24,Zabur 78:24,"Ia menghujani mereka dengan manna untuk dimakan, dan mengaruniakan kepada mereka gandum dari surga.",
Zabur,78,25,Zabur 78:25,Manusia makan roti malaikat. Dikirimkan-Nya kepada mereka perbekalan berlimpah-limpah.,
Zabur,78,26,Zabur 78:26,"Ia membuat angin timur berhembus di udara, dan dengan kuasa-Nya dibawa-Nya angin selatan.",
Zabur,78,27,Zabur 78:27,"Ia menghujani mereka dengan daging seperti debu banyaknya, dengan burung bersayap seperti pasir di laut.",
Zabur,78,28,Zabur 78:28,"Dijatuhkan-Nya burung-burung itu di tengah-tengah perkemahan mereka, di sekeliling kediaman mereka.",
Zabur,78,29,Zabur 78:29,"Lalu, makanlah mereka sampai kenyang sekali karena Ia telah mengaruniakan kepada mereka apa yang mereka inginkan.",
Zabur,78,30,Zabur 78:30,"Akan tetapi, sebelum mereka puas dengan keinginan mereka, yaitu sementara makanan ada dalam mulut mereka,",
Zabur,78,31,Zabur 78:31,"murka Allah bangkit melawan mereka. Ia mengambil nyawa orang-orang kuat mereka, dan menewaskan pemuda-pemuda Israil.",
Zabur,78,32,Zabur 78:32,"Meskipun semua itu terjadi, mereka masih saja berdosa, mereka tidak percaya akan perbuatan-perbuatan-Nya yang ajaib.",
Zabur,78,33,Zabur 78:33,"Oleh sebab itu, Ia membuat hari-hari mereka habis dalam kesia-siaan dan tahun-tahun mereka dalam ketakutan.",
Zabur,78,34,Zabur 78:34,"Apabila Ia membinasakan sebagian dari mereka, barulah mereka mencari Dia, mereka berbalik dan mencari Allah dengan sungguh-sungguh.",
Zabur,78,35,Zabur 78:35,"Mereka ingat bahwa Allah adalah gunung batu mereka, dan Allah Yang Mahatinggi adalah Penebus mereka.",
Zabur,78,36,Zabur 78:36,"Tetapi, mereka menipu Dia dengan mulut mereka, dan berbohong kepada-Nya dengan lidah mereka.",
Zabur,78,37,Zabur 78:37,"Hati mereka tidak teguh terhadap-Nya, dan mereka tidak setia kepada perjanjian-Nya.",
Zabur,78,38,Zabur 78:38,"Namun, karena Ia Maha Penyayang, Ia mengampuni kesalahan mereka dan tidak membinasakan mereka. Bahkan kerap kali Ia menahan amarah-Nya, dan tidak mengerahkan seluruh murka-Nya.",
Zabur,78,39,Zabur 78:39,"Ia ingat bahwa mereka hanyalah makhluk fana, seperti angin yang berlalu dan tak kembali lagi.",
Zabur,78,40,Zabur 78:40,"Betapa sering mereka mendurhaka terhadap Dia di padang gurun, dan mendukakan Dia di padang belantara.",
Zabur,78,41,Zabur 78:41,"Berkali-kali mereka mencobai Allah, serta mendukakan hati Yang Mahasuci, Tuhan bani Israil.",
Zabur,78,42,Zabur 78:42,"Mereka tidak mengingat kuasa-Nya, atau hari ketika Ia menebus mereka dari lawan.",
Zabur,78,43,Zabur 78:43,Ia mengadakan tanda-tanda ajaib di Mesir serta mukjizat-mukjizat di Padang Zoan.,
Zabur,78,44,Zabur 78:44,"Ia mengubah sungai-sungai mereka menjadi darah, begitu pula aliran-aliran air mereka sehingga mereka tidak dapat minum.",
Zabur,78,45,Zabur 78:45,"Ia melepaskan lalat pikat ke tengah-tengah mereka yang menghabisi mereka, dan katak-katak yang menghancurkan mereka.",
Zabur,78,46,Zabur 78:46,"Ia memberikan hasil tanah mereka kepada belalang pemusnah, dan hasil jerih lelah mereka kepada belalang besar.",
Zabur,78,47,Zabur 78:47,"Ia mematikan pohon-pohon anggur mereka dengan hujan batu, dan pohon-pohon ara mereka dengan embun beku.",
Zabur,78,48,Zabur 78:48,"Ia membiarkan kawanan binatang mereka ditimpa hujan batu, dan kawanan ternak mereka disambar halilintar.",
Zabur,78,49,Zabur 78:49,"Ia melampiaskan ke atas mereka murka-Nya yang menyala-nyala, kemarahan, kegeraman, dan permusuhan-Nya— sepasukan malaikat pembawa celaka.",
Zabur,78,50,Zabur 78:50,"Ia menyiapkan jalan untuk melampiaskan murka-Nya. Ia tidak menahan jiwa mereka dari maut, melainkan menyerahkan nyawa mereka kepada penyakit sampar,",
Zabur,78,51,Zabur 78:51,"dan menewaskan semua anak sulung di Mesir, permulaan keperkasaan mereka di kemah-kemah bani Ham.",
Zabur,78,52,Zabur 78:52,"Tetapi, umat-Nya sendiri dibawa-Nya keluar seperti domba. Ia menuntun mereka di padang belantara seperti kawanan ternak.",
Zabur,78,53,Zabur 78:53,"Ia memimpin mereka dengan selamat sehingga mereka tidak merasa takut, sedangkan musuh-musuh mereka diliputi laut.",
Zabur,78,54,Zabur 78:54,"Ia menghantarkan mereka sampai ke tanah-Nya yang suci, ke pegunungan ini, yang telah diperoleh-Nya dengan tangan kanan-Nya.",
Zabur,78,55,Zabur 78:55,"Ia menghalau pula bangsa-bangsa dari hadapan mereka, membagi-bagikan tanah pusaka kepada mereka dengan tali pengukur, serta membiarkan suku-suku Israil mendiami kemah-kemah mereka.",
Zabur,78,56,Zabur 78:56,"Akan tetapi, mereka mencobai Allah Yang Mahatinggi dan mendurhaka terhadap-Nya, peringatan-peringatan-Nya tidak mereka pegang teguh.",
Zabur,78,57,Zabur 78:57,"Mereka murtad dan berkhianat seperti nenek moyang mereka, mereka tak dapat diandalkan seperti busur panah yang rusak.",
Zabur,78,58,Zabur 78:58,"Mereka membangkitkan murka-Nya dengan bukit-bukit pengurbanan mereka, dan membuat-Nya gusar dengan patung-patung ukiran mereka.",
