Book,Chapter,Verse,Ref,Indonesian,Subheading
Zabur,1,1,Zabur 1:1,"Berbahagialah orang yang tidak berjalan menurut nasihat orang fasik, yang tidak berdiri di jalan orang berdosa, dan yang tidak duduk di tempat para pencemooh,",Jalan Orang Benar dan Orang Fasik
Zabur,1,2,Zabur 1:2,melainkan yang kesukaannya hukum ALLAH dan yang merenungkan hukum-Nya siang dan malam.,
Zabur,1,3,Zabur 1:3,"Ia seperti pohon yang tertanam di tepi aliran air, yang menghasilkan buahnya pada musimnya, dan yang daunnya tidak layu. Segala sesuatu yang dilakukannya berhasil.",
Zabur,1,4,Zabur 1:4,Tidak demikian orang fasik. Mereka seperti sekam yang diterbangkan angin.,
Zabur,1,5,Zabur 1:5,"Sebab itu, orang fasik tidak akan tahan dalam pengadilan, demikian pula orang berdosa dalam kumpulan orang benar.",
Zabur,1,6,Zabur 1:6,"ALLAH mengenal jalan orang benar, tetapi jalan orang fasik akan binasa.",
Zabur,2,1,Zabur 2:1,"Apa sebabnya bangsa-bangsa gempar, dan suku-suku bangsa merencanakan hal yang sia-sia?",Raja yang Dilantik Allah
Zabur,2,2,Zabur 2:2,"Raja-raja dunia ini bersiap diri, dan penguasa-penguasa bermufakat bersama-sama hendak melawan ALLAH serta raja yang dilantik-Nya. Kata mereka,",
Zabur,2,3,Zabur 2:3,“Mari kita putuskan ikatan-ikatan mereka dan membuang tali-tali mereka dari kita!”,
Zabur,2,4,Zabur 2:4,"Dia yang bertakhta di surga tertawa, Tuhan mengolok-olok mereka.",
Zabur,2,5,Zabur 2:5,"Pada waktu itu Ia akan berfirman kepada mereka dalam murka-Nya dan menggentarkan mereka dalam nyala amarah-Nya,",
Zabur,2,6,Zabur 2:6,"“Aku sudah melantik raja-Ku di Sion, gunung-Ku yang suci itu.”",
Zabur,2,7,Zabur 2:7,"Aku hendak mengumumkan ketetapan ALLAH. Ia telah berfirman kepadaku, “Engkaulah anak-Ku, pada hari ini Aku menjadikan engkau anak-Ku.",
Zabur,2,8,Zabur 2:8,Mintalah kepada-Ku maka Aku akan memberikan bangsa-bangsa menjadi milik pusakamu dan ujung-ujung bumi menjadi kepunyaanmu.,
Zabur,2,9,Zabur 2:9,Engkau akan menghancurkan mereka dengan tongkat besi dan memecahkan mereka seperti bejana tukang periuk.”,
Zabur,2,10,Zabur 2:10,"Oleh sebab itu, hai raja-raja, bertindaklah bijaksana! Terimalah didikan, hai hakim-hakim dunia!",
Zabur,2,11,Zabur 2:11,"Beribadahlah kepada ALLAH dalam ketakwaan, dan dalam kegentaran.",
Zabur,2,12,Zabur 2:12,Sembahlah Dia dengan tulus supaya jangan Ia murka dan kamu binasa di jalan karena murka-Nya dapat cepat sekali menyala. Berbahagialah semua yang berlindung pada-Nya.,
Zabur,3,1,Zabur 3:1,"Syair Daud ketika ia lari dari Absalom, anaknya. (3-2) Ya ALLAH, betapa banyaknya lawanku! Banyak yang bangkit melawan aku!",Nyanyian Pagi Menghadapi Musuh
Zabur,3,2,Zabur 3:2,"(3-3) Banyak yang berkata mengenai aku, “Tak ada pertolongan baginya di dalam Allah.” S e l a",
Zabur,3,3,Zabur 3:3,"(3-4) Tetapi, Engkau, ya ALLAH, perisai di depanku, kemuliaanku, dan yang mengangkat kepalaku.",
Zabur,3,4,Zabur 3:4,"(3-5) Aku berseru kepada ALLAH dengan nyaring, dan dari gunung suci-Nya Ia menjawab aku. S e l a",
Zabur,3,5,Zabur 3:5,"(3-6) Aku berbaring dan tertidur, lalu aku bangun karena ALLAH menopang aku.",
Zabur,3,6,Zabur 3:6,(3-7) Aku tidak takut terhadap puluhan ribu orang yang siap melawan aku dari segala arah.,
Zabur,3,7,Zabur 3:7,"(3-8) Ya ALLAH, bertindaklah kiranya. Ya Tuhanku, selamatkanlah aku. Engkau memukul rahang semua musuhku dan mematahkan gigi orang-orang fasik.",
Zabur,3,8,Zabur 3:8,(3-9) Keselamatan datang dari ALLAH; Berkah-Mu atas umat-Mu! S e l a,
Zabur,4,1,Zabur 4:1,"Untuk pemimpin pujian, dengan permainan kecapi. Syair Daud. (4-2) Ya Allah, yang membenarkan aku, jawablah kiranya aku ketika aku berseru. Engkau telah membuatku lega ketika aku dalam kesesakan. Kasihanilah aku dan dengarkanlah doaku!",Doa Malam Hari
Zabur,4,2,Zabur 4:2,"(4-3) Hai orang-orang, berapa lama lagi kamu mencemari kemuliaanku? Berapa lama lagi kamu menyukai hal yang sia-sia dan mencari kebohongan? S e l a",
Zabur,4,3,Zabur 4:3,"(4-4) Ketahuilah bahwa ALLAH telah mengkhususkan seorang yang saleh bagi diri-Nya, ALLAH akan mendengar ketika aku berseru kepada-Nya.",
Zabur,4,4,Zabur 4:4,"(4-5) Ketika engkau marah, janganlah berbuat dosa! Berkata-katalah dalam hatimu di tempat tidurmu, dan tetaplah berdiam diri. S e l a",
Zabur,4,5,Zabur 4:5,"(4-6) Persembahkanlah kurban sembelihan yang benar, dan percayalah kepada ALLAH.",
Zabur,4,6,Zabur 4:6,"(4-7) Banyak orang berkata, “Siapa akan menunjukkan yang baik kepada kita?” Ya ALLAH, biarlah cahaya wajah-Mu menyinari kami!",
Zabur,4,7,Zabur 4:7,(4-8) Engkau telah memberikan kegembiraan di dalam hatiku lebih daripada kegembiraan mereka ketika gandum dan air anggur berlimpah-limpah.,
Zabur,4,8,Zabur 4:8,"(4-9) Dengan sejahtera aku akan berbaring dan tertidur karena hanya Engkaulah, ya ALLAH, yang membuatku tinggal dengan aman.",
Zabur,5,1,Zabur 5:1,"Untuk pemimpin pujian, dengan permainan suling. Syair Daud. (5-2) Ya ALLAH, dengarkanlah kiranya perkataanku, perhatikanlah keluh-kesahku.",Doa Pagi Hari
Zabur,5,2,Zabur 5:2,"(5-3) Perhatikanlah seruanku meminta tolong, ya Rajaku dan Tuhanku, karena kepada-Mulah aku berdoa.",
Zabur,5,3,Zabur 5:3,"(5-4) Ya ALLAH, pada pagi hari Engkau mendengar seruanku, pada pagi hari aku mengatur persembahan bagi-Mu dan menunggu.",
Zabur,5,4,Zabur 5:4,(5-5) Engkau bukanlah Tuhan yang berkenan akan kefasikan. Orang jahat tidak dapat tinggal di hadirat-Mu.,
Zabur,5,5,Zabur 5:5,(5-6) Orang yang memegahkan diri tidak akan tahan di depan mata-Mu. Engkau membenci semua orang yang berbuat jahat.,
Zabur,5,6,Zabur 5:6,(5-7) Engkau membinasakan orang-orang yang berkata dusta. ALLAH memandang keji para penumpah darah serta penipu.,
Zabur,5,7,Zabur 5:7,"(5-8) Tetapi, aku, karena kasih abadi-Mu yang berlimpah, aku akan masuk ke dalam rumah-Mu, dan sujud menyembah ke arah Bait-Mu yang suci dengan bertakwa kepada-Mu.",
Zabur,5,8,Zabur 5:8,"(5-9) Ya ALLAH, pimpinlah aku dalam kebenaran-Mu oleh karena seteru-seteruku, luruskanlah jalan-Mu di hadapanku.",
Zabur,5,9,Zabur 5:9,"(5-10) Sesungguhnya, perkataan mereka tidak ada yang pasti, batin mereka penuh kehancuran. Kerongkongan mereka seperti kubur yang menganga, lidah mereka merayu-rayu.",
Zabur,5,10,Zabur 5:10,"(5-11) Ya Allah, nyatakanlah mereka bersalah, biarlah mereka jatuh oleh rancangan mereka sendiri! Halaulah mereka karena pelanggaran mereka banyak, sebab mereka telah mendurhaka terhadap-Mu.",
Zabur,5,11,Zabur 5:11,"(5-12) Tetapi, hendaklah semua orang yang berlindung pada-Mu bersukacita, dan biarlah mereka selalu bersorak-sorai! Naungilah mereka supaya orang-orang yang mengasihi nama-Mu dapat bersukaria karena Engkau.",
Zabur,5,12,Zabur 5:12,"(5-13) Engkau memberkahi orang benar, ya ALLAH, Engkau melindungi mereka dengan keridaan-Mu, seperti perisai.",
Zabur,6,1,Zabur 6:1,"Untuk pemimpin pujian, dengan permainan kecapi. Menurut lagu: Yang Kedelapan. Syair Daud. (6-2) Ya ALLAH, janganlah kiranya Kautegur aku dalam amarah-Mu, dan jangan hukum aku dalam murka-Mu.",Doa dalam Pergumulan
Zabur,6,2,Zabur 6:2,"(6-3) Kasihanilah aku, ya ALLAH, karena aku lemah. Sembuhkanlah aku, ya ALLAH, karena tulang-tulangku gemetar.",
Zabur,6,3,Zabur 6:3,"(6-4) Jiwaku pun sangat gentar. Ya ALLAH, berapa lama lagi?",
Zabur,6,4,Zabur 6:4,"(6-5) Ya ALLAH, kembalilah kiranya. Lepaskanlah jiwaku! Selamatkanlah aku karena kasih abadi-Mu.",
Zabur,6,5,Zabur 6:5,"(6-6) Dalam kematian tidak ada lagi kenangan akan Engkau, dan dalam alam kubur, siapakah yang akan mengucap syukur kepada-Mu?",
Zabur,6,6,Zabur 6:6,"(6-7) Aku penat dalam keluh-kesahku. Sepanjang malam kugenangi tempat tidurku dengan air mata, dan kubasahi alas tidurku.",
Zabur,6,7,Zabur 6:7,"(6-8) Mataku cekung karena dukacita, dan menjadi rabun karena semua lawanku.",
Zabur,6,8,Zabur 6:8,"(6-9) Menjauhlah dari diriku, hai semua yang berbuat jahat, karena ALLAH telah mendengar suara tangisku.",
Zabur,6,9,Zabur 6:9,"(6-10) ALLAH telah mendengar permintaanku, ALLAH menerima doaku.",
Zabur,6,10,Zabur 6:10,"(6-11) Semua musuhku akan mendapat malu dan sangat terkejut, mereka akan mundur dan mendapat malu dalam sekejap.",
Zabur,7,1,Zabur 7:1,"(7-1) Nyanyian ratapan Daud, yang dinyanyikan untuk ALLAH karena Kus, orang Benyamin itu. (7-2) Ya ALLAH, ya Tuhanku, pada-Mulah aku berlindung. Selamatkanlah aku dari semua orang yang mengejar aku, dan lepaskanlah aku","Allah, Hakim Yang Adil"
Zabur,7,2,Zabur 7:2,(7-3) supaya jangan mereka mencabik aku seperti singa dan mengoyak-ngoyak diriku sementara tidak ada penolong.,
Zabur,7,3,Zabur 7:3,"(7-4) Ya ALLAH, ya Tuhanku, jika aku melakukan ini: Jika ada kezaliman dalam tanganku,",
Zabur,7,4,Zabur 7:4,"(7-5) jika aku berbuat jahat terhadap orang yang hidup damai denganku, atau merampasi lawanku tanpa alasan,",
Zabur,7,5,Zabur 7:5,"(7-6) biarlah musuhku mengejar dan menangkap aku, menginjak-injak hidupku sampai ke tanah, dan meletakkan kemuliaanku dalam debu. S e l a",
Zabur,7,6,Zabur 7:6,"(7-7) Ya ALLAH, bertindaklah kiranya dalam murka-Mu, hadapilah amukan lawan-lawanku! Bertindaklah, ya Tuhanku, tegakkanlah keadilan!",
Zabur,7,7,Zabur 7:7,"(7-8) Biarlah bangsa-bangsa berhimpun mengelilingi-Mu, dan bertakhtalah atas mereka di tempat yang tinggi.",
Zabur,7,8,Zabur 7:8,"(7-9) ALLAH mengadili bangsa-bangsa. Ya ALLAH, adililah aku sesuai dengan kebenaranku dan ketulusan hatiku.",
Zabur,7,9,Zabur 7:9,"(7-10) Hentikanlah kiranya kejahatan orang fasik, dan tegakkanlah orang benar, ya Allah Yang Mahabenar, yang menguji hati serta batin.",
Zabur,7,10,Zabur 7:10,"(7-11) Perisaiku adalah Allah, yang menyelamatkan orang yang lurus hati.",
Zabur,7,11,Zabur 7:11,"(7-12) Allah adalah hakim yang benar, dan Ia adalah Tuhan yang setiap hari menunjukkan murka-Nya.",
Zabur,7,12,Zabur 7:12,"(7-13) Jikalau seseorang tidak bertobat, maka Allah akan mengasah pedang-Nya, melenturkan busur-Nya dan membidik.",
Zabur,7,13,Zabur 7:13,"(7-14) Ia melengkapi diri-Nya dengan senjata-senjata yang mematikan, dan membuat anak-anak panah-Nya menyala.",
Zabur,7,14,Zabur 7:14,"(7-15) Sesungguhnya, orang yang mengandung kejahatan dan hamil kezaliman akan melahirkan kebohongan.",
Zabur,7,15,Zabur 7:15,"(7-16) Ia mengorek dan menggali lubang, tetapi ia sendiri jatuh ke dalam lubang yang dibuatnya itu.",
Zabur,7,16,Zabur 7:16,"(7-17) Kezalimannya akan berbalik menimpa kepalanya sendiri, dan kekerasannya akan turun ke atas ubun-ubunnya.",
Zabur,7,17,Zabur 7:17,"(7-18) Aku hendak mengucap syukur kepada ALLAH karena kebenaran-Nya, dan aku akan melantunkan puji-pujian bagi nama ALLAH Yang Mahatinggi.",
Zabur,8,1,Zabur 8:1,"(8-1) Untuk pemimpin pujian. Menurut lagu: Gitit. Syair Daud. (8-2) Ya ALLAH, ya Rabbana, betapa mulia nama-Mu di seluruh bumi! Keagungan-Mu Kautempatkan melebihi langit.",Makhluk Hina sebagai Makhluk Mulia
Zabur,8,2,Zabur 8:2,(8-3) Dari mulut bayi dan kanak-kanak yang menyusu pun Kauletakkan dasar kekuatan karena lawan-lawanmu untuk membungkam musuh dan pendendam.,
Zabur,8,3,Zabur 8:3,"(8-4) Apabila aku memperhatikan langit-Mu, buatan tangan-Mu, bulan dan bintang yang telah Kautetapkan,",
Zabur,8,4,Zabur 8:4,"(8-5) apakah manusia sehingga Engkau mengingatnya, dan bani Adam sehingga Engkau memperhatikannya?",
Zabur,8,5,Zabur 8:5,"(8-6) Engkau membuatnya sedikit lebih rendah daripada makhluk-makhluk ilahi, dan memahkotainya dengan kemuliaan dan kehormatan.",
Zabur,8,6,Zabur 8:6,(8-7) Engkau menjadikannya penguasa atas karya tangan-Mu. Segala sesuatu Kautaklukkan di bawah kakinya:,
Zabur,8,7,Zabur 8:7,"(8-8) kawanan kambing domba dan lembu semuanya, juga binatang-binatang di padang,",
Zabur,8,8,Zabur 8:8,"(8-9) burung-burung di udara, ikan-ikan di laut, dan segala sesuatu yang melintasi relung lautan.",
Zabur,8,9,Zabur 8:9,"(8-10) Ya ALLAH, ya Rabbana, betapa mulia nama-Mu di seluruh bumi!",
Zabur,9,1,Zabur 9:1,"(9-1) Untuk pemimpin pujian. Menurut lagu: Kematian Seorang Anak. Syair Daud. (9-2) Aku hendak mengucap syukur kepada ALLAH dengan segenap hatiku, aku hendak menceritakan perbuatan-Mu yang ajaib.","Allah, Pelindung Orang Saleh"
Zabur,9,2,Zabur 9:2,"(9-3) Aku hendak bersukacita dan bersukaria karena Engkau, aku hendak melantunkan puji-pujian demi nama-Mu, ya Yang Mahatinggi.",
Zabur,9,3,Zabur 9:3,"(9-4) Ketika musuh-musuhku mundur, mereka tersandung dan binasa di hadapan-Mu.",
Zabur,9,4,Zabur 9:4,(9-5) Engkau membela perkaraku dan hakku. Engkau bersemayam di arasy dan menghakimi dengan benar.,
Zabur,9,5,Zabur 9:5,(9-6) Engkau menghardik bangsa-bangsa dan membinasakan orang fasik. Engkau menghapuskan nama mereka untuk seterusnya dan selama-lamanya.,
Zabur,9,6,Zabur 9:6,"(9-7) Musuh telah habis binasa dalam reruntuhan yang abadi. Kota-kota mereka telah Kauporak-porandakan, kenangan tentang mereka pun telah lenyap.",
Zabur,9,7,Zabur 9:7,"(9-8) Tetapi, ALLAH bersemayam untuk selama-lamanya, Ia telah menetapkan arasy-Nya untuk penghakiman.",
Zabur,9,8,Zabur 9:8,"(9-9) Dialah yang akan menghakimi dunia ini dengan kebenaran, menghakimi bangsa-bangsa dengan keadilan.",
Zabur,9,9,Zabur 9:9,"(9-10) Namun, ALLAH adalah kota benteng bagi yang tertindas, kota benteng dalam masa kesesakan.",
Zabur,9,10,Zabur 9:10,"(9-11) Orang-orang yang mengenal nama-Mu menaruh percaya kepada-Mu karena Engkau tidak pernah meninggalkan orang yang mencari Engkau, ya ALLAH.",
Zabur,9,11,Zabur 9:11,(9-12) Lantunkanlah puji-pujian bagi ALLAH yang bersemayam di Sion! Kabarkanlah perbuatan-perbuatan-Nya di antara bangsa-bangsa!,
Zabur,9,12,Zabur 9:12,(9-13) Dialah yang membalas penumpahan darah. Ia ingat dan tak pernah melupakan seruan orang yang tertindas.,
Zabur,9,13,Zabur 9:13,"(9-14) Ya ALLAH, kasihanilah aku. Tiliklah kesusahanku yang disebabkan oleh orang-orang yang membenci aku, ya Tuhan yang mengangkat aku dari pintu gerbang maut,",
Zabur,9,14,Zabur 9:14,"(9-15) supaya aku dapat menceritakan segala kemasyhuran-Mu di dalam pintu gerbang Putri Sion, dan bergembira karena keselamatan dari-Mu.",
Zabur,9,15,Zabur 9:15,(9-16) Bangsa-bangsa terperosok ke dalam lubang yang telah mereka buat. Kaki mereka terjerat dalam jaring yang mereka pasang sendiri.,
Zabur,9,16,Zabur 9:16,"(9-17) ALLAH menyatakan diri-Nya, dan Ia telah menjalankan penghakiman. Orang fasik terjerat dalam perbuatan tangannya sendiri. Higayon. S e l a",
Zabur,9,17,Zabur 9:17,"(9-18) Orang-orang fasik akan kembali ke alam kubur, yaitu semua bangsa yang melupakan Allah.",
Zabur,9,18,Zabur 9:18,"(9-19) Akan tetapi, orang melarat tidak akan selalu dilupakan, dan pengharapan orang yang tertindas tidak akan selamanya lenyap.",
Zabur,9,19,Zabur 9:19,"(9-20) Ya ALLAH, bertindaklah kiranya. Jangan biarkan manusia berjaya! Biarlah bangsa-bangsa dihakimi di hadapan-Mu.",
Zabur,9,20,Zabur 9:20,"(9-21) Buatlah mereka takut, ya ALLAH! Biarlah bangsa-bangsa tahu bahwa mereka hanyalah manusia. S e l a",
Zabur,10,1,Zabur 10:1,"Ya ALLAH, mengapa Engkau menjauh? Mengapa Engkau menyembunyikan diri-Mu pada masa kesesakan? 2 Dengan congkak orang fasik memburu orang yang tertindas. Biarlah mereka tertangkap dalam muslihat yang telah mereka rancang sendiri. 3 Orang fasik membanggakan nafsu hatinya, orang tamak mengutuki dan menista ALLAH. 4 Kata orang fasik dengan hidung terangkat, “Ia tidak akan menuntut.” Pikirannya semata-mata, “Tidak ada Tuhan!” 5 Jalan-jalannya senantiasa berhasil. Hukum-hukum-Mu ada di tempat tinggi, jauh dari dirinya. Ia meremehkan semua lawannya. 6 Dalam hatinya ia berkata, “Aku tak akan tergoyahkan, dari zaman ke zaman aku tak akan kena bencana.” 7 Mulutnya penuh kutuk, tipu daya, serta penindasan. Di bawah lidahnya ada kezaliman dan kejahatan. 8 Ia duduk menghadang di desa-desa, di tempat tersembunyi ia membunuh orang yang tak bersalah. Matanya mengintai orang yang tak berdaya. 9 Ia menghadang di tempat tersembunyi seperti singa di semak-semak. Ia menghadang untuk menangkap orang yang tertindas. Ia menangkap orang yang tertindas dan menariknya dalam jaringnya. 10 Ia membungkuk, siap untuk menerkam, lalu jatuhlah orang yang tak berdaya oleh kekuatannya. 11 Katanya di dalam hatinya, “Allah sudah lupa, Ia sudah menyembunyikan hadirat-Nya dan Ia tidak pernah melihatnya.” 12 Ya ALLAH, bertindaklah kiranya. Turun tanganlah, ya Tuhan. Janganlah lupakan orang yang tertindas. 13 Mengapa orang fasik menista Allah serta berkata dalam hatinya, “Engkau tidak akan menuntut”? 14 Engkau memang melihatnya karena Engkau memperhatikan kesukaran dan sakit hati, dan Engkau mengambilnya ke dalam tangan-Mu sendiri. Orang yang tak berdaya berserah kepada-Mu karena Engkaulah penolong anak yatim. 15 Patahkanlah lengan orang fasik dan orang jahat, usutlah kefasikannya sampai tidak Kaudapati lagi. 16 ALLAH adalah Raja untuk seterusnya dan selama-lamanya; bangsa-bangsa akan lenyap dari tanah-Nya. 17 Keinginan hati orang yang tertindas Kaudengarkan, ya ALLAH. Engkau akan menguatkan hati mereka, Engkau akan siap mendengar 18 untuk membela anak yatim dan orang yang tertindas sehingga tidak ada lagi orang di bumi yang menakut-nakuti. << Zabur 10 >>",
Zabur,10,2,Zabur 10:2,Dengan congkak orang fasik memburu orang yang tertindas. Biarlah mereka tertangkap dalam muslihat yang telah mereka rancang sendiri.,
Zabur,10,3,Zabur 10:3,"Orang fasik membanggakan nafsu hatinya, orang tamak mengutuki dan menista ALLAH.",
Zabur,10,4,Zabur 10:4,"Kata orang fasik dengan hidung terangkat, “Ia tidak akan menuntut.” Pikirannya semata-mata, “Tidak ada Tuhan!”",
Zabur,10,5,Zabur 10:5,"Jalan-jalannya senantiasa berhasil. Hukum-hukum-Mu ada di tempat tinggi, jauh dari dirinya. Ia meremehkan semua lawannya.",
Zabur,10,6,Zabur 10:6,"Dalam hatinya ia berkata, “Aku tak akan tergoyahkan, dari zaman ke zaman aku tak akan kena bencana.”",
Zabur,10,7,Zabur 10:7,"Mulutnya penuh kutuk, tipu daya, serta penindasan. Di bawah lidahnya ada kezaliman dan kejahatan.",
Zabur,10,8,Zabur 10:8,"Ia duduk menghadang di desa-desa, di tempat tersembunyi ia membunuh orang yang tak bersalah. Matanya mengintai orang yang tak berdaya.",
Zabur,10,9,Zabur 10:9,Ia menghadang di tempat tersembunyi seperti singa di semak-semak. Ia menghadang untuk menangkap orang yang tertindas. Ia menangkap orang yang tertindas dan menariknya dalam jaringnya.,
Zabur,10,10,Zabur 10:10,"Ia membungkuk, siap untuk menerkam, lalu jatuhlah orang yang tak berdaya oleh kekuatannya.",
Zabur,10,11,Zabur 10:11,"Katanya di dalam hatinya, “Allah sudah lupa, Ia sudah menyembunyikan hadirat-Nya dan Ia tidak pernah melihatnya.”",
Zabur,10,12,Zabur 10:12,"Ya ALLAH, bertindaklah kiranya. Turun tanganlah, ya Tuhan. Janganlah lupakan orang yang tertindas.",
Zabur,10,13,Zabur 10:13,"Mengapa orang fasik menista Allah serta berkata dalam hatinya, “Engkau tidak akan menuntut”?",
Zabur,10,14,Zabur 10:14,"Engkau memang melihatnya karena Engkau memperhatikan kesukaran dan sakit hati, dan Engkau mengambilnya ke dalam tangan-Mu sendiri. Orang yang tak berdaya berserah kepada-Mu karena Engkaulah penolong anak yatim.",
Zabur,10,15,Zabur 10:15,"Patahkanlah lengan orang fasik dan orang jahat, usutlah kefasikannya sampai tidak Kaudapati lagi.",
Zabur,10,16,Zabur 10:16,ALLAH adalah Raja untuk seterusnya dan selama-lamanya; bangsa-bangsa akan lenyap dari tanah-Nya.,
Zabur,10,17,Zabur 10:17,"Keinginan hati orang yang tertindas Kaudengarkan, ya ALLAH. Engkau akan menguatkan hati mereka, Engkau akan siap mendengar",
Zabur,10,18,Zabur 10:18,untuk membela anak yatim dan orang yang tertindas sehingga tidak ada lagi orang di bumi yang menakut-nakuti.,
Zabur,11,1,Zabur 11:1,"Untuk pemimpin pujian. Dari Daud. Pada ALLAH aku berlindung. Bagaimana mungkin engkau berkata kepadaku, “Terbanglah ke gunungmu seperti seekor burung!",Allah Tempat Berlindung
Zabur,11,2,Zabur 11:2,"Lihatlah, orang fasik melenturkan busurnya dan memasang anak panah mereka pada tali busurnya untuk memanah dari tempat gelap orang yang lurus hati.",
Zabur,11,3,Zabur 11:3,"Jikalau dasar-dasar dihancurkan, orang benar bisa berbuat apa?”",
Zabur,11,4,Zabur 11:4,"ALLAH hadir di dalam Bait-Nya yang suci, ALLAH, arasy-Nya ada di surga. Mata-Nya memperhatikan, pandangan-Nya menguji bani Adam.",
Zabur,11,5,Zabur 11:5,ALLAH menguji orang benar dan orang fasik. Ia membenci orang yang suka akan kekerasan.,
Zabur,11,6,Zabur 11:6,"Ia akan menghujani orang fasik dengan arang berapi dan belerang. Api, belerang, serta angin panas adalah isi cawan mereka.",
Zabur,11,7,Zabur 11:7,"ALLAH itu benar, Ia mencintai kebenaran. Orang yang lurus hati akan memandang wajah-Nya.",
Zabur,12,1,Zabur 12:1,"(12-1) Untuk pemimpin pujian. Menurut lagu: Yang Kedelapan. Syair Daud. (12-2) Ya ALLAH, tolonglah kiranya karena habis sudah orang saleh, lenyap sudah orang setia dari antara bani Adam.",Doa Minta Tolong terhadap Orang Curang
Zabur,12,2,Zabur 12:2,"(12-3) Mereka berkata dusta satu sama lain, mereka berbicara dengan bibir yang manis dan hati yang bercabang.",
Zabur,12,3,Zabur 12:3,"(12-4) Kiranya ALLAH mengerat semua bibir manis dan lidah yang berbicara dengan sombong,",
Zabur,12,4,Zabur 12:4,"(12-5) yaitu mereka yang berkata, “Dengan lidah kami, kami unggul! Bibir kami andalan kami! Siapakah tuan atas kami?”",
Zabur,12,5,Zabur 12:5,"(12-6) “Karena penindasan terhadap orang lemah dan rintihan kaum duafa, sekarang Aku akan bertindak,” demikianlah firman ALLAH. “Aku akan menempatkan mereka di tempat aman yang mereka rindukan.”",
Zabur,12,6,Zabur 12:6,"(12-7) Janji ALLAH adalah janji yang murni, seperti perak yang dilebur dalam dapur api di tanah, tujuh kali dimurnikan.",
Zabur,12,7,Zabur 12:7,"(12-8) Ya ALLAH, Engkau akan menjaga orang-orang itu. Engkau memelihara mereka terhadap generasi ini untuk selama-lamanya.",
Zabur,12,8,Zabur 12:8,(12-9) Orang fasik berkeliaran di mana-mana karena kekejian dipuji-puji di antara bani Adam.,
Zabur,13,1,Zabur 13:1,Untuk pemimpin pujian. Syair Daud.,Doa Orang yang Percaya pada Cinta Kasih Allah
Zabur,13,2,Zabur 13:2,"Sampai kapan, ya ALLAH? Sampai selama-lamanyakah Engkau melupakan aku? Sampai kapan Engkau menyembunyikan hadirat-Mu dariku?",
Zabur,13,3,Zabur 13:3,Sampai kapan aku harus menyimpan kekhawatiran dalam diriku? Dukacita ada dalam hatiku sepanjang hari. Sampai kapan musuhku meninggikan diri atasku?,
Zabur,13,4,Zabur 13:4,"Ya ALLAH, ya Tuhanku, perhatikanlah dan jawablah kiranya aku. Terangilah mataku supaya jangan aku tertidur dalam kematian,",
Zabur,13,5,Zabur 13:5,"supaya jangan musuhku berkata, “Aku sudah menguasainya!” dan lawan-lawanku bergembira ketika aku tergelincir.",
Zabur,13,6,Zabur 13:6,"Tetapi, aku, aku telah memercayai kasih abadi-Mu, hatiku bergembira karena keselamatan dari-Mu. Aku hendak menyanyi bagi ALLAH karena Ia telah berbuat baik kepadaku.",
Zabur,14,1,Zabur 14:1,"Untuk pemimpin pujian. Dari Daud. Orang kafir berkata di dalam hatinya, “Tidak ada Tuhan.” Mereka rusak, kelakuannya keji, tidak ada yang berbuat baik.",Kebodohan Manusia
Zabur,14,2,Zabur 14:2,"ALLAH memandang ke bawah dari surga, kepada bani Adam, untuk melihat kalau-kalau ada orang yang bijaksana, yang mencari Allah.",
Zabur,14,3,Zabur 14:3,"Mereka semua sudah menyimpang dan sama-sama bejat. Tidak ada yang berbuat baik, seorang pun tidak.",
Zabur,14,4,Zabur 14:4,"Tidak sadarkah semua orang yang berbuat jahat, yang memakan habis umat-Ku seperti makan roti, dan yang tidak berseru kepada ALLAH?",
Zabur,14,5,Zabur 14:5,Di sana mereka akan sangat ketakutan karena Allah menyertai generasi yang benar.,
Zabur,14,6,Zabur 14:6,"Kamu hendak mempermalukan maksud orang yang tertindas, tetapi ALLAH adalah tempat perlindungannya.",
Zabur,14,7,Zabur 14:7,"Kiranya keselamatan bagi orang Israil datang dari Sion! Ketika ALLAH memulihkan keadaan umat-Nya, Yakub akan bergembira dan Israil akan bersukacita.",
Zabur,15,1,Zabur 15:1,"Syair Daud. Ya ALLAH, siapakah yang boleh menumpang dalam Kemah Suci-Mu? Siapakah yang boleh tinggal di gunung-Mu yang suci?",Siapa Boleh Datang kepada Allah?
Zabur,15,2,Zabur 15:2,"Dia yang hidup tak bercela, yang berbuat benar, dan yang mengatakan kebenaran dalam hatinya;",
Zabur,15,3,Zabur 15:3,"dia yang tidak memfitnah dengan lidahnya, yang tidak berbuat jahat terhadap sahabatnya, dan yang tidak menanggungkan cela kepada tetangganya;",
Zabur,15,4,Zabur 15:4,"dia yang memandang hina orang keji, tetapi menghormati orang yang bertakwa kepada ALLAH; dia yang tidak mengubah janjinya sekalipun rugi;",
Zabur,15,5,Zabur 15:5,"dia yang tidak meminjamkan uangnya dengan makan bunga, dan yang tidak menerima suap untuk melawan orang yang tak bersalah. Orang yang berbuat demikian selama-lamanya tak akan tergoyahkan.",
Zabur,16,1,Zabur 16:1,"Miktam. Dari Daud. Ya Allah, jagalah kiranya aku karena pada-Mulah aku berlindung.",Kebahagiaan Orang Saleh
Zabur,16,2,Zabur 16:2,"Aku berkata kepada ALLAH, “Engkaulah Tuhanku, tak ada yang baik bagiku, selain Engkau.”",
Zabur,16,3,Zabur 16:3,"Orang-orang suci yang ada di bumi, merekalah orang-orang mulia yang selalu menjadi kesukaanku.",
Zabur,16,4,Zabur 16:4,"Kesusahan orang-orang yang menyembah ilah lain akan bertambah banyak. Aku tidak akan turut mencurahkan persembahan minuman mereka yang dari darah, atau pun menyebut-nyebut nama ilah-ilah lain di bibirku.",
Zabur,16,5,Zabur 16:5,"Ya ALLAH, Engkaulah bagian pusakaku dan pialaku. Engkau meneguhkan bagian tanah yang diundikan bagiku.",
Zabur,16,6,Zabur 16:6,"Tali pengukur jatuh bagiku di tempat-tempat yang indah. Sesungguhnya, milik pusakaku menyenangkan bagiku.",
Zabur,16,7,Zabur 16:7,"Aku hendak memuji ALLAH yang telah menasihati aku. Ya, pada malam hari batinku mengajariku.",
Zabur,16,8,Zabur 16:8,"Aku senantiasa sadar bahwa ALLAH ada di hadapanku. Karena Ia di sisi kananku, aku tak akan tergoyahkan.",
Zabur,16,9,Zabur 16:9,"Itulah sebabnya, hatiku bersukacita dan jiwaku bergembira. Ya, tubuhku akan beristirahat dengan sentosa",
Zabur,16,10,Zabur 16:10,"karena Engkau tidak akan menyerahkan jiwaku ke alam kubur, dan tidak akan membiarkan orang saleh-Mu melihat kebinasaan.",
Zabur,16,11,Zabur 16:11,"Engkau akan menyatakan kepadaku jalan kehidupan. Di hadirat-Mu ada kegembiraan yang penuh, di sebelah kanan-Mu ada nikmat selama-lamanya.",
