Book,Chapter,Verse,Ref,Indonesian,Subheading
Zabur,37,20,Zabur 37:20,"Tetapi, orang fasik akan binasa, dan musuh-musuh ALLAH akan lenyap seperti keindahan padang rumput. Mereka lenyap—lenyap bagaikan asap.",
Zabur,37,21,Zabur 37:21,"Orang fasik meminjam dan tidak membayar kembali, tetapi orang benar penuh belas kasihan dan suka memberi.",
Zabur,37,22,Zabur 37:22,"Sesungguhnya, orang yang diberkahi oleh Allah akan mewarisi bumi, sedangkan orang yang dikutuk oleh-Nya akan dilenyapkan.",
Zabur,37,23,Zabur 37:23,Langkah-langkah manusia ditetapkan ALLAH apabila Ia berkenan kepada jalannya.,
Zabur,37,24,Zabur 37:24,"Sekalipun ia jatuh, ia tak akan terhempas karena ALLAH menopang tangannya.",
Zabur,37,25,Zabur 37:25,"Dahulu aku muda, sekarang aku sudah tua, tetapi belum pernah aku melihat orang benar ditelantarkan atau keturunannya mengemis makanan.",
Zabur,37,26,Zabur 37:26,"Ia selalu penuh belas kasihan dan memberi pinjaman, keturunannya menjadi suatu berkah.",
Zabur,37,27,Zabur 37:27,"Jauhilah yang jahat dan lakukanlah yang baik, tentu engkau akan tetap tinggal selama-lamanya",
Zabur,37,28,Zabur 37:28,"karena ALLAH mencintai keadilan, dan Ia tidak menelantarkan orang-orang saleh-Nya. Mereka akan terpelihara untuk selama-lamanya, tetapi keturunan orang fasik akan dilenyapkan.",
Zabur,37,29,Zabur 37:29,"Orang-orang benar akan mewarisi negeri, dan tinggal di situ sampai selama-lamanya.",
Zabur,37,30,Zabur 37:30,"Mulut orang benar mengucapkan hikmat, dan lidahnya menuturkan keadilan.",
Zabur,37,31,Zabur 37:31,"Hukum Tuhannya ada di dalam hatinya, dan langkahnya tidak akan tergelincir.",
Zabur,37,32,Zabur 37:32,"Orang fasik mengintai orang benar, dan berikhtiar membunuhnya.",
Zabur,37,33,Zabur 37:33,"Tetapi, ALLAH tidak akan menyerahkan dia ke tangan si fasik, atau membiarkannya dinyatakan bersalah ketika diadili.",
Zabur,37,34,Zabur 37:34,"Nantikanlah ALLAH dan tetaplah ikuti jalan-Nya maka Ia akan meninggikan engkau untuk menjadi pewaris negeri, dan engkau akan menyaksikan orang-orang fasik dilenyapkan.",
Zabur,37,35,Zabur 37:35,"Aku pernah melihat seorang fasik yang kejam tumbuh mekar seperti pohon yang rimbun di tanah airnya,",
Zabur,37,36,Zabur 37:36,"tetapi kemudian ia lenyap, tak ada lagi. Sekalipun aku mencarinya, ia tak kutemukan.",
Zabur,37,37,Zabur 37:37,"Perhatikanlah orang yang tak bercela, dan pandanglah orang yang lurus hati karena ada masa depan bagi orang yang suka damai.",
Zabur,37,38,Zabur 37:38,"Tetapi, orang-orang durhaka akan dibinasakan bersama-sama, dan masa depan orang fasik akan dilenyapkan.",
Zabur,37,39,Zabur 37:39,Keselamatan orang-orang benar adalah dari ALLAH. Dialah benteng mereka pada masa kesesakan.,
Zabur,37,40,Zabur 37:40,ALLAH menolong mereka dan meluputkan mereka. Ia meluputkan mereka dari orang-orang fasik serta menyelamatkan mereka oleh karena mereka berlindung kepada-Nya.,
Zabur,38,1,Zabur 38:1,"(38-1) Syair Daud. Zikir. (38-2) Ya ALLAH, janganlah kiranya Kautegur aku dalam amarah-Mu, dan jangan hukum aku dalam murka-Mu.",Doa pada Waktu Sakit
Zabur,38,2,Zabur 38:2,"(38-3) Anak-anak panah-Mu menancap di tubuhku, dan Engkau menekan aku.",
Zabur,38,3,Zabur 38:3,"(38-4) Tidak ada kesehatan pada tubuhku karena murka-Mu, tidak ada kekuatan pada tulang-tulangku karena dosaku.",
Zabur,38,4,Zabur 38:4,"(38-5) Kesalahan-kesalahanku menumpuk melebihi kepalaku, seperti beban yang terlampau berat bagiku.",
Zabur,38,5,Zabur 38:5,(38-6) Luka-lukaku berbau dan membusuk karena kebodohanku.,
Zabur,38,6,Zabur 38:6,"(38-7) Aku terbungkuk-bungkuk, sangat tertunduk. Sepanjang hari aku berjalan sambil berkabung.",
Zabur,38,7,Zabur 38:7,"(38-8) Pinggangku penuh radang, tidak ada kesehatan pada tubuhku.",
Zabur,38,8,Zabur 38:8,"(38-9) Aku lesu dan sangat remuk, aku meraung karena pergolakan hatiku.",
Zabur,38,9,Zabur 38:9,"(38-10) Ya Rabbi, segala kerinduanku nyata di hadapan-Mu, dan keluh kesahku tidak tersembunyi dari-Mu.",
Zabur,38,10,Zabur 38:10,"(38-11) Jantungku berdebar-debar dan kekuatanku hilang, cahaya mataku pun tak lagi ada padaku.",
Zabur,38,11,Zabur 38:11,"(38-12) Sahabat-sahabatku dan rekan-rekanku menghindar karena penyakitku, kerabatku menjauh dariku.",
Zabur,38,12,Zabur 38:12,"(38-13) Orang-orang yang mengincar nyawaku memasang jerat bagiku, dan orang-orang yang mengikhtiarkan kejahatan terhadapku membicarakan kehancuran. Mereka memikirkan tipu daya sepanjang hari.",
Zabur,38,13,Zabur 38:13,"(38-14) Tetapi, aku seperti orang tuli yang tidak mendengar, seperti orang bisu yang tidak membuka mulut.",
Zabur,38,14,Zabur 38:14,"(38-15) Sungguh, aku seperti orang yang tidak mendengar, dan yang tak ada bantahan dalam mulutnya.",
Zabur,38,15,Zabur 38:15,"(38-16) Kepada-Mulah aku berharap, ya ALLAH. Ya Junjunganku, ya Tuhanku, Engkaulah yang akan menjawab.",
Zabur,38,16,Zabur 38:16,"(38-17) Aku berkata, “Jangan sampai mereka bersukacita karenaku, atau membesarkan diri atas aku ketika kakiku tergelincir.”",
Zabur,38,17,Zabur 38:17,"(38-18) Aku nyaris jatuh, dan derita selalu ada di hadapanku.",
Zabur,38,18,Zabur 38:18,"(38-19) Aku mengakui kesalahanku, dan aku khawatir karena dosa-dosaku.",
Zabur,38,19,Zabur 38:19,"(38-20) Musuh-musuhku kuat dan besar jumlahnya, banyak orang membenci aku tanpa sebab.",
Zabur,38,20,Zabur 38:20,"(38-21) Orang-orang yang membalas kebaikanku dengan kejahatan, mereka menjadi lawanku karena aku mengejar kebaikan.",
Zabur,38,21,Zabur 38:21,"(38-22) Ya ALLAH, janganlah kiranya Kautinggalkan aku. Ya Tuhanku, jangan jauh dariku.",
Zabur,38,22,Zabur 38:22,"(38-23) Tolonglah aku segera, ya Rabbi, yang menyelamatkan aku.",
Zabur,39,1,Zabur 39:1,"(39-1) Untuk pemimpin pujian. Untuk Yedutun. Syair Daud. (39-2) Aku berkata, “Aku hendak menjaga tindak-tandukku supaya aku tidak berdosa dengan lidahku. Aku hendak memberangus mulutku selagi orang fasik ada di hadapanku.”",Doa Minta Tolong
Zabur,39,2,Zabur 39:2,"(39-3) Aku kelu dan diam, perkataan baik pun tak kuucapkan. Akan tetapi, deritaku semakin bertambah.",
Zabur,39,3,Zabur 39:3,"(39-4) Hatiku memanas dalam diriku, dan sementara aku memikirkannya, api menyala. Lalu, dengan lidahku aku berkata,",
Zabur,39,4,Zabur 39:4,"(39-5) “Ya ALLAH, beritahukanlah kiranya kepadaku akhir hidupku dan sampai di mana batas umurku supaya aku tahu betapa fananya aku!",
Zabur,39,5,Zabur 39:5,"(39-6) Lihat, umurku Kautentukan setelapak tangan saja. Di hadapan-Mu hidupku seperti tiada artinya. Setiap manusia yang ada hanyalah hembusan napas belaka. S e l a",
Zabur,39,6,Zabur 39:6,(39-7) Hidup manusia hanyalah seperti bayang-bayang yang berlalu! Ia hanya menyusahkan dirinya bagi kesia-siaan. Ditimbunnya harta tanpa tahu siapa yang akan meraupnya.,
Zabur,39,7,Zabur 39:7,"(39-8) Lalu, sekarang, ya Rabbi, apa yang harus kunantikan? Kepada-Mulah aku berharap.",
Zabur,39,8,Zabur 39:8,"(39-9) Lepaskanlah aku dari semua pelanggaranku, dan jangan biarkan aku menjadi bahan celaan orang bodoh.",
Zabur,39,9,Zabur 39:9,"(39-10) Aku kelu, tak kubuka mulutku karena Engkau yang membuatnya.",
Zabur,39,10,Zabur 39:10,(39-11) Jauhkanlah tulah-Mu dariku sebab aku habis oleh hukuman tangan-Mu.,
Zabur,39,11,Zabur 39:11,"(39-12) Dengan teguran Engkau mendidik orang karena kesalahannya. Engkau melenyapkan keelokannya, seperti ngengat. Setiap manusia hanyalah hembusan napas!” S e l a",
Zabur,39,12,Zabur 39:12,"(39-13) “Ya ALLAH, dengarkanlah kiranya doaku, perhatikanlah teriakanku. Jangan diam melihat air mataku sebab aku ini seorang pendatang pada-Mu, seorang perantau seperti semua nenek moyangku.",
Zabur,39,13,Zabur 39:13,(39-14) Alihkanlah pandangan-Mu yang penuh murka dariku supaya aku dapat kembali tersenyum sebelum aku pergi dan tidak ada lagi.”,
Zabur,40,1,Zabur 40:1,"(40-1) Untuk pemimpin pujian. Syair Daud. (40-2) Aku sangat menanti-nantikan ALLAH, lalu Ia berpaling padaku dan mendengar teriakanku.",Syukur dan Doa
Zabur,40,2,Zabur 40:2,"(40-3) Ia mengangkat aku dari lubang kebinasaan, dari lumpur rawa. Ia menegakkan kakiku di atas bukit batu dan meneguhkan langkah-langkahku.",
Zabur,40,3,Zabur 40:3,"(40-4) Ia mengajari aku nyanyian baru, puji-pujian bagi Tuhan kita. Banyak orang akan melihatnya, lalu bertakwa dan percaya kepada ALLAH.",
Zabur,40,4,Zabur 40:4,"(40-5) Berbahagialah orang yang menaruh kepercayaannya kepada ALLAH, dan tidak berpaling kepada orang-orang sombong atau menyimpang kepada dusta.",
Zabur,40,5,Zabur 40:5,"(40-6) Ya ALLAH, ya Tuhanku, banyak hal telah Kaulakukan, karya-Mu yang ajaib serta rancangan-Mu bagi kami! Tak ada yang dapat disetarakan dengan Engkau! Jika aku harus menyatakan dan mengatakannya, terlalu banyak jumlahnya untuk dihitung.",
Zabur,40,6,Zabur 40:6,"(40-7) Engkau tidak menginginkan kurban sembelihan dan persembahan bahan makanan, tetapi Engkau telah memberikan kepadaku telinga yang terbuka. Kurban bakaran dan kurban penghapus dosa tidak Kautuntut.",
Zabur,40,7,Zabur 40:7,"(40-8) Kemudian, aku berkata, “Lihat, aku datang, dalam gulungan kitab sudah tertulis tentang aku.",
Zabur,40,8,Zabur 40:8,"(40-9) Aku suka melakukan kehendak-Mu, ya Tuhanku, dan hukum-Mu ada di dalam dadaku.”",
Zabur,40,9,Zabur 40:9,"(40-10) Aku telah mewartakan kebenaran di dalam jemaah yang besar. Lihatlah, aku tidak menahan bibirku, ya ALLAH, Engkau pun mengetahuinya!",
Zabur,40,10,Zabur 40:10,"(40-11) Kebenaran-Mu tidak kusembunyikan di dalam hatiku, aku berbicara tentang kesetiaan-Mu dan keselamatan dari-Mu. Kasih abadi-Mu dan kebenaran-Mu tidak kurahasiakan di hadapan jemaah yang besar.",
Zabur,40,11,Zabur 40:11,"(40-12) Ya ALLAH, janganlah kiranya Kautahan rahmat-Mu dari diriku, biarlah kasih abadi-Mu dan kebenaran-Mu senantiasa memelihara aku.",
Zabur,40,12,Zabur 40:12,"(40-13) Karena malapetaka yang tak terhingga banyaknya telah mengelilingi aku. Kesalahan-kesalahanku menangkap aku dan aku tidak dapat melihat. Jumlahnya lebih banyak daripada rambut di kepalaku, hingga tawarlah hatiku.",
Zabur,40,13,Zabur 40:13,"(40-14) Ya ALLAH, sudilah kiranya melepaskan aku, ya ALLAH, segeralah tolong aku!",
Zabur,40,14,Zabur 40:14,(40-15) Biarlah orang-orang yang berupaya melenyapkan nyawaku mendapat malu dan menjadi bingung. Biarlah orang-orang yang menginginkan celakaku mundur dan terkena aib.,
Zabur,40,15,Zabur 40:15,"(40-16) Biarlah orang-orang yang berkata kepadaku, “Syukur, syukur!” tertegun karena malu.",
Zabur,40,16,Zabur 40:16,"(40-17) Biarlah semua orang yang mencari Engkau bergirang dan bersukacita karena-Mu, dan biarlah orang-orang yang mencintai keselamatan dari-Mu senantiasa berkata, “Mahabesar ALLAH!”",
Zabur,40,17,Zabur 40:17,"(40-18) Aku ini sengsara dan miskin, kiranya Rabbi menghiraukan aku. Engkaulah penolongku dan pembebasku. Ya Tuhanku, janganlah kiranya berlambat-lambat.",
Zabur,41,1,Zabur 41:1,(41-1) Untuk pemimpin pujian. Syair Daud. (41-2) Berbahagialah orang yang memperhatikan orang miskin! ALLAH akan meluputkannya pada waktu kesusahan.,Doa Mohon Kesembuhan
Zabur,41,2,Zabur 41:2,"(41-3) ALLAH akan melindunginya serta memeliharanya. Ia akan disebut berbahagia di bumi, dan Engkau tidak akan menyerahkannya kepada kehendak musuh-musuhnya.",
Zabur,41,3,Zabur 41:3,"(41-4) ALLAH akan menopangnya di ranjangnya saat sakit, dan menyembuhkannya dari penyakitnya di tempat tidurnya.",
Zabur,41,4,Zabur 41:4,"(41-5) Aku berkata, “Ya ALLAH, kasihanilah kiranya aku, sembuhkanlah jiwaku karena aku telah berdosa terhadap Engkau.”",
Zabur,41,5,Zabur 41:5,"(41-6) Musuh-musuhku berkata jahat tentang aku, “Kapankah ia akan mati dan namanya lenyap?”",
Zabur,41,6,Zabur 41:6,"(41-7) Pada waktu ia datang menengok, ia mengatakan kebohongan. Hatinya mengumpulkan kejahatan, lalu ia pergi ke luar dan menyebarkannya.",
Zabur,41,7,Zabur 41:7,"(41-8) Semua yang membenci aku sama-sama berbisik tentang aku, mereka merancangkan malapetaka bagiku,",
Zabur,41,8,Zabur 41:8,"(41-9) “Penyakit jahanam menimpanya, ia tak akan bangkit lagi dari tempatnya berbaring.”",
Zabur,41,9,Zabur 41:9,"(41-10) Bahkan sahabat karibku yang kupercayai, yang makan rotiku, telah mengangkat tumitnya melawan aku.",
Zabur,41,10,Zabur 41:10,"(41-11) Tetapi, Engkau, ya ALLAH, kasihanilah aku, dan bangkitkanlah aku supaya aku dapat membalas mereka!",
Zabur,41,11,Zabur 41:11,(41-12) Dengan ini aku tahu bahwa Engkau berkenan kepadaku karena musuhku tak dapat bersorak-sorak atasku.,
Zabur,41,12,Zabur 41:12,"(41-13) Engkau menopang aku karena ketulusan hatiku, dan Engkau menempatkan aku di hadapan-Mu untuk selama-lamanya.",
Zabur,41,13,Zabur 41:13,"(41-14) Segala puji bagi ALLAH, Tuhan yang disembah bani Israil, dari kekal sampai kekal. Amin, ya amin!",
Zabur,42,1,Zabur 42:1,"(42-1) Untuk pemimpin pujian. Nyanyian pengajaran bani Korah. (42-2) Ya Allah, seperti rusa merindukan batang air, demikianlah jiwaku merindukan Engkau.","Allah, Hakim Yang Adil"
Zabur,42,2,Zabur 42:2,"(42-3) Jiwaku haus kepada Allah, kepada Tuhan yang hidup. Kapankah aku boleh masuk menghadap hadirat Allah?",
Zabur,42,3,Zabur 42:3,"(42-4) Air mataku menjadi makananku siang dan malam sementara sepanjang hari orang-orang berkata kepadaku, “Di manakah Tuhanmu?”",
Zabur,42,4,Zabur 42:4,(42-5) Hal-hal inilah yang kuingat ketika aku mencurahkan isi jiwaku: Bagaimana aku berjalan bersama orang banyak dan memimpin mereka dalam arak-arakan menuju Bait Allah disertai suara sorak-sorai dan ucapan syukur dalam keramaian orang yang mengadakan perayaan.,
Zabur,42,5,Zabur 42:5,"(42-6) Mengapa engkau tertekan, hai jiwaku, dan gelisah di dalam diriku? Berharaplah kepada Allah karena aku akan kembali memuji Dia atas pertolongan yang datang dari hadirat-Nya.",
Zabur,42,6,Zabur 42:6,"(42-7) Ya Tuhanku, jiwaku tertekan di dalam diriku, sebab itu aku akan mengingat Engkau dari daerah Sungai Yordan, Gunung Hermon, dan dari Gunung Mizar.",
Zabur,42,7,Zabur 42:7,(42-8) Samudra memanggil samudera dengan deru air terjun-Mu. Semua ombak dan gelombang-Mu melanda aku.,
Zabur,42,8,Zabur 42:8,"(42-9) Pada siang hari ALLAH memerintahkan kasih abadi-Nya, dan pada malam hari nyanyian-Nya menyertai aku, suatu doa kepada Tuhan kehidupanku.",
Zabur,42,9,Zabur 42:9,"(42-10) Aku hendak berkata kepada Allah, bukit batuku, “Mengapa Engkau melupakan aku? Mengapa aku harus berjalan sambil berkabung sebab penindasan musuh?”",
Zabur,42,10,Zabur 42:10,"(42-11) Seperti tikaman ke dalam tulang-tulangku, lawan-lawanku mencela aku. Sepanjang hari mereka berkata kepadaku, “Di manakah Tuhanmu?”",
Zabur,42,11,Zabur 42:11,"(42-12) Mengapa engkau tertekan, hai jiwaku, mengapa engkau gelisah di dalam diriku? Berharaplah kepada Allah karena aku akan kembali memuji Dia, penolongku dan Tuhanku.",
Zabur,43,1,Zabur 43:1,"Ya Allah, belalah kiranya aku, dan perjuangkanlah perkaraku di hadapan bangsa yang tidak saleh. Luputkanlah aku dari penipu dan orang zalim 2 karena Engkaulah Tuhan perlindunganku. Mengapa Engkau membuang aku? Mengapa aku harus berjalan sambil berkabung sebab penindasan musuh? 3 Kirimlah terang-Mu dan kebenaran-Mu untuk memimpin aku dan membawa aku ke gunung-Mu yang suci, ke tempat persemayaman-Mu. 4 Maka, aku akan pergi menuju mazbah Allah, kepada Allah, kesukaanku, kegembiraanku. Aku hendak memuji Engkau dengan kecapi, ya Allah, ya Tuhanku. 5 Mengapa engkau tertekan, hai jiwaku, dan mengapa engkau gelisah di dalam diriku? Berharaplah kepada Allah karena aku akan kembali memuji Dia, penolongku dan Tuhanku. << Zabur 43 >>",
Zabur,43,2,Zabur 43:2,karena Engkaulah Tuhan perlindunganku. Mengapa Engkau membuang aku? Mengapa aku harus berjalan sambil berkabung sebab penindasan musuh?,
Zabur,43,3,Zabur 43:3,"Kirimlah terang-Mu dan kebenaran-Mu untuk memimpin aku dan membawa aku ke gunung-Mu yang suci, ke tempat persemayaman-Mu.",
Zabur,43,4,Zabur 43:4,"Maka, aku akan pergi menuju mazbah Allah, kepada Allah, kesukaanku, kegembiraanku. Aku hendak memuji Engkau dengan kecapi, ya Allah, ya Tuhanku.",
Zabur,43,5,Zabur 43:5,"Mengapa engkau tertekan, hai jiwaku, dan mengapa engkau gelisah di dalam diriku? Berharaplah kepada Allah karena aku akan kembali memuji Dia, penolongku dan Tuhanku.",
Zabur,44,1,Zabur 44:1,"(44-1) Untuk pemimpin pujian. Dari bani Korah. Nyanyian pengajaran. (44-2) Ya Allah, kami telah mendengar dengan telinga kami sendiri. Nenek moyang kami telah menceritakan kepada kami perbuatan yang telah Kaulakukan pada zaman mereka, yaitu zaman dahulu.",Jeritan Bangsa yang Tertindas
Zabur,44,2,Zabur 44:2,"(44-3) Dengan tangan-Mu sendiri Engkau menghalau bangsa-bangsa, lalu Kautempatkan nenek moyang kami sebagai gantinya. Engkau meremukkan suku-suku bangsa, tetapi Kaubiarkan nenek moyang kami bertumbuh.",
Zabur,44,3,Zabur 44:3,"(44-4) Bukan dengan pedang mereka merebut tanah itu, dan bukan lengan mereka yang membuat mereka menang, melainkan tangan kanan-Mu, kuasa-Mu, dan cahaya wajah-Mu sebab Engkau berkenan kepada mereka.",
Zabur,44,4,Zabur 44:4,"(44-5) Ya Allah, Engkaulah Rajaku, tetapkanlah kemenangan bagi Yakub.",
Zabur,44,5,Zabur 44:5,"(44-6) Dengan Engkau kami memukul mundur lawan-lawan kami, dan dengan nama-Mu kami menginjak-injak orang-orang yang bangkit melawan kami.",
Zabur,44,6,Zabur 44:6,"(44-7) Bukan busurku yang kuandalkan, pedangku pun tidak memberi aku kemenangan.",
Zabur,44,7,Zabur 44:7,"(44-8) Tetapi, Engkaulah yang memberi kami kemenangan atas lawan-lawan kami, dan orang-orang yang membenci kami Kaupermalukan.",
Zabur,44,8,Zabur 44:8,"(44-9) Karena Allah, kami akan bermegah sepanjang hari, dan kepada nama-Mu kami hendak mengucap syukur untuk selama-lamanya. S e l a",
Zabur,44,9,Zabur 44:9,"(44-10) Namun, Engkau telah membuang kami dan membuat kami kena aib. Engkau tidak lagi maju bersama-sama dengan bala tentara kami.",
Zabur,44,10,Zabur 44:10,"(44-11) Engkau membuat kami mundur dari hadapan lawan, dan orang-orang yang membenci kami menjarah kami.",
Zabur,44,11,Zabur 44:11,"(44-12) Engkau menyerahkan kami seperti domba untuk disantap, dan Engkau mencerai-beraikan kami di antara bangsa-bangsa.",
Zabur,44,12,Zabur 44:12,(44-13) Engkau menyerahkan umat-Mu dengan cuma-cuma tanpa mengambil keuntungan dari penyerahan itu.,
Zabur,44,13,Zabur 44:13,"(44-14) Kaujadikan kami bahan celaan bagi tetangga-tetangga kami, olok-olok dan cemoohan bagi orang-orang di sekeliling kami.",
Zabur,44,14,Zabur 44:14,(44-15) Kaujadikan kami sindiran di antara bangsa-bangsa. Suku-suku bangsa menggeleng-gelengkan kepala.,
Zabur,44,15,Zabur 44:15,(44-16) Aibku ada di hadapanku sepanjang hari dan wajahku diselubungi rasa malu,
Zabur,44,16,Zabur 44:16,(44-17) karena kata-kata orang yang mencela dan menghujat serta karena adanya musuh dan pendendam.,
Zabur,44,17,Zabur 44:17,"(44-18) Semua ini telah menimpa kami, tetapi kami tidak melupakan Engkau atau mengkhianati perjanjian-Mu.",
Zabur,44,18,Zabur 44:18,"(44-19) Hati kami tidak berpaling, dan langkah kami tidak menyimpang dari jalan-Mu",
Zabur,44,19,Zabur 44:19,"(44-20) sekalipun Engkau telah meremukkan kami di tempat serigala, dan menyelubungi kami dengan bayang-bayang maut.",
Zabur,44,20,Zabur 44:20,"(44-21) Seandainya kami melupakan nama Tuhan kami, atau menadahkan tangan kami kepada dewa bangsa asing,",
Zabur,44,21,Zabur 44:21,"(44-22) masakan Allah tidak mengetahuinya? Sesungguhnya, Ia mengetahui rahasia hati!",
Zabur,44,22,Zabur 44:22,"(44-23) Sungguh, demi Engkau kami menghadapi ancaman maut sepanjang hari, dan kami dianggap sebagai domba sembelihan.",
Zabur,44,23,Zabur 44:23,"(44-24) Ya Rabbi, bertindaklah kiranya. Mengapa Engkau seolah-olah tidur? Bertindaklah, jangan buang kami terus-menerus!",
Zabur,44,24,Zabur 44:24,(44-25) Mengapa Engkau menyembunyikan hadirat-Mu dan melupakan kesusahan serta ketertindasan kami?,
Zabur,44,25,Zabur 44:25,"(44-26) Jiwa kami terbenam dalam debu, dan tubuh kami terkapar di tanah.",
Zabur,44,26,Zabur 44:26,(44-27) Bertindaklah dan tolonglah kami! Tebuslah kami oleh karena kasih abadi-Mu.,
Zabur,45,1,Zabur 45:1,"(45-1) Untuk pemimpin pujian. Menurut lagu: Bunga Bakung. Dari bani Korah. Nyanyian pengajaran; nyanyian kasih. (45-2) Hatiku meluap dengan kata-kata indah. Kutujukan syairku bagi raja, lidahku adalah pena seorang juru tulis mahir.",Nyanyian pada Waktu Pernikahan Raja
Zabur,45,2,Zabur 45:2,"(45-3) Engkau yang terelok di antara bani Adam, kemurahan tercurah dari bibirmu, sebab itu Allah memberkahimu untuk selama-lamanya.",
Zabur,45,3,Zabur 45:3,"(45-4) Ikatlah pedangmu di pinggang, hai kesatria, dengan keagungan dan semarakmu!",
Zabur,45,4,Zabur 45:4,"(45-5) Dalam semarakmu berkeretalah dan menanglah demi kebenaran, kelemahlembutan, dan keadilan! Biarlah tangan kananmu mengajari engkau perbuatan-perbuatan yang dahsyat.",
Zabur,45,5,Zabur 45:5,"(45-6) Anak-anak panahmu tajam, menembus jantung musuh-musuh raja. Bangsa-bangsa jatuh di bawah kuasamu.",
Zabur,45,6,Zabur 45:6,"(45-7) Arasy-Mu, ya Allah, tetap untuk seterusnya dan selama-lamanya, dan tongkat kerajaan-Mu adalah tongkat keadilan.",
Zabur,45,7,Zabur 45:7,"(45-8) Engkau mencintai kebenaran dan membenci kefasikan. Sebab itu, Allah, Tuhanmu, telah mengurapimu dengan minyak kesukaan melebihi sekutu-sekutumu.",
Zabur,45,8,Zabur 45:8,"(45-9) Semua pakaianmu beraroma damar wangi, gaharu, dan cendana. Dari mahligai gading musik kecapi menyukakanmu.",
Zabur,45,9,Zabur 45:9,"(45-10) Putri-putri raja ada di antara perempuan-perempuan yang terhormat, di sebelah kananmu berdiri permaisuri dengan perhiasan emas dari Ofir.",
Zabur,45,10,Zabur 45:10,"(45-11) Dengarkanlah, hai putri, perhatikanlah dan pasanglah telingamu! Lupakanlah bangsamu dan rumah ayahmu.",
Zabur,45,11,Zabur 45:11,"(45-12) Sang raja terpesona karena keelokanmu! Dialah tuanmu, sujudlah memberi hormat kepadanya.",
Zabur,45,12,Zabur 45:12,"(45-13) Putri Tirus akan datang dengan persembahannya, orang-orang kaya di antara rakyat akan berupaya mengambil hatimu.",
Zabur,45,13,Zabur 45:13,(45-14) Semata-mata mulia putri raja itu di dalam mahligainya! Pakaiannya bersulamkan emas.,
Zabur,45,14,Zabur 45:14,"(45-15) Ia akan dihantar kepada raja dengan pakaian sulam. Sahabat-sahabatnya, yaitu anak-anak dara yang mengiringinya, dihantar pula kepadamu.",
Zabur,45,15,Zabur 45:15,"(45-16) Mereka dihantar dengan kesukaan dan kegembiraan, mereka masuk ke dalam mahligai raja.",
Zabur,45,16,Zabur 45:16,"(45-17) Anak-anakmu akan menggantikan para leluhurmu, engkau akan membuat mereka menjadi pembesar di seluruh bumi.",
Zabur,45,17,Zabur 45:17,(45-18) Aku akan memasyhurkan namamu turun-temurun sebab itu bangsa-bangsa akan memuji-muji engkau untuk seterusnya dan selama-lamanya.,
Zabur,46,1,Zabur 46:1,(46-1) Untuk pemimpin pujian. Dari bani Korah. Pada nada tinggi. Nyanyian. (46-2) Allah adalah tempat perlindungan dan kekuatan kita. Penolong yang senantiasa hadir di dalam kesesakan.,"Allah, Kota Benteng Kita"
Zabur,46,2,Zabur 46:2,"(46-3) Sebab itu, kita tidak akan takut sekalipun bumi berubah, sekalipun gunung-gunung guncang di tengah-tengah lautan,",
Zabur,46,3,Zabur 46:3,"(46-4) sekalipun airnya menderu dan berbuih, dan sekalipun gunung-gunung bergetar karena geloranya. S e l a",
Zabur,46,4,Zabur 46:4,"(46-5) Ada sungai yang anak-anak sungainya menyukakan kota Allah, yaitu tempat suci, kediaman Yang Mahatinggi.",
Zabur,46,5,Zabur 46:5,"(46-6) Allah hadir di dalamnya, kota itu tidak akan berguncang. Allah akan menolongnya ketika fajar terbit.",
Zabur,46,6,Zabur 46:6,"(46-7) Bangsa-bangsa gempar, kerajaan-kerajaan guncang, Ia memperdengarkan suara-Nya, lalu bumi meleleh.",
Zabur,46,7,Zabur 46:7,"(46-8) ALLAH, Tuhan semesta alam, menyertai kita, kota benteng kita adalah Tuhan yang disembah Yakub. S e l a",
Zabur,46,8,Zabur 46:8,"(46-9) Mari, lihatlah karya-karya ALLAH, pemusnahan diadakan-Nya di bumi.",
Zabur,46,9,Zabur 46:9,"(46-10) Ia menghentikan peperangan sampai ke ujung bumi. Ia mematahkan busur dan memotong tombak, Ia membakar kereta-kereta dengan api.",
Zabur,46,10,Zabur 46:10,"(46-11) “Diamlah dan ketahuilah bahwa Akulah Allah! Aku akan ditinggikan di antara bangsa-bangsa, Aku akan ditinggikan di bumi.”",
Zabur,46,11,Zabur 46:11,"(46-12) ALLAH, Tuhan semesta alam, menyertai kita, kota benteng kita ialah Tuhan yang disembah Yakub. S e l a",
Zabur,47,1,Zabur 47:1,"(47-1) Untuk pemimpin pujian. Syair dari bani Korah. (47-2) Hai segala bangsa, bertepuktanganlah! Bersorak-soraklah bagi Allah dengan seruan kegembiraan.","Allah, Raja Seluruh Bumi"
Zabur,47,2,Zabur 47:2,"(47-3) ALLAH Yang Mahatinggi adalah dahsyat, Ia Raja yang besar atas seluruh bumi.",
Zabur,47,3,Zabur 47:3,"(47-4) Ia menaklukkan bangsa-bangsa di bawah kekuasaan kita, suku-suku bangsa di bawah kaki kita.",
Zabur,47,4,Zabur 47:4,"(47-5) Ia memilih bagi kita tanah pusaka kita, kebanggaan Yakub yang dikasihi-Nya. S e l a",
Zabur,47,5,Zabur 47:5,"(47-6) Tuhan telah naik ke takhta-Nya diiringi sorak-sorai, ya ALLAH, diiringi bunyi sangkakala.",
Zabur,47,6,Zabur 47:6,"(47-7) Lantunkanlah puji-pujian bagi Allah, lantunkanlah! Lantunkanlah puji-pujian bagi Raja kita, lantunkanlah!",
Zabur,47,7,Zabur 47:7,"(47-8) Karena Allah adalah Raja atas seluruh bumi, lantunkanlah nyanyian pengajaran!",
Zabur,47,8,Zabur 47:8,"(47-9) Allah memerintah sebagai Raja atas bangsa-bangsa, Allah bersemayam di atas arasy-Nya yang suci.",
Zabur,47,9,Zabur 47:9,"(47-10) Para pemuka bangsa-bangsa berkumpul sebagai umat dari Tuhan yang disembah Ibrahim karena Allah sajalah yang mempunyai perisai-perisai bumi, Ia sangat diagungkan!",
Zabur,48,1,Zabur 48:1,"(48-1) Nyanyian. Syair dari bani Korah. (48-2) Mahabesar ALLAH dan sangat patut dipuji di kota Tuhan kita, di gunung-Nya yang suci.","Sion, Kota Tuhan"
Zabur,48,2,Zabur 48:2,"(48-3) Elok menjulang, kesukaan bagi seluruh bumi, itulah Gunung Sion di ujung sebelah utara, kota Raja Agung!",
Zabur,48,3,Zabur 48:3,(48-4) Dalam puri-puri-Nya Allah telah menunjukkan bahwa diri-Nya adalah kota benteng yang kuat.,
Zabur,48,4,Zabur 48:4,"(48-5) Perhatikanlah, raja-raja berkumpul, mereka maju bersama-sama.",
Zabur,48,5,Zabur 48:5,"(48-6) Segera setelah mereka melihat kota itu, tercenganglah mereka, lalu panik dan lari ketakutan.",
Zabur,48,6,Zabur 48:6,"(48-7) Kegentaran mencekam mereka di sana, dan mereka kesakitan seperti perempuan yang hendak melahirkan.",
