Book,Chapter,Verse,Ref,Indonesian,Subheading
Zabur,108,6,Zabur 108:6,"(108-7) Supaya orang-orang yang Kaukasihi terluput, selamatkanlah kami dengan tangan kanan-Mu dan jawablah kami.",
Zabur,108,7,Zabur 108:7,"(108-8) Allah telah berfirman di tempat suci-Nya, “Aku hendak bersukaria, Aku hendak membagi-bagi Sikhem, dan mengukur Lembah Sukot.",
Zabur,108,8,Zabur 108:8,"(108-9) Gilead adalah milik-Ku, Manasye pun milik-Ku. Efraim adalah pelindung kepala-Ku, dan Yuda adalah tongkat kerajaan-Ku.",
Zabur,108,9,Zabur 108:9,"(108-10) Moab adalah bejana pembasuhan-Ku, dan kepada Edom Aku akan mencampakkan kasut-Ku. Atas Filistea Aku akan bersorak-sorak dalam kemenangan.”",
Zabur,108,10,Zabur 108:10,(108-11) Siapa akan membawa aku ke kota yang berkubu? Siapa dapat mengantar aku sampai ke Edom?,
Zabur,108,11,Zabur 108:11,"(108-12) Bukankah Engkau, ya Allah, yang telah membuang kami? Engkau tidak lagi maju bersama-sama dengan tentara kami, ya Allah.",
Zabur,108,12,Zabur 108:12,(108-13) Berilah kami pertolongan terhadap lawan karena sia-sialah penyelamatan manusia.,
Zabur,108,13,Zabur 108:13,"(108-14) Dengan Allah, kita akan melakukan perbuatan yang gagah perkasa. Dialah yang akan menginjak-injak lawan-lawan kita.",
Zabur,109,1,Zabur 109:1,"Untuk pemimpin pujian. Syair Daud. Janganlah kiranya Engkau membiarkan, ya Allah yang kupuji-puji!",Doa Seorang yang Kena Fitnah
Zabur,109,2,Zabur 109:2,"Mulut orang fasik dan mulut penipu telah ternganga terhadapku, mereka berbicara melawan aku dengan lidah dusta.",
Zabur,109,3,Zabur 109:3,"Mereka mengepung aku dengan kata-kata kebencian, serta memerangi aku dengan tidak beralasan.",
Zabur,109,4,Zabur 109:4,"Sebagai balasan kasihku mereka menuduh aku, tetapi aku ini tetap berdoa.",
Zabur,109,5,Zabur 109:5,"Mereka membalas kebaikanku dengan kejahatan, dan kasihku dengan kebencian.",
Zabur,109,6,Zabur 109:6,"Tentukanlah seorang yang fasik untuk melawannya, biarlah seorang pendakwa berdiri di sebelah kanannya.",
Zabur,109,7,Zabur 109:7,"Apabila diadili, biarlah ia keluar sebagai orang bersalah, dan biarlah doanya diperhitungkan sebagai dosa.",
Zabur,109,8,Zabur 109:8,"Biarlah umurnya singkat, dan biarlah jabatannya diambil oleh orang lain.",
Zabur,109,9,Zabur 109:9,"Biarlah anak-anaknya menjadi yatim, dan istrinya menjadi janda.",
Zabur,109,10,Zabur 109:10,"Biarlah anak-anaknya keluyuran dan mengemis, serta meminta-minta dari reruntuhan tempat tinggal mereka.",
Zabur,109,11,Zabur 109:11,"Biarlah penagih utang merampas segala sesuatu yang ada padanya, dan orang lain merampas hasil jerih lelahnya.",
Zabur,109,12,Zabur 109:12,"Biarlah tidak ada yang terus menunjukkan kasih kepadanya, dan tidak ada yang menyayangi anak-anaknya yang yatim itu.",
Zabur,109,13,Zabur 109:13,"Biarlah penerusnya dilenyapkan, dan nama mereka terhapus dalam generasi berikutnya.",
Zabur,109,14,Zabur 109:14,"Biarlah kesalahan nenek moyangnya diingat oleh ALLAH, dan dosa ibunya jangan dihapuskan.",
Zabur,109,15,Zabur 109:15,"Biarlah semua itu senantiasa ada di hadapan ALLAH, dan ingatan terhadap mereka dilenyapkan dari muka bumi",
Zabur,109,16,Zabur 109:16,"sebab ia tidak ingat untuk menunjukkan kasih, melainkan memburu sampai mati orang yang sengsara dan melarat, dan yang hancur hati.",
Zabur,109,17,Zabur 109:17,"Ia suka mengutuki, jadi biarlah kutuk menimpanya! Ia tidak suka memohonkan berkah, jadi biarlah berkah menjauh darinya!",
Zabur,109,18,Zabur 109:18,"Ia memakai kutuk sebagai pakaiannya, kutuk itu merembes ke dalam tubuhnya seperti air, dan ke dalam tulang-tulangnya seperti minyak.",
Zabur,109,19,Zabur 109:19,"Biarlah kutuk itu menjadi seperti pakaian yang menyelubunginya, dan seperti ikat pinggang yang senantiasa diikatkan pada pinggangnya.",
Zabur,109,20,Zabur 109:20,"Biar inilah balasan ALLAH atas orang-orang yang menuduhku, dan atas orang-orang yang berbicara jahat terhadap aku.",
Zabur,109,21,Zabur 109:21,"Tetapi, Engkau, ya Allah ya Rabbi, bertindaklah bagiku karena nama-Mu, dan lepaskanlah aku karena kasih abadi-Mu yang baik.",
Zabur,109,22,Zabur 109:22,"Aku ini sengsara dan melarat, dan hatiku pun terluka di dalam diriku.",
Zabur,109,23,Zabur 109:23,"Aku lenyap seperti bayang-bayang memanjang di sore hari, aku dikebaskan seperti belalang.",
Zabur,109,24,Zabur 109:24,"Lututku lemah karena berpuasa, dan tubuhku menjadi kurus, habis lemaknya.",
Zabur,109,25,Zabur 109:25,"Aku pun telah menjadi bahan celaan bagi mereka, ketika mereka melihat aku, mereka menggeleng-gelengkan kepala.",
Zabur,109,26,Zabur 109:26,"Ya ALLAH, ya Tuhanku, tolonglah kiranya aku. Selamatkanlah aku sesuai dengan kasih abadi-Mu.",
Zabur,109,27,Zabur 109:27,"Biarlah mereka tahu bahwa ini adalah pekerjaan tangan-Mu, dan bahwa Engkau, ya ALLAH, yang telah melakukannya.",
Zabur,109,28,Zabur 109:28,"Biarlah mereka mengutuk, tetapi Engkau akan memberkahi. Jika mereka bangkit, mereka akan mendapat malu, tetapi hamba-Mu ini akan bersukacita.",
Zabur,109,29,Zabur 109:29,"Biarlah orang-orang yang menuduhku dikenakan pakaian aib, dan biarlah mereka berselubung rasa malunya sendiri seperti jubah.",
Zabur,109,30,Zabur 109:30,"Aku akan sangat mengucap syukur kepada ALLAH dengan mulutku, dan aku akan memuji Dia di tengah-tengah orang banyak",
Zabur,109,31,Zabur 109:31,karena Ia ada di sebelah kanan orang melarat untuk menyelamatkannya dari orang-orang yang menghukumnya.,
Zabur,110,1,Zabur 110:1,"Syair Daud. Demikianlah firman ALLAH kepada Junjunganku, “Duduklah di sebelah kanan-Ku, hingga Aku membuat musuh-musuhmu menjadi tumpuan kakimu.”",Penobatan Raja Imam
Zabur,110,2,Zabur 110:2,ALLAH akan mengulurkan tongkat kekuatanmu dari Sion. Memerintahlah di antara musuh-musuhmu!,
Zabur,110,3,Zabur 110:3,"Rakyatmu akan mempersembahkan diri dengan rela pada hari engkau mengerahkan pasukanmu dengan berhiaskan kesucian. Dari rahim sang fajar, orang-orang mudamu akan datang kepadamu seperti embun.",
Zabur,110,4,Zabur 110:4,"ALLAH telah bersumpah dan Ia tak akan menarik kembali keputusannya, “Engkau adalah imam untuk selama-lamanya menurut peraturan Malkisedik.”",
Zabur,110,5,Zabur 110:5,"Ya Rabbi, di sebelah kanan-Mu ia akan menghancurkan raja-raja pada hari murkanya.",
Zabur,110,6,Zabur 110:6,"Ia akan menghukum bangsa-bangsa, hingga penuh dengan mayat. Ia akan menghancurkan orang-orang yang jadi kepala di negeri yang luas.",
Zabur,110,7,Zabur 110:7,"Di tengah jalan ia akan minum dari sebuah sungai, sebab itu ia akan mengangkat kepalanya.",
Zabur,111,1,Zabur 111:1,Pujilah ALLAH! Aku akan mengucap syukur kepada Allah dengan sepenuh hati dalam kumpulan orang yang lurus hati dan dalam perhimpunan umat.,Kebajikan Allah
Zabur,111,2,Zabur 111:2,"Agung perbuatan-perbuatan ALLAH, layak diselidiki oleh semua orang yang menyukainya.",
Zabur,111,3,Zabur 111:3,"Perbuatan-Nya agung dan semarak, kebenaran-Nya tetap untuk selama-lamanya.",
Zabur,111,4,Zabur 111:4,Ia mengadakan peringatan bagi perbuatan-perbuatan-Nya yang ajaib. ALLAH itu Maha Pengasih dan Maha Penyayang.,
Zabur,111,5,Zabur 111:5,"Ia memberikan rezeki kepada orang-orang yang bertakwa kepada-Nya, Ia mengingat perjanjian-Nya untuk selama-lamanya.",
Zabur,111,6,Zabur 111:6,Kepada umat-Nya Ia telah menunjukkan kekuatan perbuatan-perbuatan-Nya dengan mengaruniakan kepada mereka milik pusaka bangsa-bangsa.,
Zabur,111,7,Zabur 111:7,"Ia setia dan adil dalam apa yang dibuat-Nya, segala titah-Nya dapat dipercaya.",
Zabur,111,8,Zabur 111:8,"Semuanya tetap untuk seterusnya dan selama-lamanya, dilakukan dalam kesetiaan dan kebenaran.",
Zabur,111,9,Zabur 111:9,"Ia telah mengirim tebusan bagi umat-Nya, dan menetapkan perjanjian-Nya untuk selama-lamanya. Nama-Nya suci dan dahsyat!",
Zabur,111,10,Zabur 111:10,"Ketakwaan kepada ALLAH adalah permulaan hikmat, semua orang yang melakukannya memiliki pemahaman yang baik. Puji-pujian kepada-Nya tetap untuk selama-lamanya!",
Zabur,112,1,Zabur 112:1,"Pujilah Allah! Berbahagialah orang yang bertakwa kepada ALLAH, yang sangat menyukai perintah-perintah-Nya.",Kebahagiaan Orang Benar
Zabur,112,2,Zabur 112:2,Keturunannya akan perkasa di bumi. Generasi orang yang lurus hati akan diberkahi.,
Zabur,112,3,Zabur 112:3,"Harta dan kekayaan ada di dalam rumahnya, kebenarannya tetap untuk selama-lamanya.",
Zabur,112,4,Zabur 112:4,"Di dalam kegelapan, terang terbit bagi orang yang lurus hati, yaitu orang yang pengasih, penyayang, dan benar.",
Zabur,112,5,Zabur 112:5,"Baiklah keadaan orang yang penuh belas kasihan dan yang suka memberi pinjaman, yang menangani urusannya dengan adil.",
Zabur,112,6,Zabur 112:6,Ia tak akan goyah untuk selama-lamanya; orang benar akan diingat untuk selama-lamanya.,
Zabur,112,7,Zabur 112:7,"Ia tidak takut pada kabar buruk, hatinya mantap serta percaya kepada ALLAH.",
Zabur,112,8,Zabur 112:8,"Hatinya teguh, ia tidak akan takut sampai ia memandang rendah lawan-lawannya.",
Zabur,112,9,Zabur 112:9,Ia dermawan dan memberi kepada orang melarat. Kebenarannya tetap untuk selama-lamanya dan kejayaannya bertambah dalam kehormatan.,
Zabur,112,10,Zabur 112:10,"Orang fasik melihat hal itu dan menjadi jengkel, ia pun mengertakkan giginya, lalu lenyap. Keinginan orang fasik akan binasa.",
Zabur,113,1,Zabur 113:1,"Pujilah ALLAH! Pujilah, hai hamba-hamba ALLAH, pujilah nama ALLAH!",Allah Meninggikan Orang Rendah
Zabur,113,2,Zabur 113:2,Segala puji bagi nama ALLAH dari sekarang sampai selama-lamanya!,
Zabur,113,3,Zabur 113:3,"Dari terbitnya matahari sampai terbenamnya, nama ALLAH patut dipuji.",
Zabur,113,4,Zabur 113:4,"ALLAH tinggi mengatasi segala bangsa, dan kemuliaan-Nya mengatasi langit.",
Zabur,113,5,Zabur 113:5,"Siapakah seperti ALLAH, Tuhan kita, yang bertakhta di tempat tinggi,",
Zabur,113,6,Zabur 113:6,dan yang membungkukkan diri-Nya untuk melihat ke langit dan ke bumi?,
Zabur,113,7,Zabur 113:7,"Ia mengangkat orang miskin dari dalam debu, dan mengeluarkan orang yang berkekurangan dari timbunan abu",
Zabur,113,8,Zabur 113:8,"untuk mendudukkan mereka bersama-sama dengan para bangsawan, dengan para bangsawan dari umat-Nya.",
Zabur,113,9,Zabur 113:9,"Ia mengaruniakan rumah tangga kepada perempuan yang mandul, dan menjadikannya ibu yang bersukacita dari anak-anaknya. Pujilah Allah!",
Zabur,114,1,Zabur 114:1,"Pada waktu orang Israil keluar dari Mesir, yaitu kaum keturunan Yakub dari bangsa yang lain bahasanya,",Pada Waktu Bani Israil Keluar dari Mesir
Zabur,114,2,Zabur 114:2,"Yuda menjadi tempat suci-Nya, dan Israil menjadi wilayah pemerintahan-Nya.",
Zabur,114,3,Zabur 114:3,"Laut menyaksikannya, lalu lari. Sungai Yordan berbalik arah.",
Zabur,114,4,Zabur 114:4,"Gunung-gunung melompat-lompat seperti domba jantan, dan bukit-bukit seperti anak domba.",
Zabur,114,5,Zabur 114:5,"Hai laut, mengapa engkau lari? Hai Yordan, mengapa engkau berbalik arah?",
Zabur,114,6,Zabur 114:6,"Hai gunung-gunung, mengapa kamu melompat-lompat seperti domba jantan, dan kamu, hai bukit-bukit, seperti anak domba?",
Zabur,114,7,Zabur 114:7,"Hai bumi, bergetarlah di hadapan ALLAH, di hadapan Tuhan yang disembah Yakub,",
Zabur,114,8,Zabur 114:8,"yang telah mengubah gunung batu menjadi kolam air, dan batu yang keras menjadi mata air.",
Zabur,115,1,Zabur 115:1,"Bukan kami, ya ALLAH, bukan kami, melainkan nama-Mulah yang patut dimuliakan karena kasih abadi-Mu dan kesetiaan-Mu.",Kemuliaan Hanya bagi Allah
Zabur,115,2,Zabur 115:2,"Mengapa bangsa-bangsa berkata, “Di mana Tuhan mereka?”",
Zabur,115,3,Zabur 115:3,"Tuhan kami ada di surga, dan apa pun yang dikehendaki-Nya, dilakukan-Nya.",
Zabur,115,4,Zabur 115:4,"Berhala-berhala mereka terbuat dari perak dan emas, hasil karya tangan manusia.",
Zabur,115,5,Zabur 115:5,"Berhala-berhala itu mempunyai mulut, tetapi tidak dapat berkata-kata; mempunyai mata, tetapi tidak dapat melihat;",
Zabur,115,6,Zabur 115:6,"mempunyai telinga, tetapi tidak dapat mendengar; mempunyai hidung, tetapi tidak dapat mencium;",
Zabur,115,7,Zabur 115:7,"mempunyai tangan, tetapi tidak dapat meraba; mempunyai kaki, tetapi tidak dapat berjalan; dan tidak pula dapat mengeluarkan suara dari kerongkongannya.",
Zabur,115,8,Zabur 115:8,"Orang-orang yang membuatnya menjadi sama seperti berhala-berhala itu, yaitu semua orang yang percaya kepadanya.",
Zabur,115,9,Zabur 115:9,"Hai Israil, percayalah kepada ALLAH! Ia adalah Penolong dan Perisai mereka.",
Zabur,115,10,Zabur 115:10,"Hai kaum keturunan Harun, percayalah kepada ALLAH! Ia adalah Penolong dan Perisai mereka.",
Zabur,115,11,Zabur 115:11,"Hai orang-orang yang bertakwa kepada ALLAH, percayalah kepada ALLAH! Ia adalah Penolong dan Perisai mereka.",
Zabur,115,12,Zabur 115:12,"ALLAH mengingat kita dan akan memberkahi kita. Ia akan memberkahi kaum keturunan Israil, Ia akan memberkahi kaum keturunan Harun,",
Zabur,115,13,Zabur 115:13,"dan Ia akan memberkahi orang-orang yang bertakwa kepada ALLAH, baik kecil maupun besar.",
Zabur,115,14,Zabur 115:14,"Kiranya ALLAH membuat kamu bertambah, baik kamu maupun anak-anakmu.",
Zabur,115,15,Zabur 115:15,"Kiranya kamu dilimpahi berkah oleh ALLAH, yang menjadikan langit dan bumi.",
Zabur,115,16,Zabur 115:16,"Langit tertinggi adalah milik ALLAH, tetapi bumi ini telah dikaruniakan-Nya kepada bani Adam.",
Zabur,115,17,Zabur 115:17,"Orang-orang mati tidak akan memuji-muji ALLAH, demikian pula semua orang yang telah turun ke tempat yang sunyi.",
Zabur,115,18,Zabur 115:18,"Tetapi, kita akan memuji ALLAH dari sekarang sampai selama-lamanya. Pujilah Allah!",
Zabur,116,1,Zabur 116:1,Aku mengasihi ALLAH sebab Ia mendengar seruanku dan permohonan-permohonanku.,Terluput dari Belenggu Maut
Zabur,116,2,Zabur 116:2,"Karena Ia mendengarkan aku, aku akan berseru kepada-Nya seumur hidupku.",
Zabur,116,3,Zabur 116:3,"Tali-tali maut membelit aku, sengsara alam kubur menimpa aku, aku mengalami kesesakan dan dukacita.",
Zabur,116,4,Zabur 116:4,"Kemudian, aku berseru kepada nama ALLAH, “Ya ALLAH, luputkanlah jiwaku!”",
Zabur,116,5,Zabur 116:5,"ALLAH itu Maha Pengasih, lagi benar. Tuhan kita itu Maha Penyayang.",
Zabur,116,6,Zabur 116:6,"ALLAH melindungi orang-orang yang lugu. Ketika aku lemah, Ia menyelamatkan aku.",
Zabur,116,7,Zabur 116:7,"Hai jiwaku, kembalilah tenang karena ALLAH telah berbuat baik kepadamu.",
Zabur,116,8,Zabur 116:8,"Ya, Engkau telah melepaskan jiwaku dari maut, mataku dari air mata, dan kakiku dari tersandung.",
Zabur,116,9,Zabur 116:9,"Aku akan berjalan di hadapan ALLAH, di negeri orang-orang hidup.",
Zabur,116,10,Zabur 116:10,"Aku tetap percaya, bahkan ketika aku berkata, “Aku sangat menderita.”",
Zabur,116,11,Zabur 116:11,"Dalam ketakutanku, aku berkata, “Semua orang adalah pembohong.”",
Zabur,116,12,Zabur 116:12,Apakah yang dapat kupersembahkan kepada ALLAH untuk membalas segala kebajikan-Nya kepadaku?,
Zabur,116,13,Zabur 116:13,Aku akan mengangkat cawan keselamatan dan berseru kepada nama ALLAH.,
Zabur,116,14,Zabur 116:14,Aku akan membayar nazarku kepada ALLAH di hadapan seluruh umat-Nya.,
Zabur,116,15,Zabur 116:15,Berharga dalam pandangan ALLAH kematian orang-orang saleh-Nya.,
Zabur,116,16,Zabur 116:16,"Ya ALLAH, sesungguhnya aku ini hamba-Mu. Akulah hamba-Mu, anak dari hamba-Mu perempuan. Engkau telah membuka ikatan-ikatanku.",
Zabur,116,17,Zabur 116:17,Aku akan mempersembahkan kurban syukur kepada-Mu dan berseru kepada nama ALLAH.,
Zabur,116,18,Zabur 116:18,"Aku akan membayar nazarku kepada ALLAH di hadapan seluruh umat-Nya,",
Zabur,116,19,Zabur 116:19,"di pelataran Bait ALLAH, di tengah-tengahmu, hai Yerusalem! Pujilah Allah!",
Zabur,117,1,Zabur 117:1,"Pujilah ALLAH, hai segala bangsa! Megahkanlah Dia, hai segala suku bangsa!","Pujilah Allah, Hai Segala Bangsa!"
Zabur,117,2,Zabur 117:2,"Karena besar kasih abadi-Nya kepada kita, dan kesetiaan ALLAH kekal selama-lamanya. Pujilah Allah!",
Zabur,118,1,Zabur 118:1,"Mengucap syukurlah kepada ALLAH karena Ia baik, kasih-Nya kekal selama-lamanya.",Lantunan Puji-pujian
Zabur,118,2,Zabur 118:2,"Biarlah orang Israil berkata, “Kasih-Nya kekal selama-lamanya.”",
Zabur,118,3,Zabur 118:3,"Biarlah kaum keturunan Harun berkata, “Kasih-Nya kekal selama-lamanya.”",
Zabur,118,4,Zabur 118:4,"Biarlah orang-orang yang bertakwa kepada ALLAH berkata, “Kasih-Nya kekal selama-lamanya.”",
Zabur,118,5,Zabur 118:5,"Di dalam kesesakan aku berseru kepada ALLAH, ALLAH pun menjawab aku dengan memberi kelegaan.",
Zabur,118,6,Zabur 118:6,"ALLAH menyertai aku, aku tidak akan takut. Apa yang dapat dilakukan manusia terhadap aku?",
Zabur,118,7,Zabur 118:7,ALLAH menyertai aku untuk menolongku. Aku akan memandang rendah orang-orang yang membenci aku.,
Zabur,118,8,Zabur 118:8,Lebih baik berlindung pada ALLAH daripada percaya pada manusia.,
Zabur,118,9,Zabur 118:9,Lebih baik berlindung pada ALLAH daripada percaya pada para pemuka.,
Zabur,118,10,Zabur 118:10,"Segala bangsa mengepung aku, tetapi dengan nama ALLAH kutumpas mereka!",
Zabur,118,11,Zabur 118:11,"Mereka mengepung aku, ya, mereka mengepung aku, tetapi dengan nama ALLAH kutumpas mereka!",
Zabur,118,12,Zabur 118:12,"Mereka mengepung aku seperti lebah, tetapi mereka dipadamkan seperti api yang membakar semak duri. Dengan nama ALLAH kutumpas mereka!",
Zabur,118,13,Zabur 118:13,"Aku didorong dengan keras supaya aku terjatuh, tetapi Allah menolong aku.",
Zabur,118,14,Zabur 118:14,ALLAH adalah kekuatanku dan puji-pujianku. Ia telah menjadi keselamatanku.,
Zabur,118,15,Zabur 118:15,"Ada suara sorak-sorai dan kemenangan di dalam perkemahan orang-orang benar, “Tangan kanan ALLAH melakukan perbuatan yang gagah perkasa!",
Zabur,118,16,Zabur 118:16,Tangan kanan ALLAH ditinggikan! Tangan kanan ALLAH melakukan perbuatan yang gagah perkasa!”,
Zabur,118,17,Zabur 118:17,"Aku tidak akan mati, melainkan hidup, serta memasyhurkan perbuatan-perbuatan ALLAH.",
Zabur,118,18,Zabur 118:18,"ALLAH telah menghukum aku dengan keras, tetapi Ia tidak menyerahkan aku kepada maut.",
Zabur,118,19,Zabur 118:19,"Bukakanlah bagiku pintu-pintu gerbang kebenaran, aku hendak masuk melaluinya dan mengucap syukur kepada ALLAH.",
Zabur,118,20,Zabur 118:20,"Inilah pintu gerbang ALLAH, orang-orang benar akan masuk melaluinya.",
Zabur,118,21,Zabur 118:21,"Aku hendak mengucap syukur kepada-Mu sebab Engkau telah menjawab aku, dan telah menjadi keselamatanku.",
Zabur,118,22,Zabur 118:22,Batu yang dibuang oleh tukang-tukang bangunan telah menjadi batu penjuru utama.,
Zabur,118,23,Zabur 118:23,"Ini adalah pekerjaan ALLAH, ajaib di mata kita.",
Zabur,118,24,Zabur 118:24,"Inilah hari yang ALLAH jadikan, mari kita bergembira dan bersukacita karenanya.",
Zabur,118,25,Zabur 118:25,"Ya ALLAH, selamatkanlah! Ya ALLAH, berikanlah kiranya keberhasilan!",
Zabur,118,26,Zabur 118:26,Diberkahilah dia yang datang dalam nama ALLAH! Kami memohonkan berkah bagimu dari dalam Bait ALLAH.,
Zabur,118,27,Zabur 118:27,"ALLAH adalah Tuhan, dan Ia telah menyinari kita. Ikatlah kurban hari raya dengan tali pada tanduk-tanduk mazbah.",
Zabur,118,28,Zabur 118:28,"Engkaulah Tuhanku, aku hendak mengucap syukur kepada-Mu! Engkaulah Tuhanku, aku hendak mengagungkan Engkau!",
Zabur,118,29,Zabur 118:29,"Mengucap syukurlah kepada ALLAH karena Ia baik, kasih-Nya kekal selama-lamanya.",
Zabur,119,1,Zabur 119:1,"Berbahagialah orang-orang yang hidupnya tidak bercela, yang hidup menurut hukum ALLAH.",Bahagianya Orang yang Hidup Menurut Hukum Allah
Zabur,119,2,Zabur 119:2,"Berbahagialah orang-orang yang mematuhi peringatan-peringatan-Nya, yang mencari Dia dengan sepenuh hati,",
Zabur,119,3,Zabur 119:3,"dan yang tidak melakukan kezaliman, melainkan hidup menurut jalan-jalan-Nya.",
Zabur,119,4,Zabur 119:4,Titah-titah-Mu telah Kautetapkan supaya dipegang teguh-teguh.,
Zabur,119,5,Zabur 119:5,Kiranya jalanku mantap untuk memegang teguh ketetapan-ketetapan-Mu!,
Zabur,119,6,Zabur 119:6,"Maka, aku tidak akan mendapat malu apabila aku memperhatikan segala perintah-Mu.",
Zabur,119,7,Zabur 119:7,Aku hendak mengucap syukur kepada-Mu dengan tulus hati ketika aku mempelajari peraturan-peraturan-Mu yang benar.,
Zabur,119,8,Zabur 119:8,"Aku hendak memegang teguh ketetapan-ketetapan-Mu, janganlah sekali-kali meninggalkan aku.",
Zabur,119,9,Zabur 119:9,Dengan apakah seorang muda menjaga kesucian hidupnya? Dengan menjaganya sesuai dengan firman-Mu.,
Zabur,119,10,Zabur 119:10,"Aku mencari Engkau dengan sepenuh hati, jangan biarkan aku menyimpang dari perintah-perintah-Mu.",
Zabur,119,11,Zabur 119:11,Janji-Mu kutaruh di dalam hatiku supaya aku tidak berdosa kepada-Mu.,
Zabur,119,12,Zabur 119:12,"Segala puji bagi-Mu, ya ALLAH! Ajarilah aku ketetapan-ketetapan-Mu.",
Zabur,119,13,Zabur 119:13,Dengan bibirku aku memasyhurkan segala peraturan yang Kausampaikan.,
Zabur,119,14,Zabur 119:14,Aku senang atas arahan peringatan-peringatan-Mu bagaikan senangnya atas segala kekayaan.,
Zabur,119,15,Zabur 119:15,"Aku hendak merenungkan titah-titah-Mu, serta memperhatikan jalan-jalan-Mu.",
Zabur,119,16,Zabur 119:16,"Aku akan bersenang-senang karena ketetapan-ketetapan-Mu, dan tidak akan melupakan firman-Mu.",
Zabur,119,17,Zabur 119:17,"Lakukanlah kebajikan terhadap hamba-Mu supaya aku dapat hidup, dan aku akan memegang teguh firman-Mu.",
Zabur,119,18,Zabur 119:18,Bukakanlah mataku supaya aku dapat melihat hal-hal yang ajaib dari hukum-Mu.,
Zabur,119,19,Zabur 119:19,"Aku ini seorang pendatang di bumi, janganlah menyembunyikan perintah-perintah-Mu dariku.",
Zabur,119,20,Zabur 119:20,Hatiku remuk karena rindu kepada peraturan-peraturan-Mu setiap saat.,
Zabur,119,21,Zabur 119:21,"Engkau menghardik orang-orang angkuh, yaitu orang-orang yang terkutuk, yang menyimpang dari perintah-perintah-Mu.",
Zabur,119,22,Zabur 119:22,Singkirkanlah dariku celaan dan hinaan karena aku mematuhi peringatan-peringatan-Mu.,
Zabur,119,23,Zabur 119:23,"Meskipun para pembesar duduk berunding untuk melawan aku, hamba-Mu ini akan merenungkan ketetapan-ketetapan-Mu.",
Zabur,119,24,Zabur 119:24,Peringatan-peringatan-Mu menjadi kesukaanku dan penasihat-penasihatku.,
Zabur,119,25,Zabur 119:25,"Jiwaku melekat kepada debu, hidupkanlah aku sesuai dengan firman-Mu.",
Zabur,119,26,Zabur 119:26,"Aku telah menceritakan jalan-jalan hidupku, dan Engkau pun menjawab aku. Ajarilah aku ketetapan-ketetapan-Mu.",
Zabur,119,27,Zabur 119:27,Berilah aku pengertian tentang arahan titah-titah-Mu maka aku akan merenungkan perbuatan-perbuatan-Mu yang ajaib.,
Zabur,119,28,Zabur 119:28,"Jiwaku menangis karena dukacita, kuatkanlah aku sesuai dengan firman-Mu.",
Zabur,119,29,Zabur 119:29,"Jauhkanlah dariku jalan dusta, dan karena kemurahan hati-Mu ajarilah aku hukum-Mu.",
Zabur,119,30,Zabur 119:30,"Aku telah memilih jalan kebenaran, peraturan-peraturan-Mu telah kutaruh di hadapanku.",
Zabur,119,31,Zabur 119:31,"Aku berpaut pada peringatan-peringatan-Mu. Ya ALLAH, janganlah mempermalukan aku.",
Zabur,119,32,Zabur 119:32,Aku berlari di jalur perintah-perintah-Mu karena Engkau melapangkan hatiku.,
Zabur,119,33,Zabur 119:33,"Ya ALLAH, ajarilah aku arahan ketetapan-ketetapan-Mu maka aku akan mematuhinya sampai akhir.",
Zabur,119,34,Zabur 119:34,"Berilah aku pengertian maka aku akan mematuhi hukum-Mu, dan memegangnya teguh dengan sepenuh hatiku.",
Zabur,119,35,Zabur 119:35,Tuntunlah aku dalam jalur perintah-perintah-Mu karena itulah kesukaanku.,
Zabur,119,36,Zabur 119:36,"Condongkanlah hatiku pada peringatan-peringatan-Mu, dan bukan pada laba haram.",
Zabur,119,37,Zabur 119:37,"Jauhkanlah mataku dari melihat hal yang sia-sia, hidupkanlah aku dalam jalan-jalan-Mu.",
Zabur,119,38,Zabur 119:38,"Teguhkanlah kepada hamba-Mu janji-Mu, yang diperuntukkan bagi orang yang bertakwa kepada-Mu.",
Zabur,119,39,Zabur 119:39,Jauhkanlah celaku yang kutakuti itu karena peraturan-peraturan-Mu baik.,
Zabur,119,40,Zabur 119:40,"Lihatlah, aku merindukan titah-titah-Mu. Hidupkanlah aku di dalam kebenaran-Mu.",
Zabur,119,41,Zabur 119:41,"Ya ALLAH, kiranya kasih abadi-Mu datang padaku, dan keselamatan dari-Mu sesuai dengan janji-Mu.",
Zabur,119,42,Zabur 119:42,"Dengan demikian, aku dapat menjawab orang-orang yang mencela aku karena aku percaya kepada firman-Mu.",
Zabur,119,43,Zabur 119:43,Janganlah sekali-kali mengambil firman kebenaran dari mulutku karena aku berharap pada peraturan-peraturan-Mu.,
Zabur,119,44,Zabur 119:44,Aku akan selalu memegang teguh hukum-Mu untuk seterusnya dan selama-lamanya.,
Zabur,119,45,Zabur 119:45,Aku akan hidup dalam kelegaan karena aku mencari titah-titah-Mu.,
Zabur,119,46,Zabur 119:46,"Aku pun akan berbicara tentang peringatan-peringatan-Mu di hadapan raja-raja, dan aku tidak akan malu.",
Zabur,119,47,Zabur 119:47,Aku akan bersenang-senang karena perintah-perintah-Mu yang kucintai itu.,
Zabur,119,48,Zabur 119:48,"Aku akan mengangkat tangan untuk memuliakan perintah-perintah-Mu yang kucintai itu, dan aku akan merenungkan ketetapan-ketetapan-Mu.",
Zabur,119,49,Zabur 119:49,Ingatlah firman yang Kausampaikan kepada hamba-Mu sebab Engkau telah memberi aku harapan.,
Zabur,119,50,Zabur 119:50,Inilah penghiburanku di dalam kesusahanku bahwa janji-Mu menghidupkan aku.,
Zabur,119,51,Zabur 119:51,"Orang angkuh mencemooh aku dengan sangat, tetapi aku tidak menyimpang dari hukum-Mu.",
Zabur,119,52,Zabur 119:52,"Aku ingat peraturan-peraturan-Mu yang ada sejak dahulu kala, ya ALLAH, dan aku terhibur.",
Zabur,119,53,Zabur 119:53,Rasa panas mencekam aku karena orang-orang fasik yang mengabaikan hukum-Mu.,
Zabur,119,54,Zabur 119:54,Ketetapan-ketetapan-Mu menjadi nyanyian-nyanyianku di rumah tempat aku tinggal sebagai pendatang.,
Zabur,119,55,Zabur 119:55,"Pada malam hari aku mengingat nama-Mu, ya ALLAH, dan aku memegang teguh hukum-Mu.",
Zabur,119,56,Zabur 119:56,Inilah yang menjadi bagianku sebab aku telah mematuhi titah-titah-Mu.,
Zabur,119,57,Zabur 119:57,"ALLAH adalah Pusakaku, aku telah berjanji untuk memegang teguh firman-Mu.",
Zabur,119,58,Zabur 119:58,"Aku memohon belas kasihan-Mu dengan sepenuh hati, kasihanilah aku sesuai dengan janji-Mu.",
Zabur,119,59,Zabur 119:59,"Aku memikirkan jalan-jalan hidupku, dan mengarahkan kakiku menuju peringatan-peringatan-Mu.",
Zabur,119,60,Zabur 119:60,Aku bersegera dan tidak berlambat-lambat untuk memegang teguh perintah-perintah-Mu.,
Zabur,119,61,Zabur 119:61,"Tali-tali orang-orang fasik membelit aku, tetapi aku tidak melupakan hukum-Mu.",
