Book,Chapter,Verse,Ref,Arabic,Indonesian,KitabSuci,Notes
Yohanes,9,38,Yohanes 9:38,فَقَالَ: «أُومِنُ يَا سَيِّدُ!». وَسَجَدَ لَهُ.,"Orang itu menjawab, “Tuhan, aku percaya!” Kemudian, dia sujud di hadapan-Nya.","Kata orang itu, “Ya Junjungan, aku percaya!” Lalu, ia sujud di hadapan-Nya.",
Yohanes,9,39,Yohanes 9:39,فَقَالَ يَسُوعُ: «لِدَيْنُونَةٍ أَتَيْتُ أَنَا إِلَى هَذَا ٱلْعَالَمِ، حَتَّى يُبْصِرَ ٱلَّذِينَ لَا يُبْصِرُونَ وَيَعْمَى ٱلَّذِينَ يُبْصِرُونَ».,"Yesus berkata, “Untuk penghakiman, Aku datang ke dunia ini supaya mereka yang tidak melihat, dapat melihat, dan mereka yang melihat, menjadi buta.”","Kemudian, sabda Isa, “Kedatangan-Ku ke dunia ini adalah untuk menghakimi supaya orang yang tidak melihat dapat melihat dan orang yang dapat melihat menjadi buta.”",
Yohanes,9,40,Yohanes 9:40,فَسَمِعَ هَذَا ٱلَّذِينَ كَانُوا مَعَهُ مِنَ ٱلْفَرِّيسِيِّينَ، وَقَالُوا لَهُ: «أَلَعَلَّنَا نَحْنُ أَيْضًا عُمْيَانٌ؟».,"Beberapa orang Farisi yang ada di dekat-Nya mendengar hal itu, dan berkata kepada-Nya, “Apakah kami juga buta?”","Orang-orang dari mazhab Farisi yang ada di dekat Isa mendengar perkataan-Nya. Lalu, kata mereka kepada-Nya, “Apakah kami buta juga?”",
Yohanes,9,41,Yohanes 9:41,قَالَ لَهُمْ يَسُوعُ: «لَوْ كُنْتُمْ عُمْيَانًا لَمَا كَانَتْ لَكُمْ خَطِيَّةٌ. وَلَكِنِ ٱلْآنَ تَقُولُونَ إِنَّنَا نُبْصِرُ، فَخَطِيَّتُكُمْ بَاقِيَةٌ.,"Yesus berkata kepada mereka, “Jika kamu buta, kamu tidak memiliki dosa; tetapi karena kamu berkata, ‘Kami melihat,’ dosamu tetap ada.”","Sabda Isa kepada mereka, “Sekiranya kamu buta, kamu tidak berdosa. Tetapi, karena sekarang kamu berkata, ‘Kami dapat melihat,’ maka dosamu itu tetap ada.”",
Yohanes,10,1,Yohanes 10:1,«اَلْحَقَّ ٱلْحَقَّ أَقُولُ لَكُمْ: إِنَّ ٱلَّذِي لَا يَدْخُلُ مِنَ ٱلْبَابِ إِلَى حَظِيرَةِ ٱلْخِرَافِ، بَلْ يَطْلَعُ مِنْ مَوْضِعٍ آخَرَ، فَذَاكَ سَارِقٌ وَلِصٌّ.,"Yesus berkata, “Sesungguhnya, Aku mengatakan kepadamu, orang yang masuk ke kandang domba dengan tidak melalui pintu, melainkan dengan memanjat melalui jalan lain, orang itu adalah pencuri dan perampok.","“Sesungguhnya, Aku berkata kepadamu, siapa masuk ke dalam kandang domba tanpa melalui pintu, tetapi memanjat dari tempat lain, ia adalah pencuri dan penyamun.",
Yohanes,10,2,Yohanes 10:2,وَأَمَّا ٱلَّذِي يَدْخُلُ مِنَ ٱلْبَابِ فَهُوَ رَاعِي ٱلْخِرَافِ.,"Akan tetapi, orang yang masuk melalui pintu adalah gembala domba.",Sedangkan orang yang masuk melalui pintu adalah gembala dari domba-domba dalam kandang itu.,
Yohanes,10,3,Yohanes 10:3,لِهَذَا يَفْتَحُ ٱلْبَوَّابُ، وَٱلْخِرَافُ تَسْمَعُ صَوْتَهُ، فَيَدْعُو خِرَافَهُ ٱلْخَاصَّةَ بِأَسْمَاءٍ وَيُخْرِجُهَا.,"Baginya, penjaga pintu membukakan pintu, dan domba-domba mendengar suaranya, dan dia memanggil domba-dombanya sendiri dengan nama mereka, serta menuntun mereka ke luar.","Penjaga pintu akan membukakan pintu baginya, dan domba-domba mendengarkan suaranya. Domba-domba itu dipanggilnya sesuai dengan nama masing-masing, lalu dituntunnya keluar.",
Yohanes,10,4,Yohanes 10:4,وَمَتَى أَخْرَجَ خِرَافَهُ ٱلْخَاصَّةَ يَذْهَبُ أَمَامَهَا، وَٱلْخِرَافُ تَتْبَعُهُ، لِأَنَّهَا تَعْرِفُ صَوْتَهُ.,"Setelah mengeluarkan semua dombanya, dia berjalan di depan mereka dan domba-dombanya akan mengikuti dia karena mereka mengenal suaranya.","Setelah semua domba dikeluarkannya, ia berjalan di depan, lalu domba-domba itu mengikutinya sebab mereka mengenali suaranya.",
Yohanes,10,5,Yohanes 10:5,وَأَمَّا ٱلْغَرِيبُ فَلَا تَتْبَعُهُ بَلْ تَهْرُبُ مِنْهُ، لِأَنَّهَا لَا تَعْرِفُ صَوْتَ ٱلْغُرَبَاءِ».,"Orang asing tidak akan mereka ikuti, tetapi mereka akan lari darinya karena mereka tidak mengenal suara orang-orang asing.”",Domba-domba itu tidak akan pernah mengikuti orang yang asing. Mereka akan lari dari orang itu sebab mereka tidak mengenali suaranya yang asing.”,
Yohanes,10,6,Yohanes 10:6,هَذَا ٱلْمَثَلُ قَالَهُ لَهُمْ يَسُوعُ، وَأَمَّا هُمْ فَلَمْ يَفْهَمُوا مَا هُوَ ٱلَّذِي كَانَ يُكَلِّمُهُمْ بِهِ.,"Perumpamaan itulah yang dikatakan Yesus kepada mereka, tetapi mereka tidak mengerti apa yang baru saja Yesus katakan kepada mereka.","Ibarat itu disampaikan Isa kepada mereka, tetapi mereka tidak mengerti maksud dari apa yang disabdakan-Nya kepada mereka.",
Yohanes,10,7,Yohanes 10:7,فَقَالَ لَهُمْ يَسُوعُ أَيْضًا: «ٱلْحَقَّ ٱلْحَقَّ أَقُولُ لَكُمْ: إِنِّي أَنَا بَابُ ٱلْخِرَافِ.,"Oleh sebab itu, Yesus berkata lagi kepada mereka, “Sesungguhnya, Aku berkata kepadamu, Akulah pintu ke domba-domba itu.","Kemudian, Isa kembali bersabda kepada mereka, “Sesungguhnya, Aku berkata kepadamu, Akulah pintu bagi domba-domba itu.",
Yohanes,10,8,Yohanes 10:8,جَمِيعُ ٱلَّذِينَ أَتَوْا قَبْلِي هُمْ سُرَّاقٌ وَلُصُوصٌ، وَلَكِنَّ ٱلْخِرَافَ لَمْ تَسْمَعْ لَهُمْ.,"Semua orang yang datang sebelum Aku adalah pencuri dan perampok, tetapi domba-domba itu tidak mendengar mereka.","Semua orang yang datang mendahului Aku adalah pencuri dan penyamun, dan domba-domba itu tidak mendengarkan mereka.",
Yohanes,10,9,Yohanes 10:9,أَنَا هُوَ ٱلْبَابُ. إِنْ دَخَلَ بِي أَحَدٌ فَيَخْلُصُ وَيَدْخُلُ وَيَخْرُجُ وَيَجِدُ مَرْعًى.,"Akulah pintu. Jika seseorang masuk melalui Aku, dia akan diselamatkan, dan akan keluar masuk, serta menemukan padang rumput.","Akulah pintu. Jika seseorang masuk melalui Aku, ia akan selamat dan akan keluar masuk serta mendapatkan makanan.",
Yohanes,10,10,Yohanes 10:10,اَلسَّارِقُ لَا يَأْتِي إِلَّا لِيَسْرِقَ وَيَذْبَحَ وَيُهْلِكَ، وَأَمَّا أَنَا فَقَدْ أَتَيْتُ لِتَكُونَ لَهُمْ حَيَاةٌ وَلِيَكُونَ لَهُمْ أَفْضَلُ.,"Pencuri datang hanya untuk mencuri, membunuh, dan membinasakan; Aku datang supaya mereka memiliki hidup, dan memilikinya secara berlimpah.","Pencuri datang hanya untuk mencuri, membunuh, dan membinasakan. Sebaliknya, Aku datang dengan maksud supaya domba-domba itu mempunyai hidup, dan mempunyainya berlimpah-limpah.",
Yohanes,10,11,Yohanes 10:11,أَنَا هُوَ ٱلرَّاعِي ٱلصَّالِحُ، وَٱلرَّاعِي ٱلصَّالِحُ يَبْذِلُ نَفْسَهُ عَنِ ٱلْخِرَافِ.,Akulah gembala yang baik; gembala yang baik memberikan nyawa-Nya bagi domba-domba.,Akulah gembala yang baik. Gembala yang baik menyerahkan nyawanya bagi domba-dombanya.,
Yohanes,10,12,Yohanes 10:12,وَأَمَّا ٱلَّذِي هُوَ أَجِيرٌ، وَلَيْسَ رَاعِيًا، ٱلَّذِي لَيْسَتِ ٱلْخِرَافُ لَهُ، فَيَرَى ٱلذِّئْبَ مُقْبِلًا وَيَتْرُكُ ٱلْخِرَافَ وَيَهْرُبُ، فَيَخْطَفُ ٱلذِّئْبُ ٱلْخِرَافَ وَيُبَدِّدُهَا.,"Seorang upahan, bukan seorang gembala, yang bukan pemilik domba-domba itu, melihat serigala datang, dia meninggalkan domba-domba itu dan lari; serigala itu akan menerkam dan mencerai-beraikan domba-domba itu.","Sedangkan seorang upahan dan yang bukan gembala, yaitu yang bukan pemilik domba-domba itu, akan meninggalkan domba-domba itu dan melarikan diri apabila ia melihat serigala datang. Dengan demikian, serigala akan merebut domba-domba itu, lalu mencerai-beraikan mereka.",
Yohanes,10,13,Yohanes 10:13,وَٱلْأَجِيرُ يَهْرُبُ لِأَنَّهُ أَجِيرٌ، وَلَا يُبَالِي بِٱلْخِرَافِ.,Dia lari karena dia seorang upahan dan tidak peduli dengan domba-domba itu.,Ia lari sebab ia adalah seorang upahan dan tidak peduli dengan domba-domba itu.,
Yohanes,10,14,Yohanes 10:14,أَمَّا أَنَا فَإِنِّي ٱلرَّاعِي ٱلصَّالِحُ، وَأَعْرِفُ خَاصَّتِي وَخَاصَّتِي تَعْرِفُنِي،,Akulah gembala yang baik. Aku mengenal domba-domba-Ku dan domba-domba-Ku mengenal Aku,"Akulah gembala yang baik. Aku mengenal domba-domba-Ku dan domba-domba-Ku mengenal Aku,",
Yohanes,10,15,Yohanes 10:15,كَمَا أَنَّ ٱلْآبَ يَعْرِفُنِي وَأَنَا أَعْرِفُ ٱلْآبَ. وَأَنَا أَضَعُ نَفْسِي عَنِ ٱلْخِرَافِ.,sama seperti Bapa mengenal Aku dan Aku mengenal Bapa; dan Aku memberikan nyawa-Ku bagi domba-domba itu.,sama seperti Sang Bapa mengenal Aku dan Aku mengenal Sang Bapa. Aku menyerahkan nyawa-Ku bagi domba-domba-Ku.,
Yohanes,10,16,Yohanes 10:16,وَلِي خِرَافٌ أُخَرُ لَيْسَتْ مِنْ هَذِهِ ٱلْحَظِيرَةِ، يَنْبَغِي أَنْ آتِيَ بِتِلْكَ أَيْضًا فَتَسْمَعُ صَوْتِي، وَتَكُونُ رَعِيَّةٌ وَاحِدَةٌ وَرَاعٍ وَاحِدٌ.,"Aku juga mempunyai domba-domba lain yang bukan dari kandang ini; Aku harus membawa mereka juga, dan mereka akan mendengar suara-Ku; dan mereka akan menjadi satu kawanan dengan satu gembala.",Pada-Ku masih ada domba-domba lain yang bukan dari kawanan ini. Domba-domba itu pun harus Kubawa dan suara-Ku akan mereka dengar. Domba-domba itu akan menjadi satu kawanan dengan satu gembala.,
Yohanes,10,17,Yohanes 10:17,لِهَذَا يُحِبُّنِي ٱلْآبُ، لِأَنِّي أَضَعُ نَفْسِي لِآخُذَهَا أَيْضًا.,"Karena inilah, Bapa mengasihi Aku, sebab Aku memberikan nyawa-Ku supaya Aku dapat mengambilnya kembali.",Sang Bapa mengasihi Aku karena Aku menyerahkan nyawa-Ku untuk mengambilnya kembali.,
Yohanes,10,18,Yohanes 10:18,لَيْسَ أَحَدٌ يَأْخُذُهَا مِنِّي، بَلْ أَضَعُهَا أَنَا مِنْ ذَاتِي. لِي سُلْطَانٌ أَنْ أَضَعَهَا وَلِي سُلْطَانٌ أَنْ آخُذَهَا أَيْضًا. هَذِهِ ٱلْوَصِيَّةُ قَبِلْتُهَا مِنْ أَبِي».,"Tidak seorang pun telah mengambilnya dari-Ku, melainkan Akulah yang memberikannya menurut kehendak-Ku sendiri. Aku mempunyai hak untuk memberikan nyawa-Ku, dan Aku juga mempunyai hak untuk mengambilnya kembali. Inilah perintah yang Aku terima dari Bapa-Ku.”","Tak seorang pun mengambilnya dari Aku, tetapi Aku menyerahkannya atas kehendak-Ku sendiri. Aku memiliki wewenang untuk menyerahkannya, dan juga wewenang untuk mengambilnya kembali. Perintah ini Kuterima dari Bapa-Ku.”",
Yohanes,10,19,Yohanes 10:19,فَحَدَثَ أَيْضًا ٱنْشِقَاقٌ بَيْنَ ٱلْيَهُودِ بِسَبَبِ هَذَا ٱلْكَلَامِ.,"Sekali lagi, ada perpecahan di antara orang-orang Yahudi karena perkataan Yesus itu.","Kemudian, terjadi lagi perselisihan di antara orang-orang Israil karena semua yang disabdakan Isa.",
Yohanes,10,20,Yohanes 10:20,فَقَالَ كَثِيرُونَ مِنْهُمْ: «بِهِ شَيْطَانٌ وَهُوَ يَهْذِي. لِمَاذَا تَسْتَمِعُونَ لَهُ؟».,"Banyak dari mereka yang berkata, “Dia kerasukan roh jahat dan menjadi gila. Mengapa kalian mendengarkan Dia?”","Banyak dari mereka yang berkata, “Ia kerasukan setan dan gila! Mengapa kamu mendengarkan-Nya?”",
Yohanes,10,21,Yohanes 10:21,آخَرُونَ قَالُوا: «لَيْسَ هَذَا كَلَامَ مَنْ بِهِ شَيْطَانٌ. أَلَعَلَّ شَيْطَانًا يَقْدِرُ أَنْ يَفْتَحَ أَعْيُنَ ٱلْعُمْيَانِ؟».,"Yang lain berkata, “Itu bukan perkataan seorang yang kerasukan roh jahat. Dapatkah roh jahat membuka mata orang buta?”","Ada pula yang berkata, “Itu bukan perkataan orang yang kerasukan setan. Adakah setan yang membuat mata orang buta dapat melihat?”",
Yohanes,10,22,Yohanes 10:22,وَكَانَ عِيدُ ٱلتَّجْدِيدِ فِي أُورُشَلِيمَ، وَكَانَ شِتَاءٌ.,"Pada waktu itu, hari raya Penahbisan berlangsung di Yerusalem. Saat itu musim dingin,","Hari raya Pentahbisan Bait Allah di Yerusalem telah tiba, dan saat itu bertepatan dengan musim dingin.",
Yohanes,10,23,Yohanes 10:23,وَكَانَ يَسُوعُ يَتَمَشَّى فِي ٱلْهَيْكَلِ فِي رِوَاقِ سُلَيْمَانَ،,"dan Yesus sedang berjalan di Bait Allah, yaitu di Serambi Salomo .","Isa berjalan-jalan di Bait Allah, di Serambi Sulaiman.",
Yohanes,10,24,Yohanes 10:24,فَٱحْتَاطَ بِهِ ٱلْيَهُودُ وَقَالُوا لَهُ: «إِلَى مَتَى تُعَلِّقُ أَنْفُسَنَا؟ إِنْ كُنْتَ أَنْتَ ٱلْمَسِيحَ فَقُلْ لَنَا جَهْرًا».,"Lalu, orang-orang Yahudi berkumpul mengelilingi Dia dan berkata kepada-Nya, “Berapa lama lagi Engkau membiarkan jiwa kami bimbang? Jika Engkau Kristus, katakanlah terus terang kepada kami.”","Lalu, orang-orang Israil mengelilingi-Nya serta berkata, “Berapa lama lagi Engkau membuat hati kami bimbang? Jika Engkau memang Al-Masih, katakanlah kepada kami secara terus terang.”",
Yohanes,10,25,Yohanes 10:25,أَجَابَهُمْ يَسُوعُ: «إِنِّي قُلْتُ لَكُمْ وَلَسْتُمْ تُؤْمِنُونَ. اَلْأَعْمَالُ ٱلَّتِي أَنَا أَعْمَلُهَا بِٱسْمِ أَبِي هِيَ تَشْهَدُ لِي.,"Yesus menjawab mereka, “Aku sudah mengatakannya kepadamu, tetapi kamu tidak percaya. Pekerjaan-pekerjaan yang Aku lakukan dalam nama Bapa-Ku, itulah yang memberikan kesaksian tentang Aku.","Sabda Isa kepada mereka, “Sudah Kukatakan kepadamu, tetapi kamu tidak juga percaya. Semua pekerjaan yang Aku perbuat dalam nama Bapa-Ku, itulah yang menjadi saksi bagi-Ku,",
Yohanes,10,26,Yohanes 10:26,وَلَكِنَّكُمْ لَسْتُمْ تُؤْمِنُونَ لِأَنَّكُمْ لَسْتُمْ مِنْ خِرَافِي، كَمَا قُلْتُ لَكُمْ.,"Akan tetapi, kamu tidak percaya karena kamu tidak termasuk domba-domba-Ku.",tetapi kamu tidak percaya sebab kamu bukan termasuk kawanan domba-domba-Ku.,
Yohanes,10,27,Yohanes 10:27,خِرَافِي تَسْمَعُ صَوْتِي، وَأَنَا أَعْرِفُهَا فَتَتْبَعُنِي.,"Domba-domba-Ku mendengar suara-Ku, Aku mengenal mereka dan mereka mengikuti Aku.",Domba-domba-Ku mendengarkan suara-Ku. Aku mengenal mereka dan mereka mengikuti Aku.,
Yohanes,10,28,Yohanes 10:28,وَأَنَا أُعْطِيهَا حَيَاةً أَبَدِيَّةً، وَلَنْ تَهْلِكَ إِلَى ٱلْأَبَدِ، وَلَا يَخْطَفُهَا أَحَدٌ مِنْ يَدِي.,"Aku memberikan hidup kekal kepada mereka, dan mereka tidak akan pernah binasa; dan tak seorang pun dapat merebut mereka dari tangan-Ku.","Aku memberikan hidup kekal kepada mereka dan mereka tidak akan binasa sampai selama-lamanya. Selain itu, tak seorang pun akan merebut mereka dari tangan-Ku.",
Yohanes,10,29,Yohanes 10:29,أَبِي ٱلَّذِي أَعْطَانِي إِيَّاهَا هُوَ أَعْظَمُ مِنَ ٱلْكُلِّ، وَلَا يَقْدِرُ أَحَدٌ أَنْ يَخْطَفَ مِنْ يَدِ أَبِي.,"Bapa-Ku, yang telah memberikan mereka kepada-Ku, lebih besar daripada semua, dan tidak ada seorang pun dapat merebut mereka dari tangan Bapa.","Bapa-Ku, yang memberikan mereka kepada-Ku, lebih besar daripada semuanya sehingga tak seorang pun dapat merebut mereka dari tangan Sang Bapa.",
Yohanes,10,30,Yohanes 10:30,أَنَا وَٱلْآبُ وَاحِدٌ».,Aku dan Bapa adalah satu.”,Aku dan Sang Bapa satu adanya.”,
Yohanes,10,31,Yohanes 10:31,فَتَنَاوَلَ ٱلْيَهُودُ أَيْضًا حِجَارَةً لِيَرْجُمُوهُ.,"Sekali lagi, orang-orang Yahudi mengambil batu untuk melempari Yesus.","Lalu, orang-orang Israil kembali memungut batu hendak merajam Isa.",
Yohanes,10,32,Yohanes 10:32,أَجَابَهُمْ يَسُوعُ: «أَعْمَالًا كَثِيرَةً حَسَنَةً أَرَيْتُكُمْ مِنْ عِنْدِ أَبِي. بِسَبَبِ أَيِّ عَمَلٍ مِنْهَا تَرْجُمُونَنِي؟».,"Akan tetapi, Yesus berkata kepada mereka, “Aku telah menunjukkan kepadamu banyak pekerjaan baik dari Bapa, pekerjaan manakah dari antaranya yang membuatmu hendak melempari Aku dengan batu?”","Sabda Isa kepada mereka, “Banyak perbuatan baik dari Bapa-Ku yang Kutunjukkan kepadamu. Jadi, karena perbuatan yang manakah kamu hendak merajam Aku?”",
Yohanes,10,33,Yohanes 10:33,أَجَابَهُ ٱلْيَهُودُ قَائِلِينَ: «لَسْنَا نَرْجُمُكَ لِأَجْلِ عَمَلٍ حَسَنٍ، بَلْ لِأَجْلِ تَجْدِيفٍ، فَإِنَّكَ وَأَنْتَ إِنْسَانٌ تَجْعَلُ نَفْسَكَ إِلَهًا».,"Orang-orang Yahudi itu menjawab Dia, “Bukan karena suatu pekerjaan baik kami hendak melempari Engkau dengan batu, melainkan karena hujat; dan karena Engkau, yang hanya seorang manusia, menjadikan diri-Mu Allah.”","Jawab orang-orang Israil kepada-Nya, “Kami hendak merajam Engkau bukan karena perbuatan baik yang Kaulakukan, melainkan karena penghujahan. Engkau hanya seorang manusia, tetapi Engkau menyamakan dirimu dengan Allah.”",
Yohanes,10,34,Yohanes 10:34,أَجَابَهُمْ يَسُوعُ: «أَلَيْسَ مَكْتُوبًا فِي نَامُوسِكُمْ: أَنَا قُلْتُ إِنَّكُمْ آلِهَةٌ؟,"Yesus menjawab mereka, “Bukankah tertulis dalam Kitab Tauratmu, ‘Aku telah berfirman, Kamu adalah allah ?’","Sabda Isa kepada mereka, “Bukankah telah tertulis di dalam Kitab Suci Tauratmu, ‘Aku sudah bersabda: Kamu adalah ilahi’?",
Yohanes,10,35,Yohanes 10:35,إِنْ قَالَ آلِهَةٌ لِأُولَئِكَ ٱلَّذِينَ صَارَتْ إِلَيْهِمْ كَلِمَةُ ٱللهِ، وَلَا يُمْكِنُ أَنْ يُنْقَضَ ٱلْمَكْتُوبُ،,"Jika Allah menyebut mereka yang menerima firman itu ‘allah’, padahal Kitab Suci tidak bisa dibatalkan,","Jadi, jika orang-orang itu disebut sebagai ilahi karena firman Allah ditujukan kepada mereka (padahal Kitab Suci tidak dapat dibatalkan),",
Yohanes,10,36,Yohanes 10:36,فَٱلَّذِي قَدَّسَهُ ٱلْآبُ وَأَرْسَلَهُ إِلَى ٱلْعَالَمِ، أَتَقُولُونَ لَهُ: إِنَّكَ تُجَدِّفُ، لِأَنِّي قُلْتُ: إِنِّي ٱبْنُ ٱللهِ؟,"apakah kamu mengatakan tentang Dia yang telah Bapa kuduskan dan utus ke dalam dunia, ‘Engkau menghujat,’ karena Aku berkata kepadamu, ‘Aku adalah Anak Allah’?","masakan kamu berkata kepada Dia yang dikuduskan oleh Sang Bapa dan yang diutus-Nya ke dalam dunia ini, ‘Engkau menghujah,’ hanya karena Aku berkata, ‘Aku adalah Sang Anak yang datang dari Allah’?",
Yohanes,10,37,Yohanes 10:37,إِنْ كُنْتُ لَسْتُ أَعْمَلُ أَعْمَالَ أَبِي فَلَا تُؤْمِنُوا بِي.,"Jika Aku tidak melakukan pekerjaan-pekerjaan Bapa-Ku, jangan percaya kepada-Ku.","Jika Aku tidak melakukan pekerjaan-pekerjaan Bapa-Ku, jangan percaya kepada-Ku.",
Yohanes,10,38,Yohanes 10:38,وَلَكِنْ إِنْ كُنْتُ أَعْمَلُ، فَإِنْ لَمْ تُؤْمِنُوا بِي فَآمِنُوا بِٱلْأَعْمَالِ، لِكَيْ تَعْرِفُوا وَتُؤْمِنُوا أَنَّ ٱلْآبَ فِيَّ وَأَنَا فِيهِ».,"Akan tetapi, jika Aku melakukan pekerjaan-pekerjaan itu, meskipun kamu tidak percaya kepada-Ku, percayalah akan pekerjaan-pekerjaan itu supaya kamu tahu dan mengerti bahwa Bapa di dalam Aku, dan Aku di dalam Bapa.”","Tetapi, jika Aku melakukannya dan kamu tidak percaya kepada-Ku, percayalah karena pekerjaan-pekerjaan itu supaya kamu tahu dan mengerti bahwa Sang Bapa di dalam Aku, dan Aku di dalam Sang Bapa.”",
Yohanes,10,39,Yohanes 10:39,فَطَلَبُوا أَيْضًا أَنْ يُمْسِكُوهُ فَخَرَجَ مِنْ أَيْدِيهِمْ،,"Sekali lagi, mereka mencoba menangkap Yesus, tetapi Ia lolos dari mereka.","Mereka kembali mencari jalan untuk menangkap Isa, tetapi Ia lolos dari tangan mereka.",
Yohanes,10,40,Yohanes 10:40,وَمَضَى أَيْضًا إِلَى عَبْرِ ٱلْأُرْدُنِّ إِلَى ٱلْمَكَانِ ٱلَّذِي كَانَ يُوحَنَّا يُعَمِّدُ فِيهِ أَوَّلًا وَمَكَثَ هُنَاكَ.,"Lalu, Yesus pergi lagi menyeberangi Sungai Yordan menuju tempat Yohanes pertama kali membaptis dahulu dan Yesus tinggal di sana.","Kemudian, Isa pergi lagi ke seberang Sungai Yordan, ke tempat Yahya mula-mula mempermandikan orang-orang yang bertobat, lalu tinggallah Ia di situ.",
Yohanes,10,41,Yohanes 10:41,فَأَتَى إِلَيْهِ كَثِيرُونَ وَقَالُوا: «إِنَّ يُوحَنَّا لَمْ يَفْعَلْ آيَةً وَاحِدَةً، وَلَكِنْ كُلُّ مَا قَالَهُ يُوحَنَّا عَنْ هَذَا كَانَ حَقًّا».,"Banyak orang datang kepada-Nya dan berkata, “Meskipun Yohanes tidak melakukan satu tanda ajaib pun, tetapi semua yang dikatakan Yohanes tentang Orang ini benar.”","Banyak orang datang kepada-Nya dan berkata, “Nabi Yahya tidak membuat satu tanda ajaib pun, tetapi semua yang dikatakannya mengenai orang ini memang benar.”",
Yohanes,10,42,Yohanes 10:42,فَآمَنَ كَثِيرُونَ بِهِ هُنَاكَ.,"Dan, banyak orang menjadi percaya kepada-Nya di sana.",Di situ pun banyak orang menjadi percaya kepada Isa.,
Yohanes,11,1,Yohanes 11:1,وَكَانَ إِنْسَانٌ مَرِيضًا وَهُوَ لِعَازَرُ، مِنْ بَيْتِ عَنْيَا مِنْ قَرْيَةِ مَرْيَمَ وَمَرْثَا أُخْتِهَا.,"Ada seorang laki-laki yang sedang sakit, namanya Lazarus dari Betania, kampung Maria dan saudarinya, Marta.","Ada seorang yang sedang sakit bernama Lazarus. Ia tinggal di Baitani, yaitu kampung asal Maryam dan Marta, saudaranya.",
Yohanes,11,2,Yohanes 11:2,وَكَانَتْ مَرْيَمُ، ٱلَّتِي كَانَ لِعَازَرُ أَخُوهَا مَرِيضًا، هِيَ ٱلَّتِي دَهَنَتِ ٱلرَّبَّ بِطِيبٍ، وَمَسَحَتْ رِجْلَيْهِ بِشَعْرِهَا.,"Maria inilah perempuan yang pernah meminyaki kaki Yesus dengan minyak wangi dan menyeka kaki-Nya dengan rambutnya, yang saudara laki-lakinya, Lazarus, saat itu sakit.",Maryam adalah perempuan yang pernah meminyaki Sang Junjungan dengan minyak wangi dan menyeka kaki-Nya dengan rambutnya. Sedangkan Lazarus yang sedang sakit itu adalah saudaranya.,
Yohanes,11,3,Yohanes 11:3,فَأَرْسَلَتِ ٱلْأُخْتَانِ إِلَيْهِ قَائِلَتَيْنِ: «يَا سَيِّدُ، هُوَذَا ٱلَّذِي تُحِبُّهُ مَرِيضٌ».,"Sebab itu, kedua saudari ini mengirimkan kabar kepada-Nya dengan berkata, “Tuhan, orang yang Engkau kasihi sedang sakit.”","Kedua saudara Lazarus yang perempuan itu menyuruh orang untuk menemui Isa dengan pesan, “Ya Junjungan, orang yang Engkau kasihi jatuh sakit.”",
Yohanes,11,4,Yohanes 11:4,فَلَمَّا سَمِعَ يَسُوعُ، قَالَ: «هَذَا ٱلْمَرَضُ لَيْسَ لِلْمَوْتِ، بَلْ لِأَجْلِ مَجْدِ ٱللهِ، لِيَتَمَجَّدَ ٱبْنُ ٱللهِ بِهِ».,"Namun, ketika Yesus mendengar kabar itu, Dia berkata, “Penyakit itu tidak akan menyebabkan kematian, tetapi akan menyatakan kemuliaan Allah supaya Anak Allah dimuliakan melaluinya.”","Setelah hal itu didengar oleh Isa, bersabdalah Ia, “Penyakit itu tidak akan membawa kematian, melainkan akan menyatakan kemuliaan Allah. Melalui penyakit itu, Sang Anak yang datang dari Allah akan dimuliakan.”",
Yohanes,11,5,Yohanes 11:5,وَكَانَ يَسُوعُ يُحِبُّ مَرْثَا وَأُخْتَهَا وَلِعَازَرَ.,"Yesus memang mengasihi Marta, dan saudara perempuannya, dan Lazarus.","Isa mengasihi Marta dan saudara perempuannya, serta Lazarus.",
Yohanes,11,6,Yohanes 11:6,فَلَمَّا سَمِعَ أَنَّهُ مَرِيضٌ مَكَثَ حِينَئِذٍ فِي ٱلْمَوْضِعِ ٱلَّذِي كَانَ فِيهِ يَوْمَيْنِ.,"Jadi, ketika Yesus mendengar bahwa Lazarus sakit, Dia sengaja tinggal dua hari lagi di tempat Dia berada.","Meskipun demikian, ketika Ia mendengar bahwa Lazarus sakit, Ia tinggal di tempat itu dua hari lagi.",
Yohanes,11,7,Yohanes 11:7,ثُمَّ بَعْدَ ذَلِكَ قَالَ لِتَلَامِيذِهِ: «لِنَذْهَبْ إِلَى ٱلْيَهُودِيَّةِ أَيْضًا».,"Sesudah itu, Yesus berkata kepada murid-murid-Nya, “Mari kita pergi lagi ke Yudea.”","Setelah itu, bersabdalah Ia kepada para pengikut-Nya, “Marilah kita kembali ke Yudea.”",
