Book,Chapter,Verse,Ref,Arabic,Indonesian,KitabSuci,Notes
Yohanes,15,24,Yohanes 15:24,لَوْ لَمْ أَكُنْ قَدْ عَمِلْتُ بَيْنَهُمْ أَعْمَالًا لَمْ يَعْمَلْهَا أَحَدٌ غَيْرِي، لَمْ تَكُنْ لَهُمْ خَطِيَّةٌ، وَأَمَّا ٱلْآنَ فَقَدْ رَأَوْا وَأَبْغَضُونِي أَنَا وَأَبِي.,"Seandainya Aku tidak melakukan di antara mereka pekerjaan-pekerjaan yang tidak pernah dilakukan orang lain, mereka tidak akan memiliki dosa. Akan tetapi sekarang, mereka telah melihat, tetapi tetap membenci Aku dan Bapa-Ku.","Jika di antara mereka Aku tidak melakukan pekerjaan-pekerjaan yang memang tidak pernah dilakukan oleh seorang pun, tentu mereka tidak berdosa. Tetapi sekarang, meskipun mereka sudah menyaksikannya, tetap saja mereka membenci Aku dan juga Bapa-Ku.",
Yohanes,15,25,Yohanes 15:25,لَكِنْ لِكَيْ تَتِمَّ ٱلْكَلِمَةُ ٱلْمَكْتُوبَةُ فِي نَامُوسِهِمْ: إِنَّهُمْ أَبْغَضُونِي بِلَا سَبَبٍ.,"Namun, firman yang tertulis dalam kitab Taurat mereka harus digenapi: ‘Mereka membenci Aku tanpa alasan.’","Namun, yang demikian itu terjadi supaya genaplah apa yang telah tertulis dalam Kitab Suci mereka, ‘Mereka membenci Aku tanpa alasan.’",
Yohanes,15,26,Yohanes 15:26,«وَمَتَى جَاءَ ٱلْمُعَزِّي ٱلَّذِي سَأُرْسِلُهُ أَنَا إِلَيْكُمْ مِنَ ٱلْآبِ، رُوحُ ٱلْحَقِّ، ٱلَّذِي مِنْ عِنْدِ ٱلْآبِ يَنْبَثِقُ، فَهُوَ يَشْهَدُ لِي.,"Ketika Penolong itu datang, yang akan Aku utus kepadamu dari Bapa, yaitu Roh Kebenaran yang berasal dari Bapa, Dia akan bersaksi tentang Aku.","Apabila Sang Penolong yang akan Kuutus kepadamu dari Sang Bapa telah datang, yaitu Ruh Kebenaran yang datang dari Sang Bapa, maka Ia akan bersaksi tentang Aku.",
Yohanes,15,27,Yohanes 15:27,وَتَشْهَدُونَ أَنْتُمْ أَيْضًا لِأَنَّكُمْ مَعِي مِنَ ٱلِٱبْتِدَاءِ.,"Dan, kamu juga akan bersaksi karena kamu telah bersama-Ku sejak semula.”","Selain itu, kamu pun harus bersaksi karena sejak semula kamu bersama Aku.”",
Yohanes,16,1,Yohanes 16:1,«قَدْ كَلَّمْتُكُمْ بِهَذَا لِكَيْ لَا تَعْثُرُوا.,“Semua ini telah Aku katakan kepadamu supaya kamu tidak terguncang.,“Semua itu Kukatakan kepadamu supaya imanmu tidak goyah.,
Yohanes,16,2,Yohanes 16:2,سَيُخْرِجُونَكُمْ مِنَ ٱلْمَجَامِعِ، بَلْ تَأْتِي سَاعَةٌ فِيهَا يَظُنُّ كُلُّ مَنْ يَقْتُلُكُمْ أَنَّهُ يُقَدِّمُ خِدْمَةً لِلهِ.,"Mereka akan mengusirmu dari sinagoge. Bahkan, waktunya akan tiba bahwa setiap orang yang membunuhmu akan berpikir bahwa mereka sedang berbakti kepada Allah.","Kamu akan disingkirkan dari rumah-rumah ibadah mereka, bahkan akan datang waktunya, siapa saja yang membunuh kamu akan menyangka bahwa ia beribadah kepada Allah.",
Yohanes,16,3,Yohanes 16:3,وَسَيَفْعَلُونَ هَذَا بِكُمْ لِأَنَّهُمْ لَمْ يَعْرِفُوا ٱلْآبَ وَلَا عَرَفُونِي.,"Dan, hal-hal itu akan mereka lakukan karena mereka tidak mengenal Bapa ataupun Aku.",Hal itu akan mereka lakukan karena mereka tidak mengenal Sang Bapa dan juga Aku.,
Yohanes,16,4,Yohanes 16:4,لَكِنِّي قَدْ كَلَّمْتُكُمْ بِهَذَا حَتَّى إِذَا جَاءَتِ ٱلسَّاعَةُ تَذْكُرُونَ أَنِّي أَنَا قُلْتُهُ لَكُمْ. وَلَمْ أَقُلْ لَكُمْ مِنَ ٱلْبِدَايَةِ لِأَنِّي كُنْتُ مَعَكُمْ.,"Akan tetapi, semua itu sudah Aku katakan kepadamu supaya apabila waktunya datang, kamu ingat bahwa Aku telah mengatakannya kepadamu. Dan, hal-hal ini tidak Aku katakan kepadamu pada awalnya karena Aku masih bersamamu.","Tetapi, Aku sudah memberitahukan kepadamu tentang hal-hal itu supaya apabila waktunya tiba, kamu ingat bahwa Aku sudah mengatakannya kepadamu.”",
Yohanes,16,5,Yohanes 16:5,«وَأَمَّا ٱلْآنَ فَأَنَا مَاضٍ إِلَى ٱلَّذِي أَرْسَلَنِي، وَلَيْسَ أَحَدٌ مِنْكُمْ يَسْأَلُنِي: أَيْنَ تَمْضِي؟,"Akan tetapi, sekarang Aku akan pergi kepada Dia yang mengutus Aku, dan tidak seorang pun dari kamu yang menanyai Aku, ‘Ke mana Engkau akan pergi?’","(16-4b) “Hal itu tidak Kukatakan kepadamu sejak semula karena Aku masih bersama-sama dengan kamu. (16-5) Tetapi sekarang, Aku akan pergi kepada Dia yang mengutus Aku. Tak seorang pun dari antara kamu bertanya kepada-Ku, ‘Ke mana Engkau hendak pergi?’",
Yohanes,16,6,Yohanes 16:6,لَكِنْ لِأَنِّي قُلْتُ لَكُمْ هَذَا قَدْ مَلَأَ ٱلْحُزْنُ قُلُوبَكُمْ.,"Namun, karena Aku telah mengatakan semua ini kepadamu, kesedihan memenuhi hatimu.",Hatimu memang penuh dukacita karena Aku mengatakan hal itu kepadamu.,
Yohanes,16,7,Yohanes 16:7,لَكِنِّي أَقُولُ لَكُمُ ٱلْحَقَّ: إِنَّهُ خَيْرٌ لَكُمْ أَنْ أَنْطَلِقَ، لِأَنَّهُ إِنْ لَمْ أَنْطَلِقْ لَا يَأْتِيكُمُ ٱلْمُعَزِّي، وَلَكِنْ إِنْ ذَهَبْتُ أُرْسِلُهُ إِلَيْكُمْ.,"Akan tetapi, Aku beritahukan kebenaran kepadamu: lebih baik bagimu jika Aku pergi karena jika Aku tidak pergi, Penolong itu tidak akan datang kepadamu; tetapi jika Aku pergi, Aku akan mengutus-Nya kepadamu.","Meskipun begitu, Aku mengatakan apa yang sebenarnya kepadamu bahwa kepergian-Ku itu lebih berfaedah bagimu. Karena jika Aku tidak pergi, Sang Penolong tidak akan datang kepadamu. Sebaliknya, jika Aku pergi, maka Aku akan mengutus Dia kepadamu.",
Yohanes,16,8,Yohanes 16:8,وَمَتَى جَاءَ ذَاكَ يُبَكِّتُ ٱلْعَالَمَ عَلَى خَطِيَّةٍ وَعَلَى بِرٍّ وَعَلَى دَيْنُونَةٍ:,"Dan, ketika Penolong itu datang, Dia akan menyadarkan dunia akan dosa, kebenaran, dan penghakiman ;","Kedatangan-Nya akan menginsafkan dunia perihal dosa, perihal apa yang benar, dan perihal penghakiman.",
Yohanes,16,9,Yohanes 16:9,أَمَّا عَلَى خَطِيَّةٍ فَلِأَنَّهُمْ لَا يُؤْمِنُونَ بِي،,"tentang dosa, karena mereka tidak percaya kepada-Ku;",Perihal dosa sebab mereka tidak percaya kepada-Ku;,
Yohanes,16,10,Yohanes 16:10,وَأَمَّا عَلَى بِرٍّ فَلِأَنِّي ذَاهِبٌ إِلَى أَبِي وَلَا تَرَوْنَنِي أَيْضًا،,"tentang kebenaran, karena Aku pergi kepada Bapa dan kamu tidak akan melihat Aku lagi,",perihal apa yang benar sebab Aku pergi kepada Sang Bapa dan kamu tidak melihat Aku lagi;,
Yohanes,16,11,Yohanes 16:11,وَأَمَّا عَلَى دَيْنُونَةٍ فَلِأَنَّ رَئِيسَ هَذَا ٱلْعَالَمِ قَدْ دِينَ.,"dan tentang penghakiman, karena penguasa dunia ini telah dihakimi.",dan perihal penghakiman sebab si penguasa dunia ini telah dihukum.,
Yohanes,16,12,Yohanes 16:12,«إِنَّ لِي أُمُورًا كَثِيرَةً أَيْضًا لِأَقُولَ لَكُمْ، وَلَكِنْ لَا تَسْتَطِيعُونَ أَنْ تَحْتَمِلُوا ٱلْآنَ.,"Masih banyak hal yang ingin Aku katakan kepadamu, tetapi kamu tidak dapat menanggungnya sekarang.","Masih banyak hal yang hendak Kukatakan kepadamu, tetapi sekarang kamu belum dapat menanggungnya.",
Yohanes,16,13,Yohanes 16:13,وَأَمَّا مَتَى جَاءَ ذَاكَ، رُوحُ ٱلْحَقِّ، فَهُوَ يُرْشِدُكُمْ إِلَى جَمِيعِ ٱلْحَقِّ، لِأَنَّهُ لَا يَتَكَلَّمُ مِنْ نَفْسِهِ، بَلْ كُلُّ مَا يَسْمَعُ يَتَكَلَّمُ بِهِ، وَيُخْبِرُكُمْ بِأُمُورٍ آتِيَةٍ.,"Namun, ketika Dia, Roh Kebenaran itu datang, Dia akan membimbingmu ke dalam semua kebenaran. Sebab, Dia tidak berbicara atas keinginan-Nya sendiri, melainkan semua hal yang Dia dengar itulah yang akan Dia katakan; dan Dia akan memberitahumu hal-hal yang akan terjadi.","Tetapi, apabila Ia datang, yaitu Ruh Kebenaran, Ia akan memimpin kamu pada semua jalan kebenaran. Ia tidak akan mengatakan apa yang berasal dari diri-Nya sendiri, tetapi apa yang didengar-Nya, itulah yang akan dikatakan-Nya. Ia pun akan memberitahukan kepadamu hal-hal yang akan datang.",
Yohanes,16,14,Yohanes 16:14,ذَاكَ يُمَجِّدُنِي، لِأَنَّهُ يَأْخُذُ مِمَّا لِي وَيُخْبِرُكُمْ.,"Dia akan memuliakan Aku karena Dia akan menerima yang Aku terima, dan akan memberitahukannya kepadamu.","Ia akan memuliakan Aku karena Ia akan menerima apa yang berasal dari-Ku, lalu memberitakannya kepadamu.",
Yohanes,16,15,Yohanes 16:15,كُلُّ مَا لِلْآبِ هُوَ لِي. لِهَذَا قُلْتُ: إِنَّهُ يَأْخُذُ مِمَّا لِي وَيُخْبِرُكُمْ.,"Segala sesuatu yang Bapa miliki adalah milik-Ku. Oleh sebab itu, Aku mengatakan bahwa Roh Kebenaran akan memberitakan kepadamu apa yang diterima-Nya dari-Ku.”","Segala sesuatu yang ada pada Sang Bapa adalah kepunyaan-Ku. Itulah sebabnya, Aku berkata, Ia akan menerima apa yang berasal dari-Ku dan memberitakannya kepadamu.”",
Yohanes,16,16,Yohanes 16:16,بَعْدَ قَلِيلٍ لَا تُبْصِرُونَنِي، ثُمَّ بَعْدَ قَلِيلٍ أَيْضًا تَرَوْنَنِي، لِأَنِّي ذَاهِبٌ إِلَى ٱلْآبِ».,"“Tinggal sesaat saja, dan kamu tidak akan melihat Aku lagi; dan sekali lagi, tinggal sesaat saja, dan kamu akan melihat Aku.”","“Tidak lama lagi kamu tidak akan melihat Aku lagi, tetapi kemudian dalam waktu yang tidak lama pula kamu akan kembali melihat Aku.”",
Yohanes,16,17,Yohanes 16:17,فَقَالَ قَوْمٌ مِنْ تَلَامِيذِهِ، بَعْضُهُمْ لِبَعْضٍ: «مَا هُوَ هَذَا ٱلَّذِي يَقُولُهُ لَنَا: بَعْدَ قَلِيلٍ لَا تُبْصِرُونَنِي، ثُمَّ بَعْدَ قَلِيلٍ أَيْضًا تَرَوْنَنِي، وَلِأَنِّي ذَاهِبٌ إِلَى ٱلْآبِ؟».,"Beberapa murid Yesus saling bertanya, “Apa maksud-Nya Dia berkata kepada kita, ‘Tinggal sesaat saja, dan kamu tidak akan melihat Aku lagi; dan sekali lagi, tinggal sesaat saja, dan kamu akan melihat Aku?’ dan ‘karena Aku akan pergi kepada Bapa’?”","Lalu, beberapa orang pengikut-Nya berkata satu kepada yang lain, “Apa yang dimaksudkan-Nya, ‘Tidak lama lagi kamu tidak akan melihat Aku lagi’? Kemudian, ‘Dalam waktu yang tidak lama pula kamu akan kembali melihat Aku,’ serta ‘Aku pergi kepada Sang Bapa’?”",
Yohanes,16,18,Yohanes 16:18,فَقَالُوا: «مَا هُوَ هَذَا ٱلْقَلِيلُ ٱلَّذِي يَقُولُ عَنْهُ؟ لَسْنَا نَعْلَمُ بِمَاذَا يَتَكَلَّمُ!».,"Jadi, mereka bertanya, “Apa yang Dia maksudkan dengan, ‘tinggal sesaat saja’? Kita tidak tahu apa yang Dia bicarakan.”","Lalu, kata mereka, “Apa yang dimaksudkan-Nya, ‘Tidak lama lagi’? Kita tidak mengerti apa yang dimaksudkan-Nya.”",
Yohanes,16,19,Yohanes 16:19,فَعَلِمَ يَسُوعُ أَنَّهُمْ كَانُوا يُرِيدُونَ أَنْ يَسْأَلُوهُ، فَقَالَ لَهُمْ: «أَعَنْ هَذَا تَتَسَاءَلُونَ فِيمَا بَيْنَكُمْ، لِأَنِّي قُلْتُ: بَعْدَ قَلِيلٍ لَا تُبْصِرُونَنِي، ثُمَّ بَعْدَ قَلِيلٍ أَيْضًا تَرَوْنَنِي,"Yesus tahu bahwa murid-murid-Nya ingin bertanya kepada-Nya, maka Dia berkata kepada mereka, “Apakah kamu bertanya di antara kamu sendiri mengenai hal yang Aku maksud ketika Aku berkata, ‘Tinggal sesaat saja dan kamu tidak akan melihat Aku lagi; dan sekali lagi, tinggal sesaat saja, dan kamu akan melihat Aku’?","Isa mengetahui bahwa mereka ingin bertanya kepada-Nya. Lalu, sabda-Nya kepada mereka, “Apakah kamu bertanya-tanya seorang kepada yang lain tentang apa yang Kukatakan tadi, ‘Tidak lama lagi kamu tidak akan melihat Aku lagi’ dan, ‘Dalam waktu yang tidak lama pula kamu akan kembali melihat Aku’?",
Yohanes,16,20,Yohanes 16:20,اَلْحَقَّ ٱلْحَقَّ أَقُولُ لَكُمْ: إِنَّكُمْ سَتَبْكُونَ وَتَنُوحُونَ وَٱلْعَالَمُ يَفْرَحُ. أَنْتُمْ سَتَحْزَنُونَ، وَلَكِنَّ حُزْنَكُمْ يَتَحَوَّلُ إِلَى فَرَحٍ.,"Dengan sesungguhnya, Aku mengatakan kepadamu, kamu akan menangis dan meratap, tetapi dunia akan bergembira; kamu akan berduka, tetapi dukacitamu akan berubah menjadi sukacita.","Sesungguhnya, Aku berkata kepadamu, kamu akan menangis dan meratap, tetapi dunia ini akan bergembira. Kamu akan berdukacita, tetapi dukacitamu itu akan berubah menjadi kegembiraan.",
Yohanes,16,21,Yohanes 16:21,اَلْمَرْأَةُ وَهِيَ تَلِدُ تَحْزَنُ لِأَنَّ سَاعَتَهَا قَدْ جَاءَتْ، وَلَكِنْ مَتَى وَلَدَتِ ٱلطِّفْلَ لَا تَعُودُ تَذْكُرُ ٱلشِّدَّةَ لِسَبَبِ ٱلْفَرَحِ، لِأَنَّهُ قَدْ وُلِدَ إِنْسَانٌ فِي ٱلْعَالَمِ.,"Ketika seorang perempuan melahirkan, dia menderita karena waktunya untuk melahirkan sudah tiba; tetapi sesudah anaknya lahir, dia lupa akan penderitaannya yang berat karena sukacita bahwa seorang manusia telah dilahirkan ke dunia.","Seorang perempuan berdukacita saat ia melahirkan. Tetapi, ketika anaknya sudah dilahirkan, ia tidak ingat lagi pada kesengsaraannya. Ia diliputi perasaan gembira sebab seorang manusia telah dilahirkan ke dalam dunia.",
Yohanes,16,22,Yohanes 16:22,فَأَنْتُمْ كَذَلِكَ، عِنْدَكُمُ ٱلْآنَ حُزْنٌ. وَلَكِنِّي سَأَرَاكُمْ أَيْضًا فَتَفْرَحُ قُلُوبُكُمْ، وَلَا يَنْزِعُ أَحَدٌ فَرَحَكُمْ مِنْكُمْ,"Demikianlah kamu juga mengalami penderitaan saat ini, tetapi Aku akan menemuimu lagi dan hatimu akan bersukacita, dan tidak ada seorang pun yang akan mengambil sukacitamu darimu.","Pada saat ini, kamu memang berdukacita. Tetapi, Aku akan menjumpai kamu lagi sehingga hatimu akan bergembira dan tak seorang pun dapat mengambil kegembiraan itu darimu.",
Yohanes,16,23,Yohanes 16:23,وَفِي ذَلِكَ ٱلْيَوْمِ لَا تَسْأَلُونَنِي شَيْئًا. اَلْحَقَّ ٱلْحَقَّ أَقُولُ لَكُمْ: إِنَّ كُلَّ مَا طَلَبْتُمْ مِنَ ٱلْآبِ بِٱسْمِي يُعْطِيكُمْ.,"Pada hari itu, kamu tidak akan menanyakan apa pun kepada-Ku. Dengan sesungguhnya, Aku mengatakan kepadamu, apa pun yang kamu minta kepada Bapa-Ku dalam nama-Ku, Ia akan memberikannya kepadamu.","Pada saat itu tidak ada satu hal pun yang akan kamu tanyakan kepada-Ku. Sesungguhnya, Aku berkata kepadamu, jika kamu meminta sesuatu kepada Sang Bapa, maka Ia akan memberikannya kepadamu dalam nama-Ku.",
Yohanes,16,24,Yohanes 16:24,إِلَى ٱلْآنَ لَمْ تَطْلُبُوا شَيْئًا بِٱسْمِي. اُطْلُبُوا تَأْخُذُوا، لِيَكُونَ فَرَحُكُمْ كَامِلًا.,"Sampai sekarang, kamu belum pernah meminta apa pun dalam nama-Ku. Mintalah, dan kamu akan menerimanya supaya sukacitamu menjadi penuh.”","Sampai sekarang, satu hal pun belum kamu minta dalam nama-Ku. Mintalah maka kamu akan menerimanya supaya kegembiraanmu menjadi sempurna.",
Yohanes,16,25,Yohanes 16:25,«قَدْ كَلَّمْتُكُمْ بِهَذَا بِأَمْثَالٍ، وَلَكِنْ تَأْتِي سَاعَةٌ حِينَ لَا أُكَلِّمُكُمْ أَيْضًا بِأَمْثَالٍ، بَلْ أُخْبِرُكُمْ عَنِ ٱلْآبِ عَلَانِيَةً.,"“Aku sudah mengatakan hal-hal ini kepadamu dengan perumpamaan; saatnya akan tiba ketika Aku tidak lagi berbicara kepadamu dengan perumpamaan, tetapi akan berbicara kepadamu dengan terus terang tentang Bapa.","Semua itu Kusampaikan kepadamu melalui kiasan. Meskipun demikian, akan tiba waktunya Aku tidak lagi berbicara melalui kiasan, melainkan dengan terus terang memberitakan kepadamu tentang Sang Bapa.",
Yohanes,16,26,Yohanes 16:26,فِي ذَلِكَ ٱلْيَوْمِ تَطْلُبُونَ بِٱسْمِي. وَلَسْتُ أَقُولُ لَكُمْ إِنِّي أَنَا أَسْأَلُ ٱلْآبَ مِنْ أَجْلِكُمْ،,"Pada hari itu, kamu akan meminta dalam nama-Ku, dan Aku tidak mengatakan kepadamu bahwa Aku mendoakannya kepada Bapa bagimu.","Pada hari itu kamu akan meminta dalam nama-Ku dan tidak Kukatakan kepadamu bahwa Aku akan meminta kepada Sang Bapa untuk kamu,",
Yohanes,16,27,Yohanes 16:27,لِأَنَّ ٱلْآبَ نَفْسَهُ يُحِبُّكُمْ، لِأَنَّكُمْ قَدْ أَحْبَبْتُمُونِي، وَآمَنْتُمْ أَنِّي مِنْ عِنْدِ ٱللهِ خَرَجْتُ.,"Sebab, Bapa sendiri mengasihi kamu karena kamu telah mengasihi Aku dan percaya bahwa Aku datang dari Bapa.",karena Sang Bapa sendiri mengasihi kamu sebab kamu sudah mengasihi Aku dan percaya bahwa Aku datang dari Sang Bapa.,
Yohanes,16,28,Yohanes 16:28,خَرَجْتُ مِنْ عِنْدِ ٱلْآبِ، وَقَدْ أَتَيْتُ إِلَى ٱلْعَالَمِ، وَأَيْضًا أَتْرُكُ ٱلْعَالَمَ وَأَذْهَبُ إِلَى ٱلْآبِ».,"Aku berasal dari Bapa dan telah datang ke dunia; sekarang, Aku akan meninggalkan dunia dan kembali kepada Bapa.”","Memang Aku datang dari Sang Bapa, lalu turun ke dunia ini. Setelah itu, Aku meninggalkan dunia ini dan kembali lagi kepada Sang Bapa.”",
Yohanes,16,29,Yohanes 16:29,قَالَ لَهُ تَلَامِيذُهُ: «هُوَذَا ٱلْآنَ تَتَكَلَّمُ عَلَانِيَةً وَلَسْتَ تَقُولُ مَثَلًا وَاحِدًا.,"Murid-murid-Nya berkata, “Nah, sekarang Engkau berbicara terus terang dan tidak menggunakan perumpamaan lagi.","Kata para pengikut Isa, “Lihatlah, sekarang Engkau menyampaikannya dengan terus terang, ya Junjungan, dan tidak lagi memakai kiasan.",
Yohanes,16,30,Yohanes 16:30,اَلْآنَ نَعْلَمُ أَنَّكَ عَالِمٌ بِكُلِّ شَيْءٍ، وَلَسْتَ تَحْتَاجُ أَنْ يَسْأَلَكَ أَحَدٌ. لِهَذَا نُؤْمِنُ أَنَّكَ مِنَ ٱللهِ خَرَجْتَ».,"Sekarang, kami tahu bahwa Engkau mengetahui segala sesuatu dan tidak perlu seseorang bertanya kepada-Mu. Karena itu, kami percaya bahwa Engkau datang dari Allah.”","Sekarang kami tahu, ya Junjungan, bahwa Engkau mengetahui segala sesuatu dan tidak perlu lagi ada yang bertanya kepada-Mu. Oleh sebab itu, kami percaya, ya Junjungan, bahwa Engkau datang dari Allah.”",
Yohanes,16,31,Yohanes 16:31,أَجَابَهُمْ يَسُوعُ: «أَلآنَ تُؤْمِنُونَ؟,"Yesus menjawab mereka, “Percayakah kamu sekarang?","Lalu, sabda Isa kepada mereka, “Sekarang kamu percaya?",
Yohanes,16,32,Yohanes 16:32,هُوَذَا تَأْتِي سَاعَةٌ، وَقَدْ أَتَتِ ٱلْآنَ، تَتَفَرَّقُونَ فِيهَا كُلُّ وَاحِدٍ إِلَى خَاصَّتِهِ، وَتَتْرُكُونَنِي وَحْدِي. وَأَنَا لَسْتُ وَحْدِي لِأَنَّ ٱلْآبَ مَعِي.,"Lihatlah! Saatnya akan datang, bahkan sudah datang bagimu untuk dicerai-beraikan, masing-masing pulang ke tempat asalnya sendiri dan akan meninggalkan Aku sendirian. Akan tetapi, Aku tidak sendiri karena Bapa bersama-Ku.","Lihatlah, tiba waktunya, bahkan sudah tiba bahwa kamu akan dicerai-beraikan ke tempatnya masing-masing dan akan meninggalkan Aku seorang diri. Meskipun begitu, Aku tidak sendirian karena Sang Bapa menyertai Aku.",
Yohanes,16,33,Yohanes 16:33,قَدْ كَلَّمْتُكُمْ بِهَذَا لِيَكُونَ لَكُمْ فِيَّ سَلَامٌ. فِي ٱلْعَالَمِ سَيَكُونُ لَكُمْ ضِيقٌ، وَلَكِنْ ثِقُوا: أَنَا قَدْ غَلَبْتُ ٱلْعَالَمَ».,"Semua ini Aku katakan kepadamu supaya di dalam Aku, kamu memiliki damai sejahtera. Di dunia, kamu akan mengalami penganiayaan, tetapi kuatkanlah hatimu! Aku telah mengalahkan dunia!”","Aku mengatakan semua ini kepadamu supaya kamu memperoleh kesentosaan di dalam Aku. Dalam dunia ini kamu akan mengalami kesusahan, tetapi teguhkanlah hatimu! Aku sudah mengalahkan dunia.”",
Yohanes,17,1,Yohanes 17:1,تَكَلَّمَ يَسُوعُ بِهَذَا وَرَفَعَ عَيْنَيْهِ نَحْوَ ٱلسَّمَاءِ وَقَالَ: «أَيُّهَا ٱلْآبُ، قَدْ أَتَتِ ٱلسَّاعَةُ. مَجِّدِ ٱبْنَكَ لِيُمَجِّدَكَ ٱبْنُكَ أَيْضًا،,"Setelah Yesus menyampaikan semua itu, Dia mengangkat pandangannya ke langit dan berkata, “Bapa, saatnya sudah tiba. Muliakanlah Anak-Mu supaya Anak-Mu juga memuliakan Engkau.","Setelah Isa menyampaikan semua itu, Ia menengadah ke langit dan bersabda, “Ya Bapa, saat yang ditentukan sudah tiba. Muliakanlah Anak-Mu ini supaya Anak-Mu juga memuliakan Engkau.",
Yohanes,17,2,Yohanes 17:2,إِذْ أَعْطَيْتَهُ سُلْطَانًا عَلَى كُلِّ جَسَدٍ لِيُعْطِيَ حَيَاةً أَبَدِيَّةً لِكُلِّ مَنْ أَعْطَيْتَهُ.,"Sama seperti Engkau telah memberikan Dia kuasa atas semua manusia supaya kepada semua yang Engkau berikan kepada-Nya, Dia dapat memberikan hidup kekal.","Engkau sudah memberi wewenang kepada-Nya atas seluruh umat manusia, dan Ia pun memberikan hidup kekal kepada semua orang yang telah Engkau serahkan kepada-Nya.",
Yohanes,17,3,Yohanes 17:3,وَهَذِهِ هِيَ ٱلْحَيَاةُ ٱلْأَبَدِيَّةُ: أَنْ يَعْرِفُوكَ أَنْتَ ٱلْإِلَهَ ٱلْحَقِيقِيَّ وَحْدَكَ وَيَسُوعَ ٱلْمَسِيحَ ٱلَّذِي أَرْسَلْتَهُ.,"Inilah hidup kekal itu, yaitu bahwa mereka mengenal Engkau, satu-satunya Allah yang benar, dan mengenal Kristus Yesus yang telah Engkau utus.","Inilah hidup yang kekal, yaitu bahwa mereka mengenal Engkau sebagai satu-satunya Allah yang benar, dan mengenal Isa Al-Masih yang telah Engkau utus.",
Yohanes,17,4,Yohanes 17:4,أَنَا مَجَّدْتُكَ عَلَى ٱلْأَرْضِ. ٱلْعَمَلَ ٱلَّذِي أَعْطَيْتَنِي لِأَعْمَلَ قَدْ أَكْمَلْتُهُ.,Aku telah memuliakan Engkau di bumi dengan menyelesaikan pekerjaan yang Engkau berikan kepada-Ku untuk dikerjakan.,Aku sudah memuliakan Engkau di bumi ini dengan menyelesaikan pekerjaan yang Engkau serahkan kepada-Ku untuk dilaksanakan.,
Yohanes,17,5,Yohanes 17:5,وَٱلْآنَ مَجِّدْنِي أَنْتَ أَيُّهَا ٱلْآبُ عِنْدَ ذَاتِكَ بِٱلْمَجْدِ ٱلَّذِي كَانَ لِي عِنْدَكَ قَبْلَ كَوْنِ ٱلْعَالَمِ.,"Dan sekarang, ya Bapa, muliakanlah Aku bersama-Mu dengan kemuliaan yang Kumiliki bersama-Mu sebelum dunia ada.","Ya Bapa, sekarang muliakanlah Aku bersama-Mu dengan kemuliaan yang telah menjadi milik-Ku dan milik-Mu sebelum dunia ini dijadikan.",
Yohanes,17,6,Yohanes 17:6,«أَنَا أَظْهَرْتُ ٱسْمَكَ لِلنَّاسِ ٱلَّذِينَ أَعْطَيْتَنِي مِنَ ٱلْعَالَمِ. كَانُوا لَكَ وَأَعْطَيْتَهُمْ لِي، وَقَدْ حَفِظُوا كَلَامَكَ.,"Aku telah menyatakan nama-Mu kepada orang-orang yang Engkau berikan kepada-Ku dari dunia ini. Mereka itu milik-Mu dan Engkau telah berikan mereka kepada-Ku, dan mereka juga telah menaati firman-Mu.",Aku sudah memperkenalkan nama-Mu kepada orang-orang yang Engkau serahkan kepada-Ku dari dunia ini. Mereka adalah milik-Mu dan Engkau menyerahkan mereka kepada-Ku. Mereka pun telah mematuhi firman-Mu.,
Yohanes,17,7,Yohanes 17:7,وَٱلْآنَ عَلِمُوا أَنَّ كُلَّ مَا أَعْطَيْتَنِي هُوَ مِنْ عِنْدِكَ،,"Sekarang, mereka tahu bahwa semua yang Engkau berikan kepada-Ku berasal dari-Mu.",Sekarang mereka tahu bahwa semua yang Engkau serahkan kepada-Ku berasal dari-Mu,
Yohanes,17,8,Yohanes 17:8,لِأَنَّ ٱلْكَلَامَ ٱلَّذِي أَعْطَيْتَنِي قَدْ أَعْطَيْتُهُمْ، وَهُمْ قَبِلُوا وَعَلِمُوا يَقِينًا أَنِّي خَرَجْتُ مِنْ عِنْدِكَ، وَآمَنُوا أَنَّكَ أَنْتَ أَرْسَلْتَنِي.,"Sebab, Aku telah memberikan kepada mereka firman yang Engkau berikan kepada-Ku, dan mereka telah menerimanya serta benar-benar mengetahui bahwa Aku berasal dari Engkau, dan mereka percaya bahwa Engkaulah yang mengutus Aku.","karena firman yang Engkau serahkan kepada-Ku sudah Kusampaikan kepada mereka dan mereka telah menerimanya. Mereka benar-benar tahu bahwa Aku berasal dari-Mu, dan mereka juga percaya bahwa Engkaulah yang telah mengutus Aku.",
