Book,Chapter,Verse,Ref,Arabic,Indonesian,KitabSuci,Notes
Keluaran,22,5,Keluaran 22:5,«إِذَا رَعَى إِنْسَانٌ حَقْلًا أَوْ كَرْمًا وَسَرَّحَ مَوَاشِيَهُ فَرَعَتْ فِي حَقْلِ غَيْرِهِ، فَمِنْ أَجْوَدِ حَقْلِهِ، وَأَجْوَدِ كَرْمِهِ يُعَوِّضُ.,"Jika seseorang membiarkan suatu ladang atau kebun anggur dimakan oleh ternaknya, lalu ternak itu dibiarkan untuk makan di ladang orang lain, dia harus membayar ganti rugi dengan hasil yang terbaik dari ladangnya sendiri atau dengan hasil yang terbaik dari kebun anggurnya sendiri.","Jika seseorang menggembalakan ternak di ladang atau di kebun anggur, dan ternak itu dibiarkannya lepas sehingga makan di ladang orang lain, maka ia harus memberikan hasil terbaik dari ladangnya dan hasil terbaik dari kebun anggurnya sebagai bayaran ganti rugi.",
Keluaran,22,6,Keluaran 22:6,إِذَا خَرَجَتْ نَارٌ وَأَصَابَتْ شَوْكًا فَٱحْتَرَقَتْ أَكْدَاسٌ أَوْ زَرْعٌ أَوْ حَقْلٌ، فَٱلَّذِي أَوْقَدَ ٱلْوَقِيدَ يُعَوِّضُ.,"Jika api menyala dan melahap semak duri sehingga timbunan jagung atau ladang itu dimakan api, orang yang menyulut api itu harus membayar ganti rugi.","Jika api menyala dan menjilat semak duri sehingga tumpukan gandum atau gandum yang belum dipotong, bahkan seluruh ladang terlalap api, maka orang yang menyalakan api itu harus membayar ganti rugi penuh.",
Keluaran,22,7,Keluaran 22:7,إِذَا أَعْطَى إِنْسَانٌ صَاحِبَهُ فِضَّةً أَوْ أَمْتِعَةً لِلْحِفْظِ، فَسُرِقَتْ مِنْ بَيْتِ ٱلْإِنْسَانِ، فَإِنْ وُجِدَ ٱلسَّارِقُ، يُعَوِّضُ بِٱثْنَيْنِ.,"Jika seseorang menitipkan uang kepada temannya untuk disimpan, lalu uang itu dicuri dari rumah orang itu dan pencurinya tertangkap, dia harus membayar ganti rugi sebesar dua kali lipat.","Jika seseorang menitipkan uang atau barang kepada kawannya, lalu uang atau barang itu dicuri dari rumah kawan itu, maka pencuri itu harus membayar ganti rugi dua kali lipat jika ia kedapatan.",
Keluaran,22,8,Keluaran 22:8,وَإِنْ لَمْ يُوجَدِ ٱلسَّارِقُ يُقَدَّمُ صَاحِبُ ٱلْبَيْتِ إِلَى ٱللهِ لِيَحْكُمَ هَلْ لَمْ يَمُدَّ يَدَهُ إِلَى مُلْكِ صَاحِبِهِ.,"Jika pencurinya tidak tertangkap, pemilik rumah itu harus dibawa ke hadapan Allah untuk mengetahui apakah dia telah mengulurkan tangannya atas barang-barang temannya itu.","Jika pencuri itu tidak didapati, maka tuan rumah harus dihadapkan ke hadirat Allah untuk diperiksa apakah ia mengulurkan tangannya mengambil barang milik kawannya atau tidak.",
Keluaran,22,9,Keluaran 22:9,فِي كُلِّ دَعْوَى جِنَايَةٍ، مِنْ جِهَةِ ثَوْرٍ أَوْ حِمَارٍ أَوْ شَاةٍ أَوْ ثَوْبٍ أَوْ مَفْقُودٍ مَا، يُقَالُ: إِنَّ هَذَا هُوَ، تُقَدَّمُ إِلَى ٱللهِ دَعْوَاهُمَا. فَٱلَّذِي يَحْكُمُ ٱللهُ بِذَنْبِهِ، يُعَوِّضُ صَاحِبَهُ بِٱثْنَيْنِ.,"Untuk segala bentuk pelanggaran, baik itu tentang sapi, tentang keledai, tentang domba, tentang pakaian, atau tentang segala sesuatu yang hilang, dia yang mengatakan bahwa barang itu miliknya, keduanya harus membawanya ke hadapan Allah. Siapa pun yang Allah nyatakan bersalah harus membayar dua kali lipat kepada temannya.","Dalam segala perkara perselisihan, entah itu tentang sapi, keledai, domba, pakaian, atau barang apa pun yang hilang jika yang seorang berkata, “Ini milikku,” maka perkara kedua orang itu harus dibawa ke hadirat Allah. Siapa yang dipersalahkan oleh Allah harus membayar ganti rugi dua kali lipat kepada kawannya.",
Keluaran,22,10,Keluaran 22:10,إِذَا أَعْطَى إِنْسَانٌ صَاحِبَهُ حِمَارًا أَوْ ثَوْرًا أَوْ شَاةً أَوْ بَهِيمَةً مَّا لِلْحِفْظِ، فَمَاتَ أَوِ ٱنْكَسَرَ أَوْ نُهِبَ وَلَيْسَ نَاظِرٌ،,"Jika seseorang menitipkan keledai, atau sapi, atau domba, atau hewan apa pun kepada temannya agar dia menjaganya, lalu hewan itu mati atau terluka, atau diambil orang tanpa ada seorang pun yang melihatnya,","Jika seseorang menitipkan kepada kawannya seekor keledai, sapi, domba, atau binatang lainnya, lalu binatang itu mati, luka, atau diambil orang tanpa ada yang melihatnya,",
Keluaran,22,11,Keluaran 22:11,فَيَمِينُ ٱلرَّبِّ تَكُونُ بَيْنَهُمَا، هَلْ لَمْ يَمُدَّ يَدَهُ إِلَى مُلْكِ صَاحِبِهِ. فَيَقْبَلُ صَاحِبُهُ. فَلَا يُعَوِّضُ.,"harus ada sumpah di antara mereka demi TUHAN bahwa dia tidak mengulurkan tangannya atas milik temannya itu, dan pemiliknya harus menerimanya, dan dia tidak perlu membayar ganti rugi.","maka haruslah diangkat sumpah demi ALLAH di antara kedua orang itu untuk menentukan apakah ia mengulurkan tangannya mengambil barang kawannya atau tidak. Sumpah itu harus diterima oleh sang pemilik, dan kawannya itu tidak usah membayar ganti rugi.",
Keluaran,22,12,Keluaran 22:12,وَإِنْ سُرِقَ مِنْ عِنْدِهِ يُعَوِّضُ صَاحِبَهُ.,"Namun, jika hewan itu benar-benar dicuri darinya, dia harus membayar ganti rugi kepada pemiliknya.","Tetapi, jika binatang itu benar-benar dicuri darinya, maka ia harus membayar ganti rugi kepada sang pemilik.",
Keluaran,22,13,Keluaran 22:13,إِنِ ٱفْتُرِسَ يُحْضِرُهُ شَهَادَةً. لَا يُعَوِّضُ عَنِ ٱلْمُفْتَرَسِ.,"Jika hewan itu benar-benar tercabik-cabik, biarlah dia membawanya sebagai bukti sehingga dia tidak perlu membayar ganti rugi atas apa yang telah tercabik-cabik itu.","Jika binatang itu benar-benar dicabik-cabik oleh binatang buas, maka ia harus membawanya sebagai bukti, dan ia tidak usah membayar ganti rugi atas binatang yang dicabik-cabik itu.",
Keluaran,22,14,Keluaran 22:14,وَإِذَا ٱسْتَعَارَ إِنْسَانٌ مِنْ صَاحِبِهِ شَيْئًا فَٱنْكَسَرَ أَوْ مَاتَ، وَصَاحِبُهُ لَيْسَ مَعَهُ، يُعَوِّضُ.,"Jika seseorang meminjam hewan apa pun dari temannya, lalu hewan itu terluka atau mati ketika pemiliknya tidak bersama dengannya, orang itu benar-benar harus membayar ganti rugi.","Jika seseorang meminjam seekor binatang dari kawannya, lalu binatang itu luka atau mati ketika pemiliknya tidak ada di situ, maka ia harus membayar ganti rugi penuh.",
Keluaran,22,15,Keluaran 22:15,وَإِنْ كَانَ صَاحِبُهُ مَعَهُ لَا يُعَوِّضُ. إِنْ كَانَ مُسْتَأْجَرًا أَتَى بِأُجْرَتِهِ.,"Namun, jika pemiliknya ada bersama dengan hewan itu, orang itu tidak perlu membayar ganti rugi. Jika hewan itu disewa, itu sudah mencakup biaya sewanya.","Jika pemiliknya ada di situ, maka ia tidak usah membayar ganti rugi. Jika binatang itu disewa, maka kerugian itu sudah termasuk dalam sewanya.",
Keluaran,22,16,Keluaran 22:16,«وَإِذَا رَاوَدَ رَجُلٌ عَذْرَاءَ لَمْ تُخْطَبْ، فَٱضْطَجَعَ مَعَهَا يَمْهُرُهَا لِنَفْسِهِ زَوْجَةً.,"Jika seorang laki-laki merayu seorang gadis yang belum bertunangan untuk tidur dengannya, dia harus membelinya sebagai istrinya.","Jika seseorang membujuk seorang anak dara yang belum bertunangan, lalu tidur dengannya, maka ia harus membayar mas kawin untuk memperistri perempuan itu.",
Keluaran,22,17,Keluaran 22:17,إِنْ أَبَى أَبُوهَا أَنْ يُعْطِيَهُ إِيَّاهَا، يَزِنُ لَهُ فِضَّةً كَمَهْرِ ٱلْعَذَارَى.,"Jika ayah gadis itu menolak untuk memberikan anaknya kepada laki-laki itu, dia harus membayar sejumlah uang berdasarkan maskawin seorang gadis.","Jika ayah perempuan itu sama sekali menolak untuk memberikan anaknya kepadanya, maka orang itu tetap harus membayarkan uang senilai mas kawin anak dara.",
Keluaran,22,18,Keluaran 22:18,لَا تَدَعْ سَاحِرَةً تَعِيشُ.,Kamu tidak boleh membiarkan seorang perempuan penyihir hidup.,Jangan kaubiarkan hidup seorang perempuan yang menjadi juru teluh.,
Keluaran,22,19,Keluaran 22:19,كُلُّ مَنِ ٱضْطَجَعَ مَعَ بَهِيمَةٍ يُقْتَلُ قَتْلًا.,Siapa pun yang bersetubuh dengan hewan harus dihukum mati.,"Siapa bersetubuh dengan seekor binatang, ia pasti dihukum mati.",
Keluaran,22,20,Keluaran 22:20,مَنْ ذَبَحَ لِآلِهَةٍ غَيْرِ ٱلرَّبِّ وَحْدَهُ، يُهْلَكُ.,"Siapa pun yang berkurban bagi ilah-ilah lain, selain bagi TUHAN semata, dia harus dibinasakan.","Siapa mempersembahkan kurban kepada dewa-dewa, dan bukan kepada ALLAH semata-mata, ia harus ditumpas.",
Keluaran,22,21,Keluaran 22:21,«وَلَا تَضْطَهِدِ ٱلْغَرِيبَ وَلَا تُضَايِقْهُ، لِأَنَّكُمْ كُنْتُمْ غُرَبَاءَ فِي أَرْضِ مِصْرَ.,Kamu tidak boleh menindas orang asing ataupun menekannya karena dahulu kamu juga adalah orang asing di tanah Mesir.,Jangan menindas seorang pendatang atau menekan dia karena kamu pun dahulu pendatang di Tanah Mesir.,
Keluaran,22,22,Keluaran 22:22,لَا تُسِيءْ إِلَى أَرْمَلَةٍ مَّا وَلَا يَتِيمٍ.,Kamu tidak boleh menganiaya seorang janda atau anak yatim.,Jangan menindas seorang janda atau seorang anak yatim.,
Keluaran,22,23,Keluaran 22:23,إِنْ أَسَأْتَ إِلَيْهِ فَإِنِّي إِنْ صَرَخَ إِلَيَّ أَسْمَعُ صُرَاخَهُ،,"Jika kamu menganiaya mereka dengan cara apa pun, lalu mereka berseru kepada-Ku, Aku akan benar-benar mendengarkan seruan mereka,","Jika engkau menindas mereka, lalu mereka berseru kepada-Ku, Aku pasti akan mendengarkan seruan mereka.",
Keluaran,22,24,Keluaran 22:24,فَيَحْمَى غَضَبِي وَأَقْتُلُكُمْ بِٱلسَّيْفِ، فَتَصِيرُ نِسَاؤُكُمْ أَرَامِلَ، وَأَوْلَادُكُمْ يَتَامَى.,"dan murka-Ku akan menyala-nyala, lalu Aku akan membunuhmu dengan pedang sehingga istri-istrimu akan menjadi janda dan anak-anakmu menjadi yatim.",Murka-Ku akan menyala-nyala dan Aku akan menewaskan kamu dengan pedang sehingga istri-istrimu menjadi janda dan anak-anakmu menjadi yatim.,
Keluaran,22,25,Keluaran 22:25,إِنْ أَقْرَضْتَ فِضَّةً لِشَعْبِي ٱلْفَقِيرِ ٱلَّذِي عِنْدَكَ فَلَا تَكُنْ لَهُ كَٱلْمُرَابِي. لَا تَضَعُوا عَلَيْهِ رِبًا.,"Jika kamu meminjamkan uang kepada umat-Ku yang miskin di antaramu, kamu tidak boleh bertindak seperti penagih utang terhadapnya dan kamu juga tidak boleh menetapkan bunga kepadanya.","Jika engkau meminjamkan uang kepada seorang dari umat-Ku yang miskin di antara kamu, jangan menjadi seorang penagih utang terhadap dia dan jangan kaubebankan bunga kepadanya.",
Keluaran,22,26,Keluaran 22:26,إِنِ ٱرْتَهَنْتَ ثَوْبَ صَاحِبِكَ فَإِلَى غُرُوبِ ٱلشَّمْسِ تَرُدُّهُ لَهُ،,"Jika kamu mengambil jubah temanmu sebagai jaminan utang, kamu harus mengembalikan itu kepadanya sebelum matahari terbenam,","Jika engkau sampai harus mengambil pakaian kawanmu sebagai gadaian, kembalikanlah pakaian itu kepadanya sebelum matahari terbenam",
Keluaran,22,27,Keluaran 22:27,لِأَنَّهُ وَحْدَهُ غِطَاؤُهُ، هُوَ ثَوْبُهُ لِجِلْدِهِ، فِي مَاذَا يَنَامُ؟ فَيَكُونُ إِذَا صَرَخَ إِلَيَّ أَنِّي أَسْمَعُ، لِأَنِّي رَؤُوفٌ.,"sebab mungkin hanya itulah penutup tubuhnya, itulah pakaian bagi kulitnya, jadi dengan apakah dia akan tidur? Lalu, akan terjadi, ketika dia berseru kepada-Ku, Aku akan mendengarkannya sebab Aku ini murah hati.","karena hanya itulah penutup dan pakaian pada tubuhnya—dengan apakah ia akan tidur? Jadi, jika ia berseru kepada-Ku, Aku akan mendengarkannya karena Aku ini maha pengasih.",
Keluaran,22,28,Keluaran 22:28,«لَا تَسُبَّ ٱللهَ، وَلَا تَلْعَنْ رَئِيسًا فِي شَعْبِكَ.,Kamu tidak boleh mengutuk Allah ataupun pemimpin bangsamu.,Jangan menghina Allah dan jangan mengutuki seorang pemimpin bangsamu.,
Keluaran,22,29,Keluaran 22:29,لَا تُؤَخِّرْ مِلْءَ بَيْدَرِكَ، وَقَطْرَ مِعْصَرَتِكَ، وَأَبْكَارَ بَنِيكَ تُعْطِينِي.,Kamu tidak boleh menangguhkan persembahan dari hasil panenmu dan hasil anggurmu. Kamu harus menyerahkan anak laki-laki sulungmu kepada-Ku.,Jangan lalai mempersembahkan hasil tuaianmu dan hasil pemerasan anggurmu. Yang sulung dari anak-anak lelakimu harus kaukhususkan bagi-Ku.,
Keluaran,22,30,Keluaran 22:30,كَذَلِكَ تَفْعَلُ بِبَقَرِكَ وَغَنَمِكَ. سَبْعَةَ أَيَّامٍ يَكُونُ مَعَ أُمِّهِ، وَفِي ٱلْيَوْمِ ٱلثَّامِنِ تُعْطِينِي إِيَّاهُ.,"Demikianlah kamu juga harus melakukannya dengan sapi-sapimu dan dengan domba-dombamu. Selama 7 hari, hewan itu akan tinggal dengan induknya, lalu kamu harus menyerahkannya kepada-Ku pada hari kedelapan.","Demikian jugalah harus kaulakukan dengan kawanan sapi dan kawanan kambing dombamu. Tujuh hari lamanya anak-anak binatang itu harus tinggal dengan induknya, tetapi pada hari kedelapan engkau harus mempersembahkannya kepada-Ku.",
Keluaran,22,31,Keluaran 22:31,وَتَكُونُونَ لِي أُنَاسًا مُقَدَّسِينَ. وَلَحْمَ فَرِيسَةٍ فِي ٱلصَّحْرَاءِ لَا تَأْكُلُوا. لِلْكِلَابِ تَطْرَحُونَهُ.,"Kamu harus menjadi umat yang kudus bagi-Ku. Sebab itu, kamu tidak boleh makan daging apa pun yang dicabik-cabik oleh binatang di padang, melainkan kamu harus melemparkannya kepada anjing.”",Jadilah orang-orang yang suci bagi-Ku. Jangan kamu makan daging yang dicabik-cabik oleh binatang liar. Campakkanlah daging itu kepada anjing.,
Keluaran,23,1,Keluaran 23:1,«لَا تَقْبَلْ خَبَرًا كَاذِبًا، وَلَا تَضَعْ يَدَكَ مَعَ ٱلْمُنَافِقِ لِتَكُونَ شَاهِدَ ظُلْمٍ.,"“Jangan menyebarkan perkataan yang sia-sia, jangan melibatkan tanganmu dengan orang jahat untuk menjadi saksi palsu baginya.",Jangan menyebarkan kabar dusta. Jangan bekerja sama dengan orang fasik dengan menjadi saksi yang tidak benar.,
Keluaran,23,2,Keluaran 23:2,لَا تَتْبَعِ ٱلْكَثِيرِينَ إِلَى فِعْلِ ٱلشَّرِّ، وَلَا تُجِبْ فِي دَعْوَى مَائِلًا وَرَاءَ ٱلْكَثِيرِينَ لِلتَّحْرِيفِ.,"Jangan kamu ikut-ikutan dengan orang banyak dalam hal melakukan kejahatan dan jangan pula kamu menjadi saksi dalam suatu perkara hukum, mengikuti kebanyakan orang, untuk menyesatkan keadilan,","Jangan ikut-ikutan orang banyak berbuat jahat. Jika engkau menjadi saksi dalam suatu perkara, jangan menyimpang dengan ikut-ikutan orang banyak memutarbalikkan hukum.",
Keluaran,23,3,Keluaran 23:3,وَلَا تُحَابِ مَعَ ٱلْمِسْكِينِ فِي دَعْوَاهُ.,dan jangan pula berpihak pada orang miskin dalam perkaranya.,Jangan memihak orang miskin dalam perkaranya.,
Keluaran,23,4,Keluaran 23:4,إِذَا صَادَفْتَ ثَوْرَ عَدُوِّكَ أَوْ حِمَارَهُ شَارِدًا، تَرُدُّهُ إِلَيْهِ.,"Jika kamu mendapati sapi musuhmu atau keledainya berkeliaran, kamu harus mengembalikannya kepada pemiliknya.","Jika engkau mendapati sapi musuhmu atau keledainya tersesat, engkau harus mengembalikan binatang itu kepadanya.",
Keluaran,23,5,Keluaran 23:5,إِذَا رَأَيْتَ حِمَارَ مُبْغِضِكَ وَاقِعًا تَحْتَ حِمْلِهِ وَعَدَلْتَ عَنْ حَلِّهِ، فَلَا بُدَّ أَنْ تَحُلَّ مَعَهُ.,"Jika kamu melihat keledai milik orang yang membencimu rebah di bawah bebannya, jangan kamu meninggalkannya, kamu harus benar-benar melepaskan bebannya.","Jika engkau melihat keledai milik orang yang membencimu rebah karena berat tanggungannya, jangan enggan menolongnya. Tolonglah orang itu dan juga keledainya.",
Keluaran,23,6,Keluaran 23:6,لَا تُحَرِّفْ حَقَّ فَقِيرِكَ فِي دَعْوَاهُ.,Jangan kamu memutarbalikkan hak orang miskin dalam perkaranya.,Jangan memutarbalikkan hak orang miskin di antaramu dalam perkaranya.,
Keluaran,23,7,Keluaran 23:7,اِبْتَعِدْ عَنْ كَلَامِ ٱلْكَذِبِ، وَلَا تَقْتُلِ ٱلْبَرِيءَ وَٱلْبَارَّ، لِأَنِّي لَا أُبَرِّرُ ٱلْمُذْنِبَ.,"Menjauhlah dari perkara yang licik, dan jangan kamu membunuh orang yang tidak bersalah atau orang yang benar sebab Aku tidak membenarkan kejahatan.",Jauhkanlah dirimu dari perkara dusta. Orang yang tak bersalah dan orang benar tidak boleh kauhukum mati karena Aku tidak akan membenarkan orang fasik.,
Keluaran,23,8,Keluaran 23:8,وَلَا تَأْخُذْ رَشْوَةً، لِأَنَّ ٱلرَّشْوَةَ تُعْمِي ٱلْمُبْصِرِينَ، وَتُعَوِّجُ كَلَامَ ٱلْأَبْرَارِ.,Jangan kamu menerima suap sebab suap dapat membutakan mata orang yang dapat melihat dan memutarbalikkan perkara orang yang benar.,Jangan menerima suap karena suap membutakan mata orang yang melihat dan memutarbalikkan perkara orang benar.,
Keluaran,23,9,Keluaran 23:9,وَلَا تُضَايِقِ ٱلْغَرِيبَ فَإِنَّكُمْ عَارِفُونَ نَفْسَ ٱلْغَرِيبِ، لِأَنَّكُمْ كُنْتُمْ غُرَبَاءَ فِي أَرْضِ مِصْرَ.,Jangan menindas orang asing. Kamu sendiri tahu rasanya menjadi orang asing sebab kamu adalah orang yang tinggal sementara di tanah Mesir.”,Seorang pendatang jangan kautekan. Kamu sendiri tahu bagaimana rasanya menjadi pendatang karena kamu pun dahulu pendatang di Tanah Mesir.,
Keluaran,23,10,Keluaran 23:10,«وَسِتَّ سِنِينَ تَزْرَعُ أَرْضَكَ وَتَجْمَعُ غَلَّتَهَا،,"“Selama 6 tahun kamu harus menabur benih di tanahmu dan akan mengumpulkan hasilnya,","Enam tahun lamanya engkau harus menabur benih di tanahmu dan mengumpulkan hasilnya,",
Keluaran,23,11,Keluaran 23:11,وَأَمَّا فِي ٱلسَّابِعَةِ فَتُرِيحُهَا وَتَتْرُكُهَا لِيَأْكُلَ فُقَرَاءُ شَعْبِكَ. وَفَضْلَتُهُمْ تَأْكُلُهَا وُحُوشُ ٱلْبَرِّيَّةِ. كَذَلِكَ تَفْعَلُ بِكَرْمِكَ وَزَيْتُونِكَ.,"tetapi pada tahun ketujuh, kamu harus membiarkannya dan meninggalkannya supaya apa pun yang ditinggalkan oleh tanah itu dapat dimakan oleh binatang di ladang. Kamu harus melakukan hal yang sama dengan kebun anggurmu dan pohon-pohon zaitunmu.","tetapi pada tahun ketujuh engkau harus membiarkannya dan meninggalkannya begitu saja supaya kaum duafa di antara bangsamu dapat makan, dan apa yang mereka sisakan dapat dimakan binatang liar. Demikian jugalah harus kauperlakukan kebun anggurmu dan kebun zaitunmu.",
Keluaran,23,12,Keluaran 23:12,سِتَّةَ أَيَّامٍ تَعْمَلُ عَمَلَكَ. وَأَمَّا ٱلْيَوْمُ ٱلسَّابِعُ فَفِيهِ تَسْتَرِيحُ، لِكَيْ يَسْتَرِيحَ ثَوْرُكَ وَحِمَارُكَ، وَيَتَنَفَّسَ ٱبْنُ أَمَتِكَ وَٱلْغَرِيبُ.,"Enam hari lamanya kamu akan mengerjakan pekerjaanmu, tetapi pada hari ketujuh kamu harus beristirahat agar sapimu dan keledaimu dapat beristirahat, begitu pula dengan anak budak perempuanmu dan orang asing agar mereka dapat beristirahat.","Enam hari lamanya engkau harus melakukan pekerjaanmu, tetapi pada hari ketujuh engkau harus berhenti. Dengan demikian, sapimu serta keledaimu dapat beristirahat dan anak hambamu perempuan serta para pendatang dapat melepas lelah.",
Keluaran,23,13,Keluaran 23:13,وَكُلُّ مَا قُلْتُ لَكُمُ ٱحْتَفِظُوا بِهِ، وَلَا تَذْكُرُوا ٱسْمَ آلِهَةٍ أُخْرَى، وَلَا يُسْمَعْ مِنْ فَمِكَ.,Perhatikanlah segala sesuatu yang telah Aku firmankan kepadamu dan jangan menyebut nama ilah-ilah lain dan jangan biarkan itu terdengar dari mulutmu!,"Camkanlah segala hal yang Kufirmankan kepadamu. Jangan menyebut nama ilah lain, dan jangan biarkan nama itu terdengar dari mulutmu.",
Keluaran,23,14,Keluaran 23:14,«ثَلَاثَ مَرَّاتٍ تُعَيِّدُ لِي فِي ٱلسَّنَةِ.,Tiga kali dalam setahun kamu harus mengadakan perayaan bagi-Ku.,Tiga kali dalam setahun engkau harus mengadakan perayaan bagi-Ku.,
Keluaran,23,15,Keluaran 23:15,تَحْفَظُ عِيدَ ٱلْفَطِيرِ. تَأْكُلُ فَطِيرًا سَبْعَةَ أَيَّامٍ كَمَا أَمَرْتُكَ فِي وَقْتِ شَهْرِ أَبِيبَ، لِأَنَّهُ فِيهِ خَرَجْتَ مِنْ مِصْرَ. وَلَا يَظْهَرُوا أَمَامِي فَارِغِينَ.,"Kamu harus memelihara perayaan Roti Tidak Beragi. Selama 7 hari kamu harus makan roti yang tidak beragi seperti yang telah Aku perintahkan kepadamu, pada waktu yang telah ditetapkan pada bulan Abib. Sebab, pada bulan itulah kamu keluar dari Mesir dan jangan ada seorang pun yang terlihat dengan tangan hampa di hadapan-Ku.","Tetaplah rayakan Hari Raya Roti Tak Beragi. Tujuh hari lamanya engkau harus makan roti yang tak beragi, seperti yang Kuperintahkan kepadamu. Hal itu harus kaulakukan pada waktu yang ditetapkan, yaitu dalam bulan Abib, karena dalam bulan itulah engkau keluar dari Mesir. Jangan seorang pun menghadap hadirat-Ku dengan tangan hampa.",
Keluaran,23,16,Keluaran 23:16,وَعِيدَ ٱلْحَصَادِ أَبْكَارِ غَلَّاتِكَ ٱلَّتِي تَزْرَعُ فِي ٱلْحَقْلِ. وَعِيدَ ٱلْجَمْعِ فِي نِهَايَةِ ٱلسَّنَةِ عِنْدَمَا تَجْمَعُ غَلَّاتِكَ مِنَ ٱلْحَقْلِ.,"Kamu juga harus memelihara hari raya Panen, yaitu hasil pertama usahamu dari apa yang kamu tabur di ladang. Rayakanlah juga hari raya Pengumpulan Hasil pada setiap akhir tahun, yaitu ketika kamu mengumpulkan hasil usahamu dari ladang.","Tetaplah rayakan Hari Raya Penuaian, yaitu penuaian hasil pertama dari apa yang telah kautabur di ladang. Selain itu, tetaplah rayakan Hari Raya Pengumpulan Hasil pada akhir tahun, saat engkau mengumpulkan hasil pekerjaanmu dari ladang.",
Keluaran,23,17,Keluaran 23:17,ثَلَاثَ مَرَّاتٍ فِي ٱلسَّنَةِ يَظْهَرُ جَمِيعُ ذُكُورِكَ أَمَامَ ٱلسَّيِّدِ ٱلرَّبِّ.,"Jadi, tiga kali dalam setahun semua laki-laki harus datang ke hadapan TUHAN Allah.",Tiga kali setahun semua laki-laki harus menghadap ke hadirat ALLAH Taala.,
Keluaran,23,18,Keluaran 23:18,لَا تَذْبَحْ عَلَى خَمِيرٍ دَمَ ذَبِيحَتِي، وَلَا يَبِتْ شَحْمُ عِيدِي إِلَى ٱلْغَدِ.,Janganlah kamu persembahkan darah kurban untuk-Ku dengan roti yang beragi. Jangan sampai lemak dari perayaan-Ku tersisa hingga pagi.,Jangan kaupersembahkan kepada-Ku darah dari kurban sembelihan bersama-sama dengan sesuatu yang beragi. Lemak kurban hari raya-Ku pun tidak boleh kaubiarkan bermalam sampai pagi.,
Keluaran,23,19,Keluaran 23:19,أَوَّلَ أَبْكَارِ أَرْضِكَ تُحْضِرُهُ إِلَى بَيْتِ ٱلرَّبِّ إِلَهِكَ. لَا تَطْبُخْ جَدْيًا بِلَبَنِ أُمِّهِ.,"Kamu harus membawa hasil pertama yang terbaik dari ladangmu ke rumah TUHAN, Allahmu. Janganlah merebus anak kambing dalam susu induknya.”","Yang terbaik dari hasil pertama tanahmu harus kaubawa ke dalam Bait ALLAH, Tuhanmu. Jangan kaurebus anak kambing dalam air susu induknya.",
Keluaran,23,20,Keluaran 23:20,«هَا أَنَا مُرْسِلٌ مَلَاكًا أَمَامَ وَجْهِكَ لِيَحْفَظَكَ فِي ٱلطَّرِيقِ، وَلِيَجِيءَ بِكَ إِلَى ٱلْمَكَانِ ٱلَّذِي أَعْدَدْتُهُ.,"“Lihatlah, Aku akan mengutus malaikat di hadapanmu untuk melindungimu dalam perjalanan dan untuk membawamu ke tempat yang telah Aku siapkan.","Sesungguhnya, Aku mengutus Malaikat-Ku berjalan di depanmu untuk melindungimu di jalan dan untuk membawamu ke tempat yang telah Kusediakan.",
Keluaran,23,21,Keluaran 23:21,اِحْتَرِزْ مِنْهُ وَٱسْمَعْ لِصَوْتِهِ وَلَا تَتَمَرَّدْ عَلَيْهِ، لِأَنَّهُ لَا يَصْفَحُ عَنْ ذُنُوبِكُمْ، لِأَنَّ ٱسْمِي فِيهِ.,"Perhatikanlah dia dan taatilah suaranya, jangan kamu memberontak terhadapnya karena dia tidak akan mengampuni pelanggaran-pelanggaranmu. Sebab, nama-Ku ada dalam dia.","Jagalah dirimu di hadapannya dan dengarkanlah sabdanya. Nama-Ku ada di dalam dia. Oleh sebab itu, jangan mendurhaka kepadanya karena ia tidak akan mengampuni pelanggaranmu.",
