Book,Chapter,Verse,Ref,Arabic,Indonesian,KitabSuci,Notes
Keluaran,12,4,Keluaran 12:4,وَإِنْ كَانَ ٱلْبَيْتُ صَغِيرًا عَنْ أَنْ يَكُونَ كُفْوًا لِشَاةٍ، يَأْخُذُ هُوَ وَجَارُهُ ٱلْقَرِيبُ مِنْ بَيْتِهِ بِحَسَبِ عَدَدِ ٱلنُّفُوسِ. كُلُّ وَاحِدٍ عَلَى حَسَبِ أُكْلِهِ تَحْسُبُونَ لِلشَّاةِ.,"Jika satu rumah terlalu sedikit jumlahnya untuk seekor domba, biarlah dia bersama tetangga yang dekat dengan rumahnya mengambil berdasarkan jumlah jiwa. Kamu harus memperkirakan domba itu berdasarkan berapa banyak yang dimakan oleh setiap orang.","Jika sebuah rumah tangga terlalu kecil untuk menghabiskan seekor anak domba, maka ia bersama tetangga yang rumahnya terdekat harus mengambil satu ekor menurut jumlah jiwa. Perkirakanlah berapa banyak anak domba yang diperlukan sesuai dengan yang dapat dimakan oleh setiap orang.",
Keluaran,12,5,Keluaran 12:5,تَكُونُ لَكُمْ شَاةً صَحِيحَةً ذَكَرًا ٱبْنَ سَنَةٍ، تَأْخُذُونَهُ مِنَ ٱلْخِرْفَانِ أَوْ مِنَ ٱلْمَوَاعِزِ.,"Dombamu itu harus tidak bercacat, jantan, dan berumur setahun, dan kamu dapat mengambilnya dari antara domba atau kambing.","Anak domba atau anak kambing itu—kamu boleh memilihnya—haruslah jantan, berumur setahun, dan tak bercacat.",
Keluaran,12,6,Keluaran 12:6,وَيَكُونُ عِنْدَكُمْ تَحْتَ ٱلْحِفْظِ إِلَى ٱلْيَوْمِ ٱلرَّابِعَ عَشَرَ مِنْ هَذَا ٱلشَّهْرِ. ثُمَّ يَذْبَحُهُ كُلُّ جُمْهُورِ جَمَاعَةِ إِسْرَائِيلَ فِي ٱلْعَشِيَّةِ.,"Kamu harus menyimpannya sampai pada hari keempat belas bulan ini. Setelah itu, seluruh jemaat Israel harus menyembelihnya pada waktu senja.","Kamu harus mengurusnya sampai hari keempat belas dalam bulan ini, lalu setelah itu seluruh jemaah Israil harus menyembelihnya pada waktu magrib.",
Keluaran,12,7,Keluaran 12:7,وَيَأْخُذُونَ مِنَ ٱلدَّمِ وَيَجْعَلُونَهُ عَلَى ٱلْقَائِمَتَيْنِ وَٱلْعَتَبَةِ ٱلْعُلْيَا فِي ٱلْبُيُوتِ ٱلَّتِي يَأْكُلُونَهُ فِيهَا.,"Kemudian, mereka harus mengambil darahnya dan mengoleskannya pada kedua tiang dan ambang pintu rumah tempat mereka memakannya.’","Darahnya harus diambil sedikit, lalu dibubuhkan pada kedua tiang pintu serta ambang atas setiap pintu rumah, tempat orang memakannya.",
Keluaran,12,8,Keluaran 12:8,وَيَأْكُلُونَ ٱللَّحْمَ تِلْكَ ٱللَّيْلَةَ مَشْوِيًّا بِٱلنَّارِ مَعَ فَطِيرٍ. عَلَى أَعْشَابٍ مُرَّةٍ يَأْكُلُونَهُ.,"‘Pada malam itu juga, mereka harus makan daging itu, yang dipanggang pada api, dan mereka harus memakannya dengan roti tidak beragi dan sayur pahit.","Dagingnya, yang sudah dipanggang di atas api, harus mereka makan malam itu juga dengan roti yang tak beragi serta sayur pahit.",
Keluaran,12,9,Keluaran 12:9,لَا تَأْكُلُوا مِنْهُ نِيئًا أَوْ طَبِيخًا مَطْبُوخًا بِٱلْمَاءِ، بَلْ مَشْوِيًّا بِٱلنَّارِ. رَأْسَهُ مَعَ أَكَارِعِهِ وَجَوْفِهِ.,"Jangan memakannya mentah-mentah atau matang karena direbus dengan air, melainkan pangganglah dengan api, baik kepalanya, dan kakinya, beserta isi perutnya.","Janganlah makan daging itu mentah-mentah atau setelah direbus dalam air, tetapi makanlah setelah dipanggang di atas api lengkap dengan kepala, kaki, dan isi perutnya.",
Keluaran,12,10,Keluaran 12:10,وَلَا تُبْقُوا مِنْهُ إِلَى ٱلصَّبَاحِ. وَٱلْبَاقِي مِنْهُ إِلَى ٱلصَّبَاحِ، تُحْرِقُونَهُ بِٱلنَّارِ.,Kamu tidak boleh menyisakannya sampai pagi. Apa pun yang tersisa dari itu sampai pagi harus kamu bakar dengan api.’,Jangan tinggalkan sisa sampai pagi. Sisa yang tertinggal sampai pagi harus kamu bakar habis.,
Keluaran,12,11,Keluaran 12:11,وَهَكَذَا تَأْكُلُونَهُ: أَحْقَاؤُكُمْ مَشْدُودَةٌ، وَأَحْذِيَتُكُمْ فِي أَرْجُلِكُمْ، وَعِصِيُّكُمْ فِي أَيْدِيكُمْ. وَتَأْكُلُونَهُ بِعَجَلَةٍ. هُوَ فِصْحٌ لِلرَّبِّ.,"‘Beginilah kamu harus memakannya, yaitu dengan pinggangmu yang dililit sabuk, dengan kasutmu di kakimu, dan dengan tongkatmu di tanganmu, dan kamu harus memakannya dengan cepat, itulah Pesakh bagi TUHAN.’","Beginilah kamu harus memakannya, yaitu dengan pinggang berikat, kaki berkasut, dan dengan tongkat di tanganmu. Kamu harus memakannya buru-buru. Itulah perayaan Paskah bagi ALLAH.",
Keluaran,12,12,Keluaran 12:12,فَإِنِّي أَجْتَازُ فِي أَرْضِ مِصْرَ هَذِهِ ٱللَّيْلَةَ، وَأَضْرِبُ كُلَّ بِكْرٍ فِي أَرْضِ مِصْرَ مِنَ ٱلنَّاسِ وَٱلْبَهَائِمِ. وَأَصْنَعُ أَحْكَامًا بِكُلِّ آلِهَةِ ٱلْمِصْرِيِّينَ. أَنَا ٱلرَّبُّ.,"‘Pada malam itu, Aku akan melintasi seluruh tanah Mesir dan akan memukul setiap anak sulung di tanah Mesir, baik itu manusia maupun binatang, dan Aku akan menjatuhkan penghakiman atas seluruh ilah Mesir. Akulah TUHAN.","Pada malam itu juga, Aku akan melintasi Tanah Mesir dan menewaskan semua anak sulung di Tanah Mesir, dari anak manusia sampai anak binatang. Semua ilah orang Mesir akan Kujatuhi hukuman. Akulah ALLAH.",
Keluaran,12,13,Keluaran 12:13,وَيَكُونُ لَكُمُ ٱلدَّمُ عَلَامَةً عَلَى ٱلْبُيُوتِ ٱلَّتِي أَنْتُمْ فِيهَا، فَأَرَى ٱلدَّمَ وَأَعْبُرُ عَنْكُمْ، فَلَا يَكُونُ عَلَيْكُمْ ضَرْبَةٌ لِلْهَلَاكِ حِينَ أَضْرِبُ أَرْضَ مِصْرَ.,"Darah itu akan menjadi tanda bagimu pada rumah tempat kamu tinggal. Ketika Aku melihat darah itu, Aku akan melewatkan rumahmu agar tidak ada bencana yang akan menimpamu dan membinasakanmu ketika Aku memukul tanah Mesir.’","Darah itu akan menjadi tanda bagimu di rumah-rumah yang kamu tinggali. Apabila Aku melihat darah itu, maka Aku akan melewati kamu sehingga tidak akan ada tulah kemusnahan di antara kamu saat Aku mengazab Tanah Mesir.",
Keluaran,12,14,Keluaran 12:14,وَيَكُونُ لَكُمْ هَذَا ٱلْيَوْمُ تَذْكَارًا فَتُعَيِّدُونَهُ عِيدًا لِلرَّبِّ. فِي أَجْيَالِكُمْ تُعَيِّدُونَهُ فَرِيضَةً أَبَدِيَّةً.,"‘Hari ini akan menjadi hari peringatan bagimu dan kamu harus memeliharanya sebagai suatu hari raya bagi TUHAN, turun-temurun. Kamu harus memeliharanya sebagai suatu ketetapan untuk selama-lamanya.","Hari ini akan menjadi hari yang harus kamu peringati. Kamu harus merayakannya turun-temurun sebagai hari raya bagi ALLAH, dan hal ini menjadi ketetapan yang berlaku untuk seterusnya.",
Keluaran,12,15,Keluaran 12:15,«سَبْعَةَ أَيَّامٍ تَأْكُلُونَ فَطِيرًا. ٱلْيَوْمَ ٱلْأَوَّلَ تَعْزِلُونَ ٱلْخَمِيرَ مِنْ بُيُوتِكُمْ، فَإِنَّ كُلَّ مَنْ أَكَلَ خَمِيرًا مِنَ ٱلْيَوْمِ ٱلْأَوَّلِ إِلَى ٱلْيَوْمِ ٱلسَّابِعِ تُقْطَعُ تِلْكَ ٱلنَّفْسُ مِنْ إِسْرَائِيلَ.,"Selama tujuh hari kamu harus makan roti tidak beragi, tetapi pada hari pertama kamu harus menyingkirkan ragi dari rumahmu. Karena siapa pun yang makan sesuatu yang beragi sejak hari pertama sampai hari ketujuh, nyawanya harus dilenyapkan dari Israel.","Kamu harus makan roti yang tak beragi tujuh hari lamanya. Pada hari pertama, buanglah ragi dari rumahmu karena siapa pun makan sesuatu yang beragi dari hari pertama sampai hari ketujuh, ia harus disingkirkan dari Israil.",
Keluaran,12,16,Keluaran 12:16,وَيَكُونُ لَكُمْ فِي ٱلْيَوْمِ ٱلْأَوَّلِ مَحْفَلٌ مُقَدَّسٌ، وَفِي ٱلْيَوْمِ ٱلسَّابِعِ مَحْفَلٌ مُقَدَّسٌ. لَا يُعْمَلُ فِيهِمَا عَمَلٌ مَا إِلَّا مَا تَأْكُلُهُ كُلُّ نَفْسٍ، فَذَلِكَ وَحْدَهُ يُعْمَلُ مِنْكُمْ.,"Pada hari pertama akan ada pertemuan kudus, begitu pula pada hari ketujuh akan ada pertemuan kudus bagimu. Tidak ada pekerjaan yang boleh dilakukan pada hari-hari itu. Apa yang perlu dimakan oleh setiap orang, hanya itulah yang boleh kamu siapkan.","Pada hari pertama adakanlah ibadah berjemaah, demikian pula pada hari ketujuh. Pada hari-hari itu tidak boleh dilakukan pekerjaan apa pun, kecuali mempersiapkan makanan yang harus dimakan oleh setiap orang.",
Keluaran,12,17,Keluaran 12:17,وَتَحْفَظُونَ ٱلْفَطِيرَ لِأَنِّي فِي هَذَا ٱلْيَوْمِ عَيْنِهِ أَخْرَجْتُ أَجْنَادَكُمْ مِنْ أَرْضِ مِصْرَ، فَتَحْفَظُونَ هَذَا ٱلْيَوْمَ فِي أَجْيَالِكُمْ فَرِيضَةً أَبَدِيَّةً.,"Kamu harus tetap memelihara hari raya Roti Tidak Beragi sebab tepat pada hari itu Aku telah membawa pasukanmu keluar dari tanah Mesir. Karena itu, kamu harus memelihara hari ini turun-temurun sebagai ketetapan untuk selama-lamanya.","Rayakanlah selalu Hari Raya Roti Tak Beragi karena tepat pada hari ini, Aku membawa rombonganmu keluar dari Tanah Mesir. Sebab itu, rayakanlah selalu hari ini turun-temurun sebagai suatu ketetapan yang berlaku untuk seterusnya.",
Keluaran,12,18,Keluaran 12:18,فِي ٱلشَّهْرِ ٱلْأَوَّلِ، فِي ٱلْيَوْمِ ٱلرَّابِعَ عَشَرَ مِنَ ٱلشَّهْرِ، مَسَاءً، تَأْكُلُونَ فَطِيرًا إِلَى ٱلْيَوْمِ ٱلْحَادِي وَٱلْعِشْرِينَ مِنَ ٱلشَّهْرِ مَسَاءً.,"Dalam bulan pertama, pada hari keempat belas bulan itu, kamu harus makan roti tidak beragi sampai pada hari kedua puluh satu bulan itu, pada waktu sore.","Mulai dari petang hari di hari keempat belas bulan pertama, makanlah roti yang tidak beragi sampai pada petang hari di hari kedua puluh satu bulan itu juga.",
Keluaran,12,19,Keluaran 12:19,سَبْعَةَ أَيَّامٍ لَا يُوجَدْ خَمِيرٌ فِي بُيُوتِكُمْ. فَإِنَّ كُلَّ مَنْ أَكَلَ مُخْتَمِرًا تُقْطَعُ تِلْكَ ٱلنَّفْسُ مِنْ جَمَاعَةِ إِسْرَائِيلَ، ٱلْغَرِيبُ مَعَ مَوْلُودِ ٱلْأَرْضِ.,"Selama tujuh hari tidak boleh ada ragi yang didapati dalam rumahmu. Karena siapa pun makan sesuatu yang beragi, nyawanya akan dilenyapkan dari antara jemaat Israel, baik orang asing atau penduduk asli negeri itu.","Tujuh hari lamanya tidak boleh ada ragi dalam rumahmu karena siapa pun makan sesuatu yang beragi, ia harus disingkirkan dari antara jemaah Israil, baik pendatang maupun warga asli.",
Keluaran,12,20,Keluaran 12:20,لَا تَأْكُلُوا شَيْئًا مُخْتَمِرًا. فِي جَمِيعِ مَسَاكِنِكُمْ تَأْكُلُونَ فَطِيرًا».,"Kamu tidak boleh makan apa pun yang beragi. Di seluruh tempat tinggalmu, kamu harus makan roti tidak beragi.’”",Apa pun yang beragi tidak boleh kamu makan. Di seluruh tempat tinggalmu kamu harus makan roti yang tak beragi.’”,
Keluaran,12,21,Keluaran 12:21,فَدَعَا مُوسَى جَمِيعَ شُيُوخِ إِسْرَائِيلَ وَقَالَ لَهُمُ: «ٱسْحَبُوا وَخُذُوا لَكُمْ غَنَمًا بِحَسَبِ عَشَائِرِكُمْ وَٱذْبَحُوا ٱلْفِصْحَ.,"Kemudian, Musa memanggil semua tua-tua Israel dan berkata kepada mereka, “Pilihlah dan ambillah domba berdasarkan keluargamu dan sembelihlah domba Pesakh itu.","Kemudian, Musa memanggil semua tua-tua Israil dan berkata kepada mereka, “Pergilah, ambillah anak domba bagi kaum keluargamu, dan sembelihlah domba Paskah.",
Keluaran,12,22,Keluaran 12:22,وَخُذُوا بَاقَةَ زُوفَا وَٱغْمِسُوهَا فِي ٱلدَّمِ ٱلَّذِي فِي ٱلطَّسْتِ وَمُسُّوا ٱلْعَتَبَةَ ٱلْعُلْيَا وَٱلْقَائِمَتَيْنِ بِٱلدَّمِ ٱلَّذِي فِي ٱلطَّسْتِ. وَأَنْتُمْ لَا يَخْرُجْ أَحَدٌ مِنْكُمْ مِنْ بَابِ بَيْتِهِ حَتَّى ٱلصَّبَاحِ،,"Ambillah seikat hisop dan celupkan itu ke dalam darah di sebuah baskom. Lalu, oleslah ambang pintu dan dua tiangnya dengan darah di baskom itu. Tidak ada seorang pun yang boleh keluar dari pintu rumah sampai pagi,","Ambillah seikat ranting hisop, celupkan dalam darah yang telah ditempatkan dalam sebuah mangkuk, lalu sapukanlah darah itu pada ambang atas pintu serta kedua tiang pintu rumah. Tak seorang pun dari antara kamu boleh keluar dari pintu rumahnya sampai pagi hari,",
Keluaran,12,23,Keluaran 12:23,فَإِنَّ ٱلرَّبَّ يَجْتَازُ لِيَضْرِبَ ٱلْمِصْرِيِّينَ. فَحِينَ يَرَى ٱلدَّمَ عَلَى ٱلْعَتَبَةِ ٱلْعُلْيَا وَٱلْقَائِمَتَيْنِ يَعْبُرُ ٱلرَّبُّ عَنِ ٱلْبَابِ وَلَا يَدَعُ ٱلْمُهْلِكَ يَدْخُلُ بُيُوتَكُمْ لِيَضْرِبَ.,"sebab TUHAN akan melintas untuk memukul orang Mesir, dan ketika Dia melihat darah pada ambang pintu dan pada dua tiangnya, TUHAN akan melewatkan pintu itu dan tidak akan mengizinkan si pembinasa masuk ke dalam rumahmu untuk memukulmu.","karena ALLAH akan melintas untuk mengazab orang Mesir. Apabila Ia melihat darah pada ambang atas pintu serta kedua tiang pintu sebuah rumah, maka ALLAH akan melewati pintu itu dan tidak membiarkan pemusnah masuk ke dalam rumahmu untuk mengazab kamu.",
Keluaran,12,24,Keluaran 12:24,فَتَحْفَظُونَ هَذَا ٱلْأَمْرَ فَرِيضَةً لَكَ وَلِأَوْلَادِكَ إِلَى ٱلْأَبَدِ.,Kamu harus memelihara hal ini sebagai ketetapan bagimu dan anak-anakmu untuk selamanya.,Lakukanlah hal ini setiap kali dan jadikan sebagai suatu ketetapan bagimu serta bagi anak-anakmu sampai seterusnya.,
Keluaran,12,25,Keluaran 12:25,وَيَكُونُ حِينَ تَدْخُلُونَ ٱلْأَرْضَ ٱلَّتِي يُعْطِيكُمُ ٱلرَّبُّ كَمَا تَكَلَّمَ، أَنَّكُمْ تَحْفَظُونَ هَذِهِ ٱلْخِدْمَةَ.,"Saat kamu memasuki negeri yang akan diberikan TUHAN kepadamu, seperti yang telah dijanjikan-Nya, kamu harus tetap memelihara ibadah ini.","Jadi, apabila kamu telah memasuki negeri yang akan dikaruniakan ALLAH kepadamu seperti yang difirmankan-Nya, kamu harus tetap memegang ibadah ini.",
Keluaran,12,26,Keluaran 12:26,وَيَكُونُ حِينَ يَقُولُ لَكُمْ أَوْلَادُكُمْ: مَا هَذِهِ ٱلْخِدْمَةُ لَكُمْ؟,"Apabila anak-anakmu bertanya kepadamu, ‘Apa arti ibadah ini bagimu?’","Nanti, apabila anak-anakmu bertanya kepadamu, ‘Apa arti ibadah ini bagi Ayah?’",
Keluaran,12,27,Keluaran 12:27,أَنَّكُمْ تَقُولُونَ: هِيَ ذَبِيحَةُ فِصْحٍ لِلرَّبِّ ٱلَّذِي عَبَرَ عَنْ بُيُوتِ بَنِي إِسْرَائِيلَ فِي مِصْرَ لَمَّا ضَرَبَ ٱلْمِصْرِيِّينَ وَخَلَّصَ بُيُوتَنَا». فَخَرَّ ٱلشَّعْبُ وَسَجَدُوا.,"kamu harus menjawab, ‘Ini adalah kurban Pesakh bagi TUHAN yang melewatkan rumah keturunan Israel di Mesir ketika Dia memukul orang Mesir, tetapi meluputkan rumah kami.’” Lalu, umat itu bersujud dan menyembah.","maka kamu harus menjawab, ‘Ini adalah kurban Paskah bagi ALLAH. Ketika ALLAH mengazab orang Mesir, Ia melewatkan rumah-rumah bani Israil di Mesir dan menyelamatkan rumah-rumah kita.’” Lalu, bangsa itu pun membungkuk dan sujud menyembah.",
Keluaran,12,28,Keluaran 12:28,وَمَضَى بَنُو إِسْرَائِيلَ وَفَعَلُوا كَمَا أَمَرَ ٱلرَّبُّ مُوسَى وَهَارُونَ. هَكَذَا فَعَلُوا.,"Kemudian, keturunan Israel pergi dan melaksanakannya, sebagaimana yang telah diperintahkan TUHAN kepada Musa dan Harun, demikianlah mereka melaksanakannya.","Kemudian, pergilah bani Israil, melaksanakan apa yang diperintahkan ALLAH kepada Musa dan Harun.",
Keluaran,12,29,Keluaran 12:29,فَحَدَثَ فِي نِصْفِ ٱللَّيْلِ أَنَّ ٱلرَّبَّ ضَرَبَ كُلَّ بِكْرٍ فِي أَرْضِ مِصْرَ، مِنْ بِكْرِ فِرْعَوْنَ ٱلْجَالِسِ عَلَى كُرْسِيِّهِ إِلَى بِكْرِ ٱلْأَسِيرِ ٱلَّذِي فِي ٱلسِّجْنِ، وَكُلَّ بِكْرِ بَهِيمَةٍ.,"Terjadilah, pada tengah malam, TUHAN memukul semua anak sulung di tanah Mesir, mulai dari anak sulung Firaun yang duduk di takhtanya, sampai anak sulung para tahanan yang berada di penjara, dan juga setiap anak sulung ternak.","Pada tengah malam ALLAH menewaskan semua anak sulung di Tanah Mesir, dari anak sulung Firaun yang duduk di atas takhta sampai anak sulung para tawanan yang ada dalam penjara bawah tanah, juga semua anak sulung binatang.",
Keluaran,12,30,Keluaran 12:30,فَقَامَ فِرْعَوْنُ لَيْلًا هُوَ وَكُلُّ عَبِيدِهِ وَجَمِيعُ ٱلْمِصْرِيِّينَ. وَكَانَ صُرَاخٌ عَظِيمٌ فِي مِصْرَ، لِأَنَّهُ لَمْ يَكُنْ بَيْتٌ لَيْسَ فِيهِ مَيْتٌ.,"Pada malam itu, Firaun bangun, dia, dan semua hambanya, dan seluruh orang Mesir. Lalu, terdengarlah jerit tangis yang dahsyat di Mesir sebab tidak ada satu pun rumah yang tidak ada kematian.","Maka, bangunlah Firaun pada malam itu, demikian pula semua pegawainya dan semua orang Mesir. Lalu, terdengarlah tangisan yang hebat di Mesir karena tidak ada rumah yang tidak kematian.",
Keluaran,12,31,Keluaran 12:31,فَدَعَا مُوسَى وَهَارُونَ لَيْلًا وَقَالَ: «قُومُوا ٱخْرُجُوا مِنْ بَيْنِ شَعْبِي أَنْتُمَا وَبَنُو إِسْرَائِيلَ جَمِيعًا، وَٱذْهَبُوا ٱعْبُدُوا ٱلرَّبَّ كَمَا تَكَلَّمْتُمْ.,"Pada malam itu juga, Firaun memanggil Musa dan Harun, lalu berkata, “Bangkitlah, keluarlah kamu dari antara rakyatku, baik kamu maupun keturunan Israel, dan pergi, layanilah TUHAN seperti katamu itu.","Pada malam itu juga Firaun memanggil Musa dan Harun, katanya, “Segeralah keluar dari tengah-tengah rakyatku, baik kamu maupun bani Israil! Pergilah, beribadahlah kepada ALLAH seperti katamu itu.",
Keluaran,12,32,Keluaran 12:32,خُذُوا غَنَمَكُمْ أَيْضًا وَبَقَرَكُمْ كَمَا تَكَلَّمْتُمْ وَٱذْهَبُوا. وَبَارِكُونِي أَيْضًا».,"Bawa juga kawanan dombamu dan ternakmu seperti katamu itu, pergilah, dan berkatilah juga aku.”","Bawalah pula kawanan kambing domba dan kawanan sapimu seperti katamu itu, lalu pergilah. Mohonkanlah juga berkah bagiku.”",
Keluaran,12,33,Keluaran 12:33,وَأَلَحَّ ٱلْمِصْرِيُّونَ عَلَى ٱلشَّعْبِ لِيُطْلِقُوهُمْ عَاجِلًا مِنَ ٱلْأَرْضِ، لِأَنَّهُمْ قَالُوا: «جَمِيعُنَا أَمْوَاتٌ».,"Orang Mesir pun mendesak bangsa itu dan menyuruh mereka keluar dari negeri itu sesegera mungkin sebab mereka berkata, “Kami semua bisa mati.”","Orang Mesir pun mendesak bangsa itu untuk pergi dengan segera dari negeri itu karena kata mereka, “Nanti kami semua mati.”",
Keluaran,12,34,Keluaran 12:34,فَحَمَلَ ٱلشَّعْبُ عَجِينَهُمْ قَبْلَ أَنْ يَخْتَمِرَ، وَمَعَاجِنُهُمْ مَصْرُورَةٌ فِي ثِيَابِهِمْ عَلَى أَكْتَافِهِمْ.,"Kemudian, bangsa itu mengangkat adonan yang belum beragi beserta tempat adonannya yang dibungkus dengan pakaiannya ke atas bahu mereka.","Kemudian, bangsa itu mengambil wadah-wadah berisi adonan yang belum diragi, lalu membungkusnya dengan pakaian dan memikulnya di atas bahu mereka.",
Keluaran,12,35,Keluaran 12:35,وَفَعَلَ بَنُو إِسْرَائِيلَ بِحَسَبِ قَوْلِ مُوسَى. طَلَبُوا مِنَ ٱلْمِصْرِيِّينَ أَمْتِعَةَ فِضَّةٍ وَأَمْتِعَةَ ذَهَبٍ وَثِيَابًا.,"Keturunan Israel juga telah melaksanakan yang dikatakan Musa, yaitu mereka meminta barang-barang perak, barang-barang emas, dan pakaian dari orang Mesir.","Bani Israil juga melaksanakan apa yang dikatakan oleh Musa. Mereka meminta dari orang Mesir barang-barang perak, barang-barang emas, dan pakaian.",
Keluaran,12,36,Keluaran 12:36,وَأَعْطَى ٱلرَّبُّ نِعْمَةً لِلشَّعْبِ فِي عُيُونِ ٱلْمِصْرِيِّينَ حَتَّى أَعَارُوهُمْ. فَسَلَبُوا ٱلْمِصْرِيِّينَ.,TUHAN memberikan kepada bangsa ini kemurahan hati di mata orang Mesir sehingga orang Mesir memberi yang mereka minta. Demikianlah mereka merampasi orang Mesir.,ALLAH membuat orang Mesir berbaik hati kepada bangsa itu sehingga permintaan mereka dipenuhi. Demikianlah mereka merampasi orang Mesir.,
Keluaran,12,37,Keluaran 12:37,فَٱرْتَحَلَ بَنُو إِسْرَائِيلَ مِنْ رَعَمْسِيسَ إِلَى سُكُّوتَ، نَحْوَ سِتِّ مِئَةِ أَلْفِ مَاشٍ مِنَ ٱلرِّجَالِ عَدَا ٱلْأَوْلَادِ.,"Keturunan Israel berangkat dari Raamses ke Sukot, sekitar 600.000 laki-laki yang berjalan kaki, belum termasuk anak-anak.","Setelah itu, berangkatlah bani Israil dari Raamses menuju Sukot. Jumlah orang yang berjalan kaki kira-kira enam ratus ribu laki-laki, belum termasuk anak-anak.",
Keluaran,12,38,Keluaran 12:38,وَصَعِدَ مَعَهُمْ لَفِيفٌ كَثِيرٌ أَيْضًا مَعَ غَنَمٍ وَبَقَرٍ، مَوَاشٍ وَافِرَةٍ جِدًّا.,"Banyak bangsa campuran yang juga pergi bersama mereka, beserta kawanan domba, kawanan sapi, dan ternak yang sangat banyak.","Juga banyak orang dari berbagai bangsa ikut pergi bersama mereka, di samping ternak yang sangat banyak jumlahnya, baik kawanan kambing domba maupun kawanan sapi.",
Keluaran,12,39,Keluaran 12:39,وَخَبَزُوا ٱلْعَجِينَ ٱلَّذِي أَخْرَجُوهُ مِنْ مِصْرَ خُبْزَ مَلَّةٍ فَطِيرًا، إِذْ كَانَ لَمْ يَخْتَمِرْ. لِأَنَّهُمْ طُرِدُوا مِنْ مِصْرَ وَلَمْ يَقْدِرُوا أَنْ يَتَأَخَّرُوا، فَلَمْ يَصْنَعُوا لِأَنْفُسِهِمْ زَادًا.,"Kemudian, mereka memanggang adonan yang mereka bawa dari Mesir menjadi roti tidak beragi sebab mereka diusir dari Mesir dan tidak boleh berlambat-lambat. Mereka juga tidak sempat menyiapkan bekal bagi diri mereka.",Mereka membakar roti bundar yang tak beragi dari adonan yang mereka bawa dari Mesir. Adonan itu memang belum beragi karena mereka diusir dari Mesir dan tidak boleh berlambat-lambat. Mereka juga tidak sempat menyediakan bekal untuk keperluan mereka.,
Keluaran,12,40,Keluaran 12:40,وَأَمَّا إِقَامَةُ بَنِي إِسْرَائِيلَ ٱلَّتِي أَقَامُوهَا فِي مِصْرَ فَكَانَتْ أَرْبَعَ مِئَةٍ وَثَلَاثِينَ سَنَةً.,"Lamanya keturunan Israel tinggal sementara, yaitu ketika mereka tinggal di Mesir adalah 430 tahun.",Empat ratus tiga puluh tahun lamanya bani Israil tinggal di Mesir.,
Keluaran,12,41,Keluaran 12:41,وَكَانَ عِنْدَ نِهَايَةِ أَرْبَعِ مِئَةٍ وَثَلَاثِينَ سَنَةً، فِي ذَلِكَ ٱلْيَوْمِ عَيْنِهِ، أَنَّ جَمِيعَ أَجْنَادِ ٱلرَّبِّ خَرَجَتْ مِنْ أَرْضِ مِصْرَ.,"Pada akhir 430 tahun, pada hari itu, seluruh pasukan TUHAN keluar dari tanah Mesir.","Setelah lewat empat ratus tiga puluh tahun, tepat pada hari itu, keluarlah seluruh rombongan umat ALLAH dari Tanah Mesir.",
Keluaran,12,42,Keluaran 12:42,هِيَ لَيْلَةٌ تُحْفَظُ لِلرَّبِّ لِإِخْرَاجِهِ إِيَّاهُمْ مِنْ أَرْضِ مِصْرَ. هَذِهِ ٱللَّيْلَةُ هِيَ لِلرَّبِّ. تُحْفَظُ مِنْ جَمِيعِ بَنِي إِسْرَائِيلَ فِي أَجْيَالِهِمْ.,"Ini adalah malam yang harus diperingati bagi TUHAN karena telah membawa mereka keluar dari tanah Mesir. Malam ini adalah malam bagi TUHAN, untuk diperingati oleh seluruh keturunan Israel, turun-temurun.",Malam itu adalah malam yang harus diperingati bagi ALLAH karena Ia telah membawa mereka keluar dari Tanah Mesir. Itulah malam yang harus diperingati oleh seluruh bani Israil bagi ALLAH turun-temurun.,
