Book,Chapter,Verse,Ref,Arabic,Indonesian,KitabSuci,Notes
Keluaran,30,12,Keluaran 30:12,«إِذَا أَخَذْتَ كَمِّيَّةَ بَنِي إِسْرَائِيلَ بِحَسَبِ ٱلْمَعْدُودِينَ مِنْهُمْ، يُعْطُونَ كُلُّ وَاحِدٍ فِدْيَةَ نَفْسِهِ لِلرَّبِّ عِنْدَمَا تَعُدُّهُمْ، لِئَلَّا يَصِيرَ فِيهِمْ وَبَأٌ عِنْدَمَا تَعُدُّهُمْ.,"“Ketika kamu mengadakan sensus bagi keturunan Israel untuk menghitung mereka, setiap orang dari mereka harus memberikan pendamaian bagi dirinya sendiri kepada TUHAN ketika kamu menghitung mereka supaya tidak ada wabah di antara mereka ketika kamu menghitungnya.","“Pada waktu engkau mendaftarkan bani Israil dan menghitung jumlahnya, mereka masing-masing harus mempersembahkan uang tebusan dirinya di hadirat ALLAH saat mereka didaftarkan supaya jangan ada tulah di antara mereka.",
Keluaran,30,13,Keluaran 30:13,هَذَا مَا يُعْطِيهِ كُلُّ مَنِ ٱجْتَازَ إِلَى ٱلْمَعْدُودِينَ: نِصْفُ ٱلشَّاقِلِ بِشَاقِلِ ٱلْقُدْسِ. ٱلشَّاقِلُ هُوَ عِشْرُونَ جِيرَةً. نِصْفُ ٱلشَّاقِلِ تَقْدِمَةً لِلرَّبِّ.,"Setiap orang yang dihitung pada sensus tersebut harus memberi ini: 0,5 syikal menurut syikal tempat kudus, berat 1 syikal adalah 20 gera, 0,5 syikal itu sebagai persembahan bagi TUHAN.",Setiap orang yang turut didaftarkan harus mempersembahkan setengah syikal menurut syikal resmi Kemah Suci yang beratnya dua puluh gera. Setengah syikal itu adalah persembahan khusus bagi ALLAH.,
Keluaran,30,14,Keluaran 30:14,كُلُّ مَنِ ٱجْتَازَ إِلَى ٱلْمَعْدُودِينَ مِنِ ٱبْنِ عِشْرِينَ سَنَةً فَصَاعِدًا يُعْطِي تَقْدِمَةً لِلرَّبِّ.,"Setiap orang yang dihitung, yaitu yang berusia 20 tahun ke atas, harus memberikan persembahan kepada TUHAN.","Setiap orang yang turut didaftarkan, yaitu mereka yang berumur dua puluh tahun ke atas, harus memberikan persembahan khusus itu kepada ALLAH.",
Keluaran,30,15,Keluaran 30:15,اَلْغَنِيُّ لَا يُكَثِّرُ وَٱلْفَقِيرُ لَا يُقَلِّلُ عَنْ نِصْفِ ٱلشَّاقِلِ حِينَ تُعْطُونَ تَقْدِمَةَ ٱلرَّبِّ لِلتَّكْفِيرِ عَنْ نُفُوسِكُمْ.,"Orang kaya tidak boleh memberi lebih banyak, dan orang miskin tidak boleh memberi lebih sedikit dari 0,5 syikal, ketika mereka memberikan persembahan kepada TUHAN untuk mengadakan pendamaian atas jiwamu.","Ketika kamu memberikan persembahan khusus itu kepada ALLAH demi pendamaian dirimu dengan-Nya, janganlah orang kaya mempersembahkan lebih dari setengah syikal itu dan janganlah orang miskin mempersembahkan kurang dari jumlah itu.",
Keluaran,30,16,Keluaran 30:16,وَتَأْخُذُ فِضَّةَ ٱلْكَفَّارَةِ مِنْ بَنِي إِسْرَائِيلَ، وَتَجْعَلُهَا لِخِدْمَةِ خَيْمَةِ ٱلِٱجْتِمَاعِ. فَتَكُونُ لِبَنِي إِسْرَائِيلَ تَذْكَارًا أَمَامَ ٱلرَّبِّ لِلتَّكْفِيرِ عَنْ نُفُوسِكُمْ».,"Kamu harus mengambil uang pendamaian itu dari bangsa Israel dan harus memberikannya untuk pelayanan tenda pertemuan supaya itu menjadi peringatan bagi keturunan Israel di hadapan TUHAN, yaitu untuk mengadakan pendamaian bagi jiwamu.”",Terimalah uang pendamaian itu dari bani Israil dan gunakanlah untuk peribadatan dalam Kemah Hadirat Allah sehingga itu menjadi tanda pengingat akan bani Israil di hadirat ALLAH demi pendamaian dirimu dengan-Nya.”,
Keluaran,30,17,Keluaran 30:17,وَكَلَّمْ ٱلرَّبُّ مُوسَى قَائِلًا:,"Kemudian, TUHAN berfirman kepada Musa,","ALLAH berfirman kepada Musa,",
Keluaran,30,18,Keluaran 30:18,«وَتَصْنَعُ مِرْحَضَةً مِنْ نُحَاسٍ، وَقَاعِدَتَهَا مِنْ نُحَاسٍ، لِلِٱغْتِسَالِ. وَتَجْعَلُهَا بَيْنَ خَيْمَةِ ٱلِٱجْتِمَاعِ وَٱلْمَذْبَحِ، وَتَجْعَلُ فِيهَا مَاءً.,"“Kamu harus membuat sebuah bejana perunggu untuk membasuh dengan alasnya yang terbuat dari perunggu, dan kamu harus meletakkannya di antara tenda pertemuan dan mazbah, lalu kamu harus memasukkan air ke dalamnya.","“Buatlah sebuah bejana dari tembaga dengan alas dari tembaga juga sebagai tempat membasuh. Taruhlah bejana itu di antara Kemah Hadirat Allah dengan mazbah, yaitu tempat pembakaran kurban, dan tuanglah air ke dalamnya.",
Keluaran,30,19,Keluaran 30:19,فَيَغْسِلُ هَارُونُ وَبَنُوهُ أَيْدِيَهُمْ وَأَرْجُلَهُمْ مِنْهَا.,Harun dan anak-anaknya harus mencuci tangan dan kaki mereka dengan air dari bejana ini.,Di situlah Harun dan anak-anaknya harus membasuh tangan dan kaki mereka.,
Keluaran,30,20,Keluaran 30:20,عِنْدَ دُخُولِهِمْ إِلَى خَيْمَةِ ٱلِٱجْتِمَاعِ يَغْسِلُونَ بِمَاءٍ لِئَلَّا يَمُوتُوا، أَوْ عِنْدَ ٱقْتِرَابِهِمْ إِلَى ٱلْمَذْبَحِ لِلْخِدْمَةِ لِيُوقِدُوا وَقُودًا لِلرَّبِّ.,"Ketika mereka masuk ke tenda pertemuan, mereka harus dibasuh dengan air supaya mereka tidak mati, atau ketika mereka mendekati mazbah untuk melayani, yaitu untuk membakar persembahan dengan api kepada TUHAN,","Sebelum mereka masuk ke dalam Kemah Hadirat Allah, mereka harus dibasuh dengan air supaya jangan mereka mati. Demikian pula halnya ketika mereka menghampiri mazbah untuk menyelenggarakan peribadatan dengan membakar kurban bagi ALLAH,",
Keluaran,30,21,Keluaran 30:21,يَغْسِلُونَ أَيْدِيَهُمْ وَأَرْجُلَهُمْ لِئَلَّا يَمُوتُوا. وَيَكُونُ لَهُمْ فَرِيضَةً أَبَدِيَّةً لَهُ وَلِنَسْلِهِ فِي أَجْيَالِهِمْ».,"mereka harus membasuh tangan mereka dan kaki mereka supaya mereka tidak mati. Ini akan menjadi peraturan yang berlaku selamanya bagi Harun dan keturunannya, turun-temurun.”","mereka harus membasuh tangan dan kaki mereka supaya jangan mereka mati. Ketetapan itu berlaku untuk seterusnya bagi mereka, yaitu bagi Harun dan bagi keturunannya turun-temurun.”",
Keluaran,30,22,Keluaran 30:22,وَكَلَّمَ ٱلرَّبُّ مُوسَى قَائِلًا:,"Kemudian, TUHAN berkata kepada Musa,","ALLAH berfirman kepada Musa,",
Keluaran,30,23,Keluaran 30:23,«وَأَنْتَ تَأْخُذُ لَكَ أَفْخَرَ ٱلْأَطْيَابِ: مُرًّا قَاطِرًا خَمْسَ مِئَةِ شَاقِلٍ، وَقِرْفَةً عَطِرَةً نِصْفَ ذَلِكَ: مِئَتَيْنِ وَخَمْسِينَ، وَقَصَبَ ٱلذَّرِيرَةِ مِئَتَيْنِ وَخَمْسِينَ،,"“Ambillah rempah-rempah yang terbaik: 500 syikal minyak mur, dan kayu manis harum sebanyak setengah dari itu, yaitu 250 syikal, dan 250 syikal tebu yang baik,","“Ambillah rempah-rempah yang terbaik: 500 syikal damar wangi cair, separuh jumlah tadi (250 syikal) kayu manis harum, 250 syikal tebu wangi,",
Keluaran,30,24,Keluaran 30:24,وَسَلِيخَةً خَمْسَ مِئَةٍ بِشَاقِلِ ٱلْقُدْسِ، وَمِنْ زَيْتِ ٱلزَّيْتُونِ هِينًا.,"dan 500 syikal kasia menurut syikal kudus, dan 1 hin minyak zaitun.",kulit lawang 500 syikal—semuanya menurut syikal resmi Kemah Suci—serta minyak zaitun satu hin.,
Keluaran,30,25,Keluaran 30:25,وَتَصْنَعُهُ دُهْنًا مُقَدَّسًا لِلْمَسْحَةِ. عِطْرَ عِطَارَةٍ صَنْعَةَ ٱلْعَطَّارِ. دُهْنًا مُقَدَّسًا لِلْمَسْحَةِ يَكُونُ.,"Kamu harus membuat minyak urapan kudus dari semua bahan itu, suatu campuran rempah-rempah yang dibuat oleh seorang ahli wewangian. Itulah yang akan menjadi minyak urapan kudus.","Dari semua itu buatlah minyak upacara yang suci, yaitu suatu campuran yang selayaknya dihasilkan oleh juru rempah-rempah. Campuran itu haruslah menjadi minyak upacara yang suci.",
Keluaran,30,26,Keluaran 30:26,وَتَمْسَحُ بِهِ خَيْمَةَ ٱلِٱجْتِمَاعِ، وَتَابُوتَ ٱلشَّهَادَةِ،,"Lalu, dengan itu kamu harus mengurapi tenda pertemuan dan tabut kesaksian,","Dengan campuran itu minyakilah Kemah Hadirat Allah, tabut loh hukum,",
Keluaran,30,27,Keluaran 30:27,وَٱلْمَائِدَةَ وَكُلَّ آنِيَتِهَا، وَٱلْمَنَارَةَ وَآنِيَتَهَا، وَمَذْبَحَ ٱلْبَخُورِ،,"meja dan segala perkakasnya, kaki dian dan segala perkakasnya, dan mazbah dupa,","meja dengan segala perlengkapannya, kaki pelita dengan segala perlengkapannya, mazbah pembakaran dupa,",
Keluaran,30,28,Keluaran 30:28,وَمَذْبَحَ ٱلْمُحْرَقَةِ وَكُلَّ آنِيَتِهِ، وَٱلْمِرْحَضَةَ وَقَاعِدَتَهَا.,"mazbah persembahan bakaran dan segala perkakasnya, dan bejana pembasuhan dengan alasnya.","mazbah kurban bakaran dengan segala perlengkapannya, dan bejana pembasuhan dengan alasnya.",
Keluaran,30,29,Keluaran 30:29,وَتُقَدِّسُهَا فَتَكُونُ قُدْسَ أَقْدَاسٍ. كُلُّ مَا مَسَّهَا يَكُونُ مُقَدَّسًا.,Kamu harus menguduskan semua itu sehingga semuanya menjadi mahakudus. Segala sesuatu yang menyentuh barang-barang itu juga akan menjadi kudus.,Sucikanlah semua itu sehingga menjadi teramat suci. Apa pun yang menyentuhnya akan menjadi suci.,
Keluaran,30,30,Keluaran 30:30,وَتَمْسَحُ هَارُونَ وَبَنِيهِ وَتُقَدِّسُهُمْ لِيَكْهَنُوا لِي.,Kamu juga harus mengurapi Harun dan anak-anaknya dan menguduskan mereka supaya mereka dapat melayani-Ku sebagai imam.,Minyakilah Harun dan anak-anaknya dan sucikanlah mereka supaya mereka dapat menunaikan tugas sebagai imam bagi-Ku.,
Keluaran,30,31,Keluaran 30:31,وَتُكَلِّمُ بَنِي إِسْرَائِيلَ قَائِلًا: يَكُونُ هَذَا لِي دُهْنًا مُقَدَّسًا لِلْمَسْحَةِ فِي أَجْيَالِكُمْ.,"Kamu harus mengatakan kepada keturunan Israel begini, ‘Ini akan menjadi minyak urapan kudus untuk seluruh keturunanmu.","Katakanlah kepada bani Israil, ‘Inilah minyak upacara yang suci bagi-Ku di antara kamu turun-temurun.",
Keluaran,30,32,Keluaran 30:32,عَلَى جَسَدِ إِنْسَانٍ لَا يُسْكَبُ، وَعَلَى مَقَادِيرِهِ لَا تَصْنَعُوا مِثْلَهُ. مُقَدَّسٌ هُوَ، وَيَكُونُ مُقَدَّسًا عِنْدَكُمْ.,"Minyak itu tidak boleh dicurahkan atas tubuh orang-orang biasa. Juga, jangan membuat tiruan dari minyak ini sebab ini kudus dan haruslah itu kudus bagi kamu.",Jangan curahkan minyak itu pada tubuh orang biasa dan jangan buat minyak yang sama campurannya. Minyak itu suci dan harus kaupandang suci.,
Keluaran,30,33,Keluaran 30:33,كُلُّ مَنْ رَكَّبَ مِثْلَهُ وَمَنْ جَعَلَ مِنْهُ عَلَى أَجْنَبِيٍّ يُقْطَعُ مِنْ شَعْبِهِ».,"Siapa pun membuat yang seperti itu atau siapa pun yang mengoleskannya pada orang biasa, harus dilenyapkan dari antara bangsanya.’”",Orang yang membuat campuran minyak seperti ini atau yang mengoleskannya pada orang awam harus disingkirkan dari antara bangsanya.’”,
Keluaran,30,34,Keluaran 30:34,وَقَالَ ٱلرَّبُّ لِمُوسَى: «خُذْ لَكَ أَعْطَارًا: مَيْعَةً وَأَظْفَارًا وَقِنَّةً عَطِرَةً وَلُبَانًا نَقِيًّا. تَكُونُ أَجْزَاءً مُتَسَاوِيَةً،,"TUHAN berkata kepada Musa, “Ambillah rempah-rempah yang harum ini bagimu: getah damar, kulit lokan, getah rasamala, dan dupa murni. Jumlah masing-masing haruslah sama.","ALLAH berfirman kepada Musa, “Ambillah rempah-rempah yang harum, yaitu getah damar wangi, kulit lokan, dan rasamala, juga kemenyan yang murni, masing-masing sama banyaknya.",
Keluaran,30,35,Keluaran 30:35,فَتَصْنَعُهَا بَخُورًا عَطِرًا صَنْعَةَ ٱلْعَطَّارِ، مُمَلَّحًا نَقِيًّا مُقَدَّسًا.,"Dari semua itu, kamu harus membuat dupa, suatu wangi-wangian, yang dikerjakan oleh ahli wewangian, lalu garamilah agar murni dan kudus.","Dari semua itu buatlah dupa campuran seperti buatan seorang juru rempah-rempah, lalu garamilah agar tetap murni dan suci.",
Keluaran,30,36,Keluaran 30:36,وَتَسْحَقُ مِنْهُ نَاعِمًا، وَتَجْعَلُ مِنْهُ قُدَّامَ ٱلشَّهَادَةِ فِي خَيْمَةِ ٱلِٱجْتِمَاعِ حَيْثُ أَجْتَمِعُ بِكَ. قُدْسَ أَقْدَاسٍ يَكُونُ عِنْدَكُمْ.,"Kamu harus menumbuk sebagian dupa itu hingga halus dan meletakkannya di depan tenda pertemuan, tempat Aku akan bertemu denganmu. Itu harus menjadi mahakudus bagimu.","Tumbuklah halus-halus sebagian dari dupa campuran itu dan taruhlah di depan tabut loh hukum dalam Kemah Hadirat Allah, tempat Aku akan menjumpaimu. Tumbukan dupa campuran yang halus itu harus kaupandang teramat suci.",
Keluaran,30,37,Keluaran 30:37,وَٱلْبَخُورُ ٱلَّذِي تَصْنَعُهُ عَلَى مَقَادِيرِهِ لَا تَصْنَعُوا لِأَنْفُسِكُمْ. يَكُونُ عِنْدَكَ مُقَدَّسًا لِلرَّبِّ.,"Dupa yang kamu buat itu tidak boleh kamu buat dengan takaranmu sendiri. Itu harus kudus bagimu, untuk TUHAN.",Jangan pernah buat campuran dupa seperti itu bagi dirimu sendiri. Engkau harus memandangnya sebagai sesuatu yang suci bagi ALLAH.,
Keluaran,30,38,Keluaran 30:38,كُلُّ مَنْ صَنَعَ مِثْلَهُ لِيَشُمَّهُ يُقْطَعُ مِنْ شَعْبِهِ».,"Siapa pun yang membuat yang seperti itu sebagai wewangian, harus dilenyapkan dari bangsanya.”",Orang yang membuat dupa seperti itu untuk menikmati wanginya harus disingkirkan dari bangsanya.”,
Keluaran,31,1,Keluaran 31:1,وَكَلَّمَ ٱلرَّبُّ مُوسَى قَائِلًا:,"Kemudian, TUHAN berfirman kepada Musa, firman-Nya,","ALLAH berfirman kepada Musa,",
Keluaran,31,2,Keluaran 31:2,«اُنْظُرْ. قَدْ دَعَوْتُ بَصَلْئِيلَ بْنَ أُورِي بْنَ حُورَ مِنْ سِبْطِ يَهُوذَا بِٱسْمِهِ،,"“Lihat, Aku telah memanggil nama Bezaleel, anak Uri, anak Hur, dari suku Yehuda,","“Lihat, Aku telah memanggil Bezaleel bin Uri bin Hur, dari suku Yuda.",
Keluaran,31,3,Keluaran 31:3,وَمَلَأْتُهُ مِنْ رُوحِ ٱللهِ بِٱلْحِكْمَةِ وَٱلْفَهْمِ وَٱلْمَعْرِفَةِ وَكُلِّ صَنْعَةٍ،,"dan Aku telah memenuhinya dengan Roh Allah dalam hal hikmat, dan pengertian, dan pengetahuan, dan bermacam-macam keahlian","Telah Kupenuhi dia dengan Ruh Allah, dengan hikmat, pengertian, pengetahuan, dan segala kepandaian",
Keluaran,31,4,Keluaran 31:4,لِٱخْتِرَاعِ مُخْتَرَعَاتٍ لِيَعْمَلَ فِي ٱلذَّهَبِ وَٱلْفِضَّةِ وَٱلنُّحَاسِ،,"untuk membuat berbagai rancangan dari emas, perak, dan perunggu,","untuk merancang pengerjaan emas, perak, dan tembaga,",
Keluaran,31,5,Keluaran 31:5,وَنَقْشِ حِجَارَةٍ لِلتَّرْصِيعِ، وَنِجَارَةِ ٱلْخَشَبِ، لِيَعْمَلَ فِي كُلِّ صَنْعَةٍ.,"dan dalam hal mengasah permata untuk pahatannya, dan dalam hal mengukir kayu untuk mengerjakan bermacam-macam keahlian.","juga untuk mengukir permata tatahan, mengukir kayu, serta mengerjakan segala macam pekerjaan.",
Keluaran,31,6,Keluaran 31:6,وَهَا أَنَا قَدْ جَعَلْتُ مَعَهُ أُهُولِيآبَ بْنَ أَخِيسَامَاكَ مِنْ سِبْطِ دَانَ. وَفِي قَلْبِ كُلِّ حَكِيمِ ٱلْقَلْبِ جَعَلْتُ حِكْمَةً، لِيَصْنَعُوا كُلَّ مَا أَمَرْتُكَ:,"Lihatlah, Aku juga telah menetapkan seseorang untuk menyertainya, yaitu Aholiab, anak Ahisamakh, dari suku Dan. Bahkan, Aku telah memberikan keahlian kepada semua pekerja lainnya supaya mereka dapat membuat segala sesuatu yang telah Kuperintahkan kepadamu, yaitu:","Aku pun telah menetapkan orang untuk menyertainya, yaitu Aholiab bin Ahisamakh dari suku Dan. Selain itu, Aku telah mengaruniakan hikmat di dalam hati semua ahli. Mereka harus membuat semua yang telah Kuperintahkan kepadamu:",
Keluaran,31,7,Keluaran 31:7,خَيْمَةَ ٱلِٱجْتِمَاعِ، وَتَابُوتَ ٱلشَّهَادَةِ، وَٱلْغِطَاءَ ٱلَّذِي عَلَيْهِ، وَكُلَّ آنِيَةِ ٱلْخَيْمَةِ،,"Tenda pertemuan, tabut kesaksian, tutup pendamaian di atasnya, dan semua perlengkapan tenda;","Kemah Hadirat Allah, tabut loh hukum dan tutupnya di atasnya, yaitu tempat pendamaian, dan segala perlengkapan kemah itu,",
Keluaran,31,8,Keluaran 31:8,وَٱلْمَائِدَةَ وَآنِيَتَهَا، وَٱلْمَنَارَةَ ٱلطَّاهِرَةَ وَكُلَّ آنِيَتِهَا، وَمَذْبَحَ ٱلْبَخُورِ،,"meja dan perkakasnya, kaki dian dari emas murni dan segala perkakasnya, mazbah pembakaran dupa,","yaitu meja dengan perlengkapannya, kaki pelita dari emas tulen dengan segala perlengkapannya, mazbah pembakaran dupa,",
Keluaran,31,9,Keluaran 31:9,وَمَذْبَحَ ٱلْمُحْرَقَةِ وَكُلَّ آنِيَتِهِ، وَٱلْمِرْحَضَةَ وَقَاعِدَتَهَا،,"mazbah kurban bakaran dan segala perkakasnya, bejana pembasuhan dan alasnya,","mazbah kurban bakaran dengan segala perlengkapannya, bejana pembasuhan dengan alasnya,",
Keluaran,31,10,Keluaran 31:10,وَٱلثِّيَابَ ٱلْمَنْسُوجَةَ، وَٱلثِّيَابَ ٱلْمُقَدَّسَةَ لِهَارُونَ ٱلْكَاهِنِ وَثِيَابَ بَنِيهِ لِلْكَهَانَةِ،,"pakaian khusus untuk Harun dan anak-anaknya apabila mereka melayani sebagai imam,","pakaian yang halus tenunannya, pakaian suci untuk Imam Harun dan pakaian anak-anaknya untuk menunaikan tugas sebagai imam,",
Keluaran,31,11,Keluaran 31:11,وَدُهْنَ ٱلْمَسْحَةِ وَٱلْبَخُورَ ٱلْعَطِرَ لِلْقُدْسِ. حَسَبَ كُلِّ مَا أَمَرْتُكَ بِهِ يَصْنَعُونَ».,"minyak urapan yang harum, dan dupa yang harum untuk Ruang Kudus. Mereka harus membuat semua itu sebagaimana yang Aku perintahkan kepadamu.”","minyak upacara, serta dupa dari rempah-rempah harum untuk tempat suci. Mereka harus membuatnya sesuai dengan semua yang telah Kuperintahkan kepadamu.”",
Keluaran,31,12,Keluaran 31:12,وَكَلَّمَ ٱلرَّبُّ مُوسَى قَائِلًا:,"TUHAN berfirman kepada Musa, firman-Nya,","ALLAH berfirman kepada Musa,",
Keluaran,31,13,Keluaran 31:13,«وَأَنْتَ تُكَلِّمُ بَنِي إِسْرَائِيلَ قَائِلًا: سُبُوتِي تَحْفَظُونَهَا، لِأَنَّهُ عَلَامَةٌ بَيْنِي وَبَيْنَكُمْ فِي أَجْيَالِكُمْ لِتَعْلَمُوا أَنِّي أَنَا ٱلرَّبُّ ٱلَّذِي يُقَدِّسُكُمْ،,"“Katakanlah kepada bangsa Israel, begini, ‘Kamu harus sungguh-sungguh memelihara sabat-sabat-Ku sebab itu adalah tanda antara Aku dan kamu bagi keturunanmu supaya kamu mengetahui bahwa Akulah, TUHAN, yang telah menguduskan kamu.","“Katakanlah kepada bani Israil, ‘Kamu harus memelihara hari-hari Sabat-Ku karena itulah tanda pengingat antara Aku dengan kamu turun-temurun supaya kamu tahu bahwa Akulah ALLAH yang menyucikan kamu.",
Keluaran,31,14,Keluaran 31:14,فَتَحْفَظُونَ ٱلسَّبْتَ لِأَنَّهُ مُقَدَّسٌ لَكُمْ. مَنْ دَنَّسَهُ يُقْتَلُ قَتْلًا. إِنَّ كُلَّ مَنْ صَنَعَ فِيهِ عَمَلًا تُقْطَعُ تِلْكَ ٱلنَّفْسُ مِنْ بَيْنِ شَعْبِهَا.,"Oleh sebab itu, kamu harus memelihara hari Sabat karena itu adalah hari yang kudus bagimu. Setiap orang yang mencemarkannya harus dihukum mati sebab siapa saja yang bekerja saat itu, orang itu harus dilenyapkan dari antara bangsanya.","Oleh sebab itu, peliharalah hari Sabat. Hari Sabat adalah hari yang suci bagimu. Siapa yang mencemarinya, pastilah dihukum mati karena siapa pun yang melakukan pekerjaan pada hari itu, nyawanya harus dilenyapkan dari antara bangsanya.",
Keluaran,31,15,Keluaran 31:15,سِتَّةَ أَيَّامٍ يُصْنَعُ عَمَلٌ، وَأَمَّا ٱلْيَوْمُ ٱلْسَّابِعُ فَفِيهِ سَبْتُ عُطْلَةٍ مُقَدَّسٌ لِلرَّبِّ. كُلُّ مَنْ صَنَعَ عَمَلًا فِي يَوْمِ ٱلسَّبْتِ يُقْتَلُ قَتْلًا.,"Selama enam hari kamu boleh bekerja, tetapi hari ketujuh adalah hari Sabat, hari peristirahatan yang kudus bagi TUHAN. Siapa pun yang bekerja pada hari Sabat harus dihukum mati.","Enam hari lamanya orang harus melakukan pekerjaannya, tetapi hari ketujuh adalah hari Sabat, hari istirahat penuh, suci bagi ALLAH. Siapa pun yang melakukan pekerjaan pada hari Sabat, ia pasti dihukum mati.",
Keluaran,31,16,Keluaran 31:16,فَيَحْفَظُ بَنُو إِسْرَائِيلَ ٱلسَّبْتَ لِيَصْنَعُوا ٱلسَّبْتَ فِي أَجْيَالِهِمْ عَهْدًا أَبَدِيًّا.,"Sebab itu, bangsa Israel harus memelihara Sabat untuk merayakan Sabat, turun-temurun, sebagai suatu perjanjian untuk selamanya.","Sebab itu, bani Israil harus memelihara hari Sabat dengan merayakannya turun-temurun sebagai suatu perjanjian untuk seterusnya.",
Keluaran,31,17,Keluaran 31:17,هُوَ بَيْنِي وَبَيْنَ بَنِي إِسْرَائِيلَ عَلَامَةٌ إِلَى ٱلْأَبَدِ. لِأَنَّهُ فِي سِتَّةِ أَيَّامٍ صَنَعَ ٱلرَّبُّ ٱلسَّمَاءَ وَٱلْأَرْضَ، وَفِي ٱلْيَوْمِ ٱلسَّابِعِ ٱسْتَرَاحَ وَتَنَفَّسَ».,"Itu adalah tanda antara Aku dan keturunan Israel selama-lamanya. Sebab, selama enam hari TUHAN bekerja menciptakan langit dan bumi, dan pada hari ketujuh Dia berhenti dan beristirahat.”","Itulah tanda pengingat antara Aku dengan bani Israil untuk selama-lamanya karena enam hari lamanya ALLAH menjadikan langit dan bumi, dan pada hari ketujuh Ia berhenti mencipta serta merasa puas.’”",
Keluaran,31,18,Keluaran 31:18,ثُمَّ أَعْطَى مُوسَى عِنْدَ فَرَاغِهِ مِنَ ٱلْكَلَامِ مَعَهُ فِي جَبَلِ سِينَاءَ لَوْحَيِ ٱلشَّهَادَةِ: لَوْحَيْ حَجَرٍ مَكْتُوبَيْنِ بِإِصْبِعِ ٱللهِ.,"Setelah TUHAN selesai berbicara kepada Musa di Gunung Sinai, Dia memberikan kepadanya dua loh batu, yang bertuliskan hukum-hukum yang ditulis dengan jari Allah sendiri.","Setelah ALLAH selesai berfirman kepada Musa di Gunung Sinai, diserahkan-Nya kepada Musa kedua loh hukum Allah, yaitu loh batu yang ditulisi ALLAH sendiri.",
Keluaran,32,1,Keluaran 32:1,وَلَمَّا رَأَى ٱلشَّعْبُ أَنَّ مُوسَى أَبْطَأَ فِي ٱلنُّزُولِ مِنَ ٱلْجَبَلِ، ٱجْتَمَعَ ٱلشَّعْبُ عَلَى هَارُونَ وَقَالُوا لَهُ: «قُمِ ٱصْنَعْ لَنَا آلِهَةً تَسِيرُ أَمَامَنَا، لِأَنَّ هَذَا مُوسَى ٱلرَّجُلَ ٱلَّذِي أَصْعَدَنَا مِنْ أَرْضِ مِصْرَ، لَا نَعْلَمُ مَاذَا أَصَابَهُ».,"Ketika bangsa Israel melihat bahwa Musa menunda untuk turun dari gunung, bangsa itu berkumpul untuk datang kepada Harun dan berkata kepadanya, “Ayo, buatlah ilah bagi kami yang akan berjalan di depan kami, sebab Musa, orang yang telah membawa kami keluar dari tanah Mesir, kami tidak tahu yang terjadi atasnya.”","Ketika bangsa Israil melihat bahwa Musa belum juga turun dari gunung itu, berkumpullah mereka mengerumuni Harun dan berkata kepadanya, “Ayo, buatlah bagi kami berhala yang akan memimpin kami karena kami tidak tahu apa yang terjadi pada Musa, orang yang telah menuntun kami keluar dari Tanah Mesir itu.”",
Keluaran,32,2,Keluaran 32:2,فَقَالَ لَهُمْ هَارُونُ: «ٱنْزِعُوا أَقْرَاطَ ٱلذَّهَبِ ٱلَّتِي فِي آذَانِ نِسَائِكُمْ وَبَنِيكُمْ وَبَنَاتِكُمْ وَآتُونِي بِهَا».,"Lalu, Harun berkata kepada mereka, “Lepaskanlah semua anting-anting emas yang ada di telinga istrimu, anak laki-lakimu, dan anak perempuanmu, lalu bawalah itu kepadaku.”","Lalu, Harun berkata kepada mereka, “Tanggalkanlah anting-anting emas yang ada pada telinga istrimu, anak laki-lakimu, dan anak perempuanmu. Bawalah semua itu kepadaku.”",
Keluaran,32,3,Keluaran 32:3,فَنَزَعَ كُلُّ ٱلشَّعْبِ أَقْرَاطَ ٱلذَّهَبِ ٱلَّتِي فِي آذَانِهِمْ وَأَتَوْا بِهَا إِلَى هَارُونَ.,"Oleh karena itu, seluruh bangsa itu melepas anting-anting emas yang ada di telinga mereka dan membawanya kepada Harun.","Maka, seluruh bangsa itu menanggalkan anting-anting emas yang ada pada telinga mereka dan membawanya kepada Harun.",
